,tweet
29592,국민의힘 윤창현 변호사비 대납의혹 이재명 뇌물수수 혐의 고발 수원지검에 고발장 제출 쌍방울 전환사채 둘러싼 자금흐름 의혹 1r9OWl2oYJ
29594,국민의힘 변호사비 대납 의혹 이재명 후보 뇌물수수 혐의로 고발 출처 강원일보 네이버 뉴스 vEv3XmrGDw
29595,이재명 후보는 문제가 단 1도 없는데 국힘당과 언론이 이간질 하고 있고 국민은 그 이간질에 넘어가서 제대로 된 후보를 알아보지 못하는 우매함을 보이고 있다 난 그렇게 밖에 해석이 안되네 이런 거 쓸 시간에 지지율을 높이려면 뭘 어떻게 해야할 지 진지하게 제대로 고민해요 남탓 좀 그만하고
29603,이재명 전국민 지원금 철회 방식 대상 고집않겠다 전문 다음뉴스 Xn3ltdrFly 이탄희 황운하 런하더니 이재명이 철회 지금 캠프는 난파선 분위기겠다
29610,만약에 윤석열이 코바나컨텐츠를 통해 3자뇌물을 받았다면 그리고 마누라와 장모의 범죄를 적극적으로 비호했다면 이재명이 화천대유와 코나아이의 실소유주라면 이게 사실일 가능성이 매우 큽니다 전국민이 들고 일어나서 두놈을 감옥에 보내야 합니다 반드시 
29611,전국민재난지원금이 사실상 소상공인과 자영업자 지원을 막는 걸림돌이 되는 상황을 먼저 타개해야겠다는 고육지책이다 여야가 협의가능한 타협안을 제시하기 위해 자신의 주장을 철회하는 것이 쉬운 일이 아니지만 이런 게 없는 길을 만들면서 가는 이재명의 일하는 방식으로 보면 될 것 같다
29615,국민의힘 윤창현 변호사비 대납의혹 이재명 뇌물수수 혐의 고발 다음 뉴스 uuoRaccZBQ
29617, 속보 문재인 대통령 국정수행 지지율 5 상승해 44 를 기록하자 이재명 전 국민 재난지원금 고집 않겠다 고 급격히 입장 선회하고 꼬리 내림 이재명 깨갱 1KiHZJkbcE
29620,그때그때 상황에 따라 달라지는 말 본인의 신념도 없이 오직 유불리로만 상황을 판단하는 모습이 안타깝다 대통령후보가 이래도 되나 2보 이재명 전국민 재난지원금 고집하지 않겠다 사실상 철회 매일경제 7rzUeNP03n
29624, 속보 이재명 전국민 지원금 주장 철회 지원대상 방식 고집않겠다 출처 네이버 뉴스 6SD01DUt6z 전국민 재난지원금 주장하다 역풍부니까 중단한다고 한다 말 뒤집고 거짓말이 일상인 이재명을 누가 신뢰 하겠냐 민주당은 후보 교체하라
29626,이재명의 고소 고발 사건이 추가 되었습니다 고소 고발 풍년이 들었습니다 뭐 이딴 후보가 있는지 모르겠습니다 국민의힘이 이재명의 변호사비 대납 의혹과 관련해 수원지검에 뇌물수수 허위사실공표 청탁금지법 위반 국회증언감정법 위반 위증 혐의로 고발 하였습니다 WL6wNoGuLO
29631,윤석열 36 vs 이재명 35 다자대결서 격차 1 p차로 좁혀져 3DWW1mrIYx 글쎄 여론조사 믿기도 힘든데 사실이면 선대위 구성에서 삐걱거리는 소리가 자주 들리기 때문일듯 우쨋든 국민의 미래를 힘들게 하는 사기꾼은 안된다 
29632, 속보 이재명 전 국민 재난지원금 철회 지원 방식 대상 고집 않겠다 자세한내용은 2oP3nm15xp
29634,박스권에서 벋어날 가망이 없구만 MBN 여론조사 이재명 33 3 vs 윤석열 47 7 국민 절반은 동시특검 찬성 다음 뉴스 q4Kew9A0RP
29635, 속보 이재명 전 국민 재난지원금 철회 지원 방식 대상 고집 않겠다 출처 SBS 네이버 뉴스 in1gE2ZZoj KHFkp4fQWi
29641,대다수 국민도 반대하고 정부도 난색을 표하는데 이재명과 송영길이 북치고 장구치다가 철회 발표 금권선거 하려다가 지지율만 떨어지고 lt 이재명 대장동 게이트 gt 이슈를 막으려는 전략도 안먹히고 찢무리의 총체적 난국 후보교체
29644,정말로 국민을 개돼지로 아는 이재명 캠프 우롱도 하루이틀이지 OgdWIuVOzI
29650,MBN과 매일경제는 여론조사업체 알앤써치와 함께 지난 11월 15일부터 사흘간 13차 ARS 여론조사를 진행했다 5자대결 윤석열 14 4 p 차 우위 이재명 더불어민주당 후보라는 응답이 33 3 윤석열 국민의힘 후보는 47 7 로 윤 후보가 14 4 p 차로 크게 앞섰다 TACbmcGYnc RIJ2fsaEU2
29655, yonhaptweet 이재명 지원방식 대상 고집 않겠다 전국민 재난지원금 철회 재난지원금은 소비를 진작시켜 성장을 견인하는 경제정책인데 경제에 무지한 것 홍남기 이 난동을 부린 탓이다 한편 나라가 디비진다 국정원 해킹사건 빨간 마티즈 에 연루된 박근혜가 직무유기 혐의로 7월 12일 대검에 피소됐다 
29659, 2보 이재명 전국민 재난지원금 고집하지 않겠다 사실상 철회 9J9cilB8Qy 더불어민주당 이재명 대선후보는 18일 전 국민 재난지원금을 고집하지 않겠다 고 밝혔습니다 
29668,이재명 버티는 홍남기에 칼뺐다 기재부서 예산 뗄 것 후보자 주제에 마치 대통령이라도 된듯 발언하는 것은 경우에도 안맞는 무례다 푼수떼기 짓을 민주당에 거들어달라고 한다면 거절하는것이 맞다 조폭스런 인성의 불량함이 제도로 나타나면 국민의 삶이 위험해진다 
29673, 속보 이재명 전국민 재난지원금 선회 지원방식 대상 고집않겠다 다음 뉴스 CeTflmRURk
29676, 속보 이재명 전국민 재난지원금 철회 지원방식 대상 고집않겠다 SvcGTm4agl
29681, 속보 이재명 전국민 재난지원금 여 야 합의 가능한 것 부터 방식 대상 고집 안해 다음 뉴스 tNaAoadK0B
29683,홍남기와 기재부에 사과부터 해 속보 이재명 전국민 재난지원금 철회 지원방식 대상 고집않겠다 다음 뉴스 s4Ph8hroMP
29684,국민의힘 윤창현 변호사비 대납의혹 이재명 뇌물수수 혐의 고발 다음 뉴스 1affGhEAsd 고발사주로 안되니 직접 나섰군 대들보같은 도이치모터스 건희 것은 눈에 안보이고 남의 티끌은 현미경으로 보는군
29685,이재명 전국민 지원금 철회 방식 대상 고집않겠다 이재명은 못합니다
29687,이재명 불쑥불쑥 수다가 정책이라고 철회 그냥 국민들 갖고 노는게 재밌냐 GSGG_재명
29688, 속보 이재명 전국민 재난지원금 철회 지원방식 대상 고집않겠다 REz1vsnO7M
29691,전국민재난지원금 고집하지 않겠다는 이재명 지역화폐 집착은 절대 못버리네 lNgQclxf5a
29694, 속보 이재명 대상 방식 고집않겠다 전국민 재난지원금 선회 다음 뉴스 RsZ8tTb04X
29696, 속보 이재명 전국민 안되면 소상공인부터 지원금 지급서둘러야 GeL3DCLPeh
29698, 속보 이재명 전국민 재난지원금 고집 안 하겠다 다음 뉴스 A9YbSSHrat
29701, 전국민재난지원금 고집하지 않겠습니다 여야 합의 가능한 것부터 즉시 시행합시다 이재명 더불어민주당 대선 후보가 내년 1월까지 전국민 재난지원금 을 지급하자는 주장을 사실상 철회했다 0lfHShLrT8
29702, 속보 이재명 전 국민 재난지원금 고집 않겠다 입장 선회 다음 뉴스 mUZ66sUFKx
29703,이재명 후보가 여야 합의 가능한 것부터 즉시 시행하자 는 입장을 발표했습니다 이재명 전국민 지원금 S7TclOQx9d
29715, 속보 이재명 전 국민 재난지원금 고집 않겠다 입장 선회 ROMNvBKmEh
29716,이재명 전국민 재난지원금 철회 지원방식 대상 고집않겠다 8Aq2xDTMgE
29717, 속보 이재명 전국민 재난지원금 지급 철회 현장은 다급한데 정치 속도 너무 느려 전문 qIeqGnTpQJ
29728,이재명 전국민 재난지원금 고집 않겠다 입장선회 혼자 빈북치고 찢어진 꽹가리 치고 이 인간은 자신이 말해놓고 아니면 말고 전형적안 朝三暮四 아주 지랄을 하세요 대통령도 아닌 인간이 기재부 쥐고 흔들고 아직 문재인 정부 살아있다는걸 알아야지 대선 패배후 감빵에 가는 꼬라지 좀 보자
29730,이재명도 윤석열도 싫다 국민들은 오직 박근혜대통령을 원할 뿐이다 박근혜대통령이 없는 대한민국은 찬밥신세가 되고 국민들은 우왕좌왕 살길을 찾아 헤메며 떠돌고 윤석열을 지지하자니 억울하고 분하고 투표를 포기하자니 주권을 일는 것 같고 누구를 찍어야하나 지나가는 똥개나 한표 줄까 
29735,이재명 전국민 재난지원금 고집 안 하겠다 일단 질러보고 불리하면 취소하고 나라를 그래서 어떻게 경영하겠냐 aLCeBc72bA
29742, 전국민재난지원금 고집하지 않겠습니다 여야 합의 가능한 것부터 즉시 시행합시다 이재명 대통령 후보의 메시지를 전합니다 전문 보기 5GoKw6e9lk FIC6cJ8JS2
29748,윤창현이 바보짓하고 있네요 RT 국민의힘 윤창현 변호사비 대납의혹 이재명 뇌물수수 혐의 고발 다음뉴스 7Rkthb2XLe
29756, 속보 이재명 전 국민 재난지원금 철회 지원 방식 대상 고집 않겠다 SBS뉴스 Izjic0GEW3
29757,이재명 전국민 재난지원금 철회 별수 없지 국민 반대가 높은데 글쿠 여당이 홍남기를 압박하고 감사까지 들먹이며 겁박 모양새가 청와대와 대결하는것 같잖아
29758,정말이냐 속보 이재명 전국민 재난지원금 철회 지원방식 대상 고집않겠다 출처 부산일보 네이버 뉴스 R3ss3RM7L0
29760, 속보 이재명 전국민재난금 철회 지원방식 대상 고집않겠다 이새끼 말장난 입니다 속지들 마세요 REBMJD9zci
29765, patriamea 국민의힘은 이재명의 없는 죄라도 쒸우는 중 이재명 수사 열심히 하라는 건 말이 되고 
29766, 속보 이재명 전국민 재난지원금 고집 안 하겠다 98eX8spZlN
29770,이재명의 기본소득 이루기 가장 빠른 방법은 적화통일 밖에 없음 국민은 공산화 시키고 본인과 측근은 화천대유처럼 해쳐먹고 자본주의 꿀빠는 거지 저 도둑놈 새끼 못 때려잡으면 민족에 미래가 없음 
29773, dongamedia 이재명 대장동 특검 강력히 요구할 것 하지만 국민의힘이 반대하지 않을까 걱정된다 한편 나라가 디비진다 국정원 해킹사건 빨간 마티즈 에 연루된 박근혜가 직무유기와 직권남용 혐의로 7월 12일 대검에 피소됐는데 아마도 감옥서 썩을 듯하다 
29775, 속보 이재명 전국민 지원금 주장 철회 지원대상 방식 고집않겠다 추후 검토 AcqMwFVkHe 추후 검토 같은 소리하고 자빠졌네 감옥 가서 혼자 검토해라
29782,윤창현 넌 교수 하다 이제 말도 안되는 고발장 접수하는 국짐당 알바 하는 국개 개가 됐내 세비가 아깝다 세끼야 국민의힘 윤창현 변호사비 대납의혹 이재명 뇌물수수 혐의 고발 다음 뉴스 ggW0qNhgWu
29786, 속보 이재명 전국민 재난지원금 철회 지원방식 대상 고집 않겠다 출처 서울경제 네이버 뉴스 jWGSokh9WT
29788, 1보 이재명 지원방식 대상 고집않겠다 전국민 재난지원금 철회 AsiDulheIP
29791, 5자대결 이재명 33 3 vs 윤석열 47 7 당선가능성 이재명 37 6 윤석열 52 2 MBN 여론조사 이재명 33 3 vs 윤석열 47 7 국민 절반은 동시특검 찬성 다음 뉴스 bUYQ6CJqjX
29794, 속보 이재명 지원 방식 대상 고집 않겠다 전 국민 재난지원금 철회 SBS뉴스 DhRhg88bHZ
29795, 속보 이재명 전국민 재난지원금 철회 지원방식 대상 고집 않겠다 T99UBoDtex
29806,이재명 지원방식 대상 고집않겠다 전국민 재난지원금 철회 zhJRsXXaI0 그냥 고집 부려 떼쟁아
29819,이재명 지원방식 대상 고집않겠다 전국민 재난지원금 철회 QOyhnlXTzH
29821, Jaemyung_Lee 국민은 국민편 상식이 통하는 사회를 원합니다
29822, 1보 이재명 지원방식대상 고집않겠다 전국민 재난지원금 철회 끝 
29825, 1보 이재명 지원방식 대상 고집않겠다 전국민 재난지원금 철회 7OHj1AjX4s
29827,이재명 특검을 강력히 요구할 수밖에 없다 야당에 밀린 대장동 프레임 역전 노린다 JiHurXtmKo 멋지다 이재명은 한다 가자 아베나베황교활토착왜구국민혐오국혐매국반역도당척살 
29828, 1보 이재명 지원방식 대상 고집않겠다 전국민 재난지원금 철회 qq00sWPtar
29829, 정당지지도 국민의힘 36 더불어민주당 33 태도유보 20 대통령 국정운영평가 긍정적 평가 44 부정적 평가 52 대선후보 관심 사안 이재명후보 대장동 특혜의혹 35 gt 윤석열후보 고발사주 의혹 22 gt 윤석열 안철수 후보간 단일화 16 gt 이재명 심상정 후보간 단일화 7 
29842,이재명과 송영길의 민주당은 신나게 돈 팡팡 풀면 지지율 올라갈 것이라 생각할 것이다 생각대로 안돌아가는 이유는 우리 국민들이 외환위기때 겪은 트라우마 때문일 것이다 경제주체는 이기적이지만 경제공동체가 붕괴되면 개인의 삶도 무너진다는 걸 몸으로 겪었기 때문 
29845,국민의힘 39 1 vs 더불어민주당 27 2 비호감도 이재명 후보 47 3 로 1위 윤석열 37 9 이 후보에 대한 비호감도는 60세 이상에서 53 4 20대에서는 50 2 로 각각 과반이 넘는 것으로 조사 2zpwadaqI7
29846, 속보 국민의힘 변호사비 대납 의혹 이재명 후보 뇌물수수 혐의로 고발 출처 강원일보 네이버 뉴스 HwiBIoyywA
29850,더불어민주당과 국민의힘 정의당 국민의당 대선후보 4인이 공식 후보 선출 후 처음으로 한 자리에서 만났다 이재명 윤석열 심상정 안철수 tfeUE0y6uu
29858,이재명은 남국이 재정이 델꼬 매타버스타고 계속 돌아라 정면승부해서 국민들과 직접 만나 돌파하는게 가장 좋아보인다 이재명은 직접 보면 기냥 빠져들거든 
29863, MBN 여론조사 이재명 33 3 vs 윤석열 47 7 국민 절반은 동시특검 찬성 출처 MBN 네이버 뉴스 iiVjZdUO3d NXclzNcmBk
29880,국민의힘당은 아직 Juli 논문 은 못본 건가 한준호 출산 갈라치기 논란 정의당 이재명 입장 밝혀라 두 아이 엄마 vs 토리 엄마 표현 논란 오승재 글 지웠어도 정치적 책임 못 지워 167oe0ODzs lEHHMrm5sE
29882,광고 카피고 지랄이고 기본적으론 상품이 좋아야 하는거다 물건이 하자 투성인데 얄팍한 카피로 사기 치는 게 효과가 있겠니 더구나 이재명은 전국민이 다 아는 불량하자품인데 
29884,이재명 코나아이로 무리수 둔거 뼈저리게 후회할 일만 남음 누가봐도 국민 세금을 후보 호소인 주제에 지 선거에 쓸려고 하는거 티남 돈살포 아무도 반기지 않음 왜 그게 국민을 위한게 아닌거 알거든 
29886,민주당과 캠프는 물론 이재명후보와 의원들 모두 국짐의 개발이익환수법 반대와 윤석열의 종부세폐지를 집중적으로 공격해 국짐이 부동산투기세력의 배후임을 국민들에게 알려야 한다 한 두 번 찔끔하다 그만두지 말고 여론이 될 때까지 세게 몰아쳐야 한다
29899,윤석열 도이치모터스 관련 계좌 추가공개 거부 이재명의 특검수용 발언에는 물타기 하면 말장난 물귀신 작전 윤석열 국민의힘 특검 이재명 대장동의혹 곽우신 기자 1u7xBO9DEJ
29929,윤석열 국민의힘 후보와 이재명 더불어민주당 후보의 지지율 격차는 1 포인트에 불과했다 지난주 같은 조사에서 윤 후보가 오차범위 밖인 7 포인트 앞섰다가 초접전 양상으로 접어든 모습이다 XfXDTdpB63
29964, minjooseoul Jaemyung_Lee 국민지원금 효과로 3분기 가계소득 8 증가 15년만의 최대폭 다음뉴스 les0z5AbFQ
29968,국민의힘 이재명 비리 국민검증특별위원회 소속 윤창현 의원과 당협위원장 2명은 18일 수원 광교신도시 소재 수원지검을 방문 이재명 후보를 뇌물수수 허위사실공표 청탁금지법 위반 국회증언감정법 위반 위증 혐의로 고발 NUfyGmaaH7 수원지검 아니면 고발 안 되나 
30011,후쿠시마 방사능 누출이 없었다고 믿고 있는 윤 후보의 핵발전 공약에 많은 국민들께서 불안을 넘어 공포를 느끼실 것 같습니다 이재명 후보 또한 원전은 이미 경제구조 라며 뚜렷한 탈원전에 대한 답을 흐렸습니다 거대 양당 후보가 모두 핵산업계의 포로가 되어버렸습니다 
30012,국민의힘 변호사비 대납 의혹 이재명 뇌물수수 혐의로 고발 다음 뉴스 CEFRY4VeaI
30021,정책이 아닌 가정사와 대장동비리 고발사주로 쌈박질만 해대는 양대 거대 정당들 후보들이 마냥 좋다면 으짤수 없지 이제 이재명도 특검하자는 쪽으로 기우는데 왜 양당이 다 조용하겠냐 기소될 가능성 있는 대선후보가 말이 되냐 에잉 요즘 더더욱 둘 다 국민에게는 관심도 읎어 보인다 
30025, jrmpark napalmogi 양정철님의 출신성분이 의심스럽오 기어이 일본놈들의 앞잡이가 되어야하곘오 분이 푸리곘오 역사의 죄인은 되지 마시고 이재명후보를 도와 민주주의 민초들을 구하시고 검찰공화국을 타파해주세요 저만의 생각이 아닙니다 부탁해요 양정철님 나라와 국민들을위해서 
30039, sosimhuman beads72 happy_CSR_ 이재명은 경기도지사할때는 경기도 세금으로 선거운동하더니 여당대선후보가 되더니 국민세금으로 선거운동을 해요 대한민국이 여다만의 것인가 전국민 70 가 반대하는데 윤석열은 세금 안뽑아써도 지지율 50 가 넘는데 
30042, 5자대결 이재명 33 3 vs 윤석열 47 7 국민 2명 중 1명 동시특검 찬성 Mt1EDk8Bo7 당선가능성 이재명 37 6 윤석열 52 2
30054, Jaemyung_Lee 요즈음 국민속에 지지율이 주춤한것같아 한가지 꼭필요한 공약사항 제안합니다 청년공약 우리나라 제조업 및 중소기업이 보수가 낮아서 단순한 제조업에 청년들이 취업을 안하려하는데 보수측면에서 제조 및 중소기업 종류를 정해서국가에서 절반이나 1 3정도의 보수를 지원해 준다면 청년들강국
30075, Jaemyung_Lee 약속을 지키는 대통령 이재명을 지지합니다 부동산 불로소득은 국민에게 이것이 공정을 위한 진짜 이 나라의 길입니다 
30086,고발이 풍년이다 국민의힘 변호사비 대납 의혹 이재명 뇌물수수 혐의로 고발 수원지검에 고발장 제출 변호사비 대납 관련 참고자료 첨부 이 후보를 뇌물수수 허위사실공표 청탁금지법 위반 국회증언감정법 위반 위증 혐의로 고발하는 내용의 고발장을 제출 HeS7eVGVc2
30113, TheMinjoo_Kr 다른 후보님들은 공부왕 찐천재도 나가시던데 음 후보님은 승우아빠 쯔양 히밥 박미선 미선임파서블 터키즈 유퀴즈아님 뭐 이런거 어울리실듯 양세형 님처럼 엮일까 다들 두려워 할까요 이왕 이렇게 된거 온 국민을 이재명 측근으로 만드세요 
30136, MBN 여론조사 이재명 33 3 vs 윤석열 47 7 국민 절반은 동시특검 찬성 다음 뉴스 wjtKTulwe8 5자대결 이재명 33 3 vs 윤석열 47 7 당선가능성 이재명 37 6 윤석열 52 2 국민 2명 중 1명 동시특검 찬성
30140, koreakorea111 새로운 시대에 전과 4범을 올리니 곧 대장동 비리로 전과가 몇개가 붙을 지 모르는 물건을 정상적인 국민이 찍겠냐 독일에 세계적인 기업이 있는지 없는지도 모르는 이재명이 세상을 안다고 너같은 등신이 지지하는 찢재명은 쳐뒈져야 해 알았냐 
30150, zynnOmDVsu MBN 여론조사 이재명 33 3 vs 윤석열 47 7 국민 절반은 동시특검 찬성
30165,토지 보유세 당연하고 국민들 90 혜택 빈부 격차를 주일수 있는 시작된다 그레서 이재명 을 지지한다
30167, celestemalti ubermenschhgsg 비호감도 지지율 여조 안 보시나요 윤 싫지만 이재명이 더 싫은 사람들이 더 많다는 지표가 쌨는데 뭔 국민과 국가에게 피해를 덜 줄 후보를 찍어야 하는 상황이라 이재명은 절대 못 찍겠단 거고요 
30174, Jaemyung_Lee 대통령자리 라는 것은 국민을 지키는 권력이기도 하다 옛날 좋은 일에 상만 주는 임금과 궂은 일에 벌 주는 재상이 있었다 그렇게 몇해가 지나자 백성들은 착한 임금을 몰아내고 무서운 재상을 임금으로 만들었다 국민은 제 수하에게 휘둘리는 리더에게 즉각 불안해하며 결국 신뢰하지 않는다 
30205,종부세는 전면 재검토한다는 윤석열 후보 1 7 만 대변하는 정치는 하지 마십시오 이재명 너네들 세금 엄청 내야한다이 라고 국민을 속이려드는 권력자와 언론들 아프리카나 여느 미개한 나라와 똑같다 
30207,이재명의 실천력과 정신을 두려워하는 집단들이 많다 1 같은 당내 쓰레기 국개나리들 2 국민의 힘과 그 일당들 3 조중동과 기레기 잡새들 4 대재벌과 적폐 경제인들 5 윤석열 계보의 썩은 개검새들이 대표적이다 지지율 따윈 중요치 않다 진정성있는 정치가 중요한 것이다 
30213, CO WORK 이재명과 함께 일 할 청년상근자 공모 이재명이 더 많은 국민 여러분과 소통하고 생각을 나눌 수 있도록 함께 일 할 청년 동료를 모집합니다 기성세대가 말하는 청년이 아닌 진짜 청년의 목소리를 듣겠습니다 자세한 내용은 pdcJUtKWXa 더불어민주당 온라인소통단 mu08z6QajD
30233,여론조사 정상화 윤석열 36 이재명 35 초접전 1 p격차 NBS 尹 3 p 하락 李 3 p 반등 당선가능성 尹 42 李 38 관심 이슈 李 대장동 35 尹 고발사주 22 순으로 국민의힘 36 민주당 33 정권 심판론도 감소세 반전 NBpFT8cJoh
30243, lsh4u 의원님 민주당이 미쳤습니다 살다살다 이런 꼴은 처음 봅니다 억지 후보를 내놓고 휘두르는 모양새가 양아치도 안 할 짓들을 하고 있습니다 국민들이 민주당 찍지 않겠답니다 세상이 무너져도 이재명 찍을 일은 결단코 없을겁니다 지난 총선 부터 공작을 했던 겁니다 다음 총선 꼭 망 할겁니다 
30266,민주 이재명 관련 허위사실 유포 네티즌 3명 추가 고발 다음 뉴스 4Vrxgi3Pva 잘 하고 있어 어디한번 전국민 고발해서 국민비호감 가보자구 
30270, yoongaphee 머리가 빈 자들이 주로 자신을 세우기위해 돈으로 때울려고함 국민 70 가 반대해도 기본소득 이름만 바꾸면 되는 줄 아는 멍청이들 민주당과 이재명 
30295,정치인은 국민탓 하는거 아닙니다 지지를 못 받으면 왜 못받나 반성을 하시길 이재명 인물이 대통령감이 아니라 지지율이 그모양 그 꼬라지 입니다 받아들이세요 민주진보세력 실체가 뭔가요 걍 상식적 판단하는 국민이 있을뿐 함량미달 전과자는 안뽑습니다 
30303,대한민국 코로나 전쟁 야전군 대 승리 민주당 대통령 문제인 대통령 감사합니다 또한 국무총리님들도 정말 현장 고생 많았습니다 민주당 권력은 자유국민쟁취 민주당 지지자 당원들은 에너지입니다 민주당 이재명 대통령 공약 군대 졸병 월1백만 지급 제대때 90 결재된다 군부 영남당 전체 특검하자 fdiYUIRpck
30311,조선닷컴은 변호사인 김진태 국민의힘 이재명 비리 국민검증특별위원회 위원장을 통해 17일 박씨를 서면 인터뷰했다 서신에서 박씨는 최근 김어준의 뉴스공장에 잇달아 출연해 박씨 폭로를 부인하고 있는 박씨의 전 조직 선배 이준석씨의 주장도 반박했다 
30322,국민의힘 이재명 후보 변호사비 대납 의혹 관련 수원지검에 고발장 제출 윤창현 의원 이재명_변호사비대납 의혹 수사 관련 뇌물수수 허위사실공표 청탁금지법 및 국회증언감정법 위증 혐의로 고발장 제출 2021 11 18 li6wx2Izi6 ogG8a0TTus
30344, TwIzYIuaLx 삼국지 위지 왕수전에 정사를 함에 강한 이를 누르고 약한 이를 도우며 상벌을 분명하게 하면 백성들이 칭송한다 는 말이 나온다 여기서 등장한 억강부약 적극지지 합니다 이재명은 한다 국민은 한다 대한민국은 한다 적폐없는 세상 만들기 
30349, MBN 여론조사 이재명 33 3 vs 윤석열 47 7 국민 절반은 동시특검 찬성 MBN PieT7Iq7NW
30383,14 4 쳐 발리는데 접전이래 MBN 여론조사 이재명 33 3 vs 윤석열 47 7 국민 절반은 동시특검 찬성 9K8qgXgZ1j
30403, 국민뉴스 거창에 간 이재명 야구장 간 윤석열 반응 화제 ZuvOHbl1QS
30411,취약한 계층을 집중 해서 지원 해야 한다 이게 이낙연식 지원 정책 이었고 그게 맞았다는 게 통계 결과로 입증된거잖어 이재명식으로 전국민에 다 나눠서 진짜 취약계층에 돌아갈 몫이 현저히 줄어들면 이런 효과 못얻음
30425,5자대결 윤석열 14 4 p 차 우위 MBN 여론조사 이재명 33 3 vs 윤석열 47 7 국민 절반은 동시특검 찬성 5자대결 이재명 33 3 vs 윤석열 47 7 당선가능성 이재명 37 6 윤석열 52 2 국민 2명 중 1명 동시특검 찬성 quYw3K0Raq
