,tweet
44438,이재명씨는 민주당에 대한 국민 기대가 실망으로 변질되고 있다 라고 하셨는데 민주당이 아닌 당신에 대한 불신과 분노 심지어 증오와 혐오까지로 번지고 있습니다 자기 자신을 빼버리고 문제를 보는 것은 여전하네요 당신만 나가면 민주당 회복할 겁니다 hFk2wcNHyw
44448,이재명이 세금으로 매표 행위하려는걸 홍남기가 안 들어주니 저 지랄이지 그게 홍남기 비판이 아니고 임명권자인 대통령 비판하는거지 용기도 없는 비겁한 새끼들 국민들이 필요없다잖아
44456,민주당에 대해 국민의 실망은 이재명 너놈이 주범이고 원흉이다 미친새끼야 61CiiqtADY
44457, TheMinjoo_Kr 이 고가제품들 이재명 부인이 걸치고 다닌다던데 그동안 가난 청렴 코스프레 한건가요 국민이 우스워요 후보자랑 마누라는 돈 펑펑쓰면서 국민들한텐 기본소득 8만원 줄테니 지지해 달라고 한거 맞죠 정신 차리세요 민주당 OEJI4AoIPz
44471, Jaemyung_Lee 최순실 특검 때 국민들은 당신들과 특검팀을 응원하고 믿었다 하지만 너희들은 뒤에서 국민들을 조롱하고 웃었을 것이다 화가난다 깨끗한척 청렴한척 국민을 속이고 권력과 돈에 눈이 먼 이 인간과 윤석열 반드시 천벌을 받기 바란다 
44481,윤석열 가족 비리 의혹 파면 이재명 가족 건드리겠다는 이준석 이준석이 대통령을 만들겠다는 유승민이 이런 명언을 했지 가족은 건들지 맙시다 공사 구분 못 하는 국민의힘 당 대표 
44486,국민학교때 선생님이 잘못이네 27대밖에 안때리니 저러지 Jaemyung_Lee
44493,대장동 백현동이 언론과 포털에서 사라지면 대선 전까지 국민들이 잊어먹을 거라 생각하는 건가 경선 탈락하고 그냥 성남시장과 도지사로 공직생활 마감했으면 대선분위기에 휩쓸려 갔을 수도 있겠지 국민들은 이재명이 당사자요 비리의 수괴로 여기기 때문에 볼 때 마다 그게 떠오른단 말이다 
44495, napalmogi 메타버스는 이미 순시리가 아바타 이용해서 재미 많이 많이 보는걸 이미 우리에게 보여줬죠 우리 이재명 후보는 매주 전국을 다니며 품고있는 비전을 많은 국민들에게 알리고 있죠 광주 영령들이 보고있는 곳에서 폭탄주 돌리는 등신쎅히와 너무 대비됩니다 
44525,단언컨데 문재인대통령을 찍은 41 국민 중에서 이재명을 찍겠다는 국민들보다 죽어도 이재명을 안 찍겠다는 국민들이 훨씬 많을 것이다 그 이유는 간단하다 이재명은 반문수괴고 패악오물덩어리기 때문이다 우리는 이재명을 절대 안 찍는다 이재명_절대_안찍어 이재명을_거부한다 NO재명
44530,윤호중 국가재정 주인은 모피아가 아니라 국민이다 홍남기 경제부총리는 사과하라 국가재정 주인은 이재명과 민주당이 아니라 국민 60 이상 주인은 전국민 재난지원금 지급 반대한다 나라곳간을 사금고 취급하는 이재명의 민주당은 각성하라 wRbIIZBPhF
44539,당연하다 사사오입 불법경선으로 전과4범 이재명을 후보로 내놓고 연일 망언과 남탓하며 정작 대장동 게이트 주범 주제에 수사도 안받는 너를 쉴드친다고 염병떠는 민주당을 누가 좋아하겠냐 이재명 민주당에 대한 국민 기대가 실망으로 변질되고 있어 다음 뉴스 ktpAaf6qC1
44577, 민주당에게 내리는 국민의 경고 이재명으로는 대선도 망하고 민주당도 망한다 즉시 비대위 구성해서 대선후보 교체하라 민주당이 살 수 있는 유일한 길이다 다른 대안은 없다 
44588, bluepaper815 수는 없쟎습니까 민주당 선대위가 아니라 당당히 이재명 대통령후보 선대위 인재 라고 해주실 날을 기대합니다 욕먹을 줄도 알아야 진정한 정치인이라고 생각합니다 욕먹는게 두려워 보이는 애매한 태도는 상식적인 국민을 등돌리게 할껍니다 아이가 너무 예뻐서 비판 보류 축하합니다 
44613,RT ohmynews_korea 화천대유 그분 은 SK 최태원 회장 이재명 게이트 완전 헛다리 전석진변호사 대장동특혜의혹 최태원SK그룹회장 이재명민주당후보 윤석열국민의힘후보 김종철 기자 0Y9K84KY14
44614,이재명 영원히 기다릴 순 없다 검찰이 이재명이든 윤석열이든 하나은행이든 국민의힘의 공직자든 가릴 것 없이 엄정하게 있는 그대로 수사해야 한다 검찰이 제대로 수사하지 않으면 당연히 특검을 통해 진상규명하고 상응하는 책임을 물어야 한다 L9i4wzYb7V
44626, Jaemyung_Lee 이재명이 대통령이 되면 지금까지도 가장 악날한 조중동이하 언론들이 가장 두려워 할 것이다 그것에 이 조중동 저항은 이재명에 대한 최악의 날조와 조작을 일상처럼하고 있다 조중동이 명백하게 거짓과 날조인 줄 알면서 하는 것은 그것에 매번 속는 아둔한 국민을 두고 그러하다 
44627,이재명측 김혜경 사고 의혹 제기한 배현진 사과 안하면 법적 대응 출처 뉴스1 네이버 뉴스 26IulqItTB 이렇게 국민 고소고발 하는 대권후보 처음이야 
44667,민주당이 죽을까봐 이재명은 싫지만 이재명 찍겠다고 하는 분들은 이걸 어떻게 받아들일지 모르겠네 그럴 수도 있지 하며 인내할 것인가 그분들 궤변도 날로 늘긴 하더라 그게 바로 고립의 길 이재명 민주당에 대한 국민 기대가 실망으로 변질되고 있어 다음 뉴스 jWaISdBUZ7
44668,흠 음주운전 공장서 여공 머리채 잡기 등등 무수함 6000조원 등등 무수함 동문서답의 귀재 김혜경 계정 질문에 정치는 국민이 에너지관련 예기하면서 핵폭탄 하는 새끼 이재명이네 uH75eoJTld
44669,이재명 국민 90 는 토지세로 이득 반대하면 바보짓 부동산 투기 막으려면 거래세 줄이고 보유세를 선진국 수준으로 올려야 한다 토지소유자를 대상으로 국토보유세 를 걷어 전 국민에게 기본소득을 지급하겠다 부자들 역차별하면 안되니 8만원 기본소득 주되 부동산 세금은 졸라 걷겠습니다 
44670,이재명 자택서 나온 검은 망토女 김혜경 아니다 수행원 출처 중앙일보 네이버 뉴스 98YicfUUAh 거진말이 생활이구나 수행원이 명품으로 휘감고 일하는구나 국민을 얼마나 우습게보는거야
44689,민주당에 대한 기대는 모두 너 때문이고 절대 너는 대통령 안된다 포기하고 죗값이나 받아라 민주당 살고 싶으면 후보교체하라 이재명 민주당에 대한 국민 기대가 실망으로 변질되고 있어 다음뉴스 swLuCSOi5j
44695, MuzeoRosenbach 지지율 문제는 정책 때문 이기 이전에 이재명 자신의 비호감도에 기인한 것 사람의 진가는 살아온 발자취로 평가 받는 것 일진데 아무리 광고 한다고 그 가치가 달라 지겠냐고 결국 점명이 키운 민주당이 망했다고 봐야지 뭐 어휴 이제 국민의 짐 세상을 어떻게 살아내야 할지 막막하다 
44696, Jaemyung_Lee 국민들에게 전달되지 않으니 답답하지만 오늘도 주위 사람 한분 한분씩 직접 만나서 커피한잔 사드리며 사실을 알리고 있습니다 용기 잃지마세요 
44699,허경영 이재명 저격 전국민 재난지원금 액수 턱없이 부족 출처 세계일보 네이버 뉴스 y4zmaxvnoH
44700,60 가 이재명식 전국민재난지원금 반대하는데 기재부와 홍남기 부총리 악마화해도 이재명 후보 지지율 안 오름 현정부한테 정치적 중립성 위반소지 있다는 부담까지 지면서 자길 도우라고 주문하는건데 사람들이 금권선거라는 단어 생각할까요 안할까요 대장동도 해결 안됐는데 정책선거하라고 JQSr92R8HX
44719,이재명은 합니다를 민주당도 합니다로 가열차게 이재명 정책을 밀고 가야 하는데 세월아 네월아 함흥차사 무반응으로 일관하니 국민들이 속터지지 않겠냐구 국힘당이 선대위 꾸리고 경제이슈로 치고 나가기 전에 한발 빠르게 이슈선점해야 다음주부터 지지율이 오른다고 이번주 기회 놓치지 마라 제발
44727,이재명 국민90 가 수혜보는 기본소득토지세 누가 반대하나 17rU0xfFQS
44731,이재명에 대해서는 각종 비판을 쏟아내고있고 본선에서는 더 집중적으로 추궁해야하는 상황에서 뇌물전과자를 선대위원장으로 앉히는 것도 전략적 패착 그런 인사가 상왕노릇을 하고있는 상황에서 국민을 향해서는 공정과 정의를 부르짖을수있다고 생각하는 것인가 또 하나의 내로남불일 수밖에없다
44735,국민의힘 언론 탓하는 이재명 국민은 이재명 탓 이라 생각 다음뉴스 Rb7U8YpzhD
44744,김건희 논란 침묵하는 윤석열 민주당 반격 나섰다 강득구 김건희 도이치모터스 주가조작 미리 알았을 가능성 이재명 후보 4WbvXgY7jK 출처 YouTube 180여석을 국민들이 몰아주었을때 왜 라는 생각을해봐라 수박의원들아 언론개혁은 1순위로 해야할것이라 생각한다
44748,국민들 그거 다 자기 세금이라고 생각해서 받고싶어하지도 않아 어디서 선심쓰는척 돈뿌려 금권선거하려는 것들이 곳간지킴이 부총리보고 사과하라마라 지랄이야 호중아 이 이재명똥같은 개새끼야 윤호중 홍남기 지금이라도 사과하고 반성해야 당정 갈등 최고조 neEmqGeI7O
44761, 단독취재 이재명 후보 미래세대를 위한 약속 청년 기후활동가들과의 간담회 bSkzAzndZN 출처 YouTube 180여석을 국민들이 몰아주었을때 왜 라는 생각을해봐라 수박의원들아 언론개혁은 1순위로 해야할것이라 생각한다
44769,추가세수 19조는 코로나로 힘들어하는 국민들을 위해 유예해뒀던 세금이 걷히며 들어온 것이고 국채를 상환하기 위한 돈이기도 하다 근데 여당이라는 민주당 국회의원들과 이재명 이재명 지지자들은 윤호중 추가세수 19조 더 있다 기재부 말 믿었다 오판할뻔 34hodfCgBP
44775,이재명 측이 진중권 발언을 기사로 내는 언론사를 상대로 선관위 인터넷선거보도심의위원회에 불공정하다고 이의신청 제기 이준석 국민의힘 대표가 페이스북에 공개 진중권 수구기득권 민주당 사람들은 아직도 자기들이 진보 라고 착각하는 듯 메코네상스 오인 그런데 왜 김부선은 노터치 cgFYwj2R4b
44792, 이재명 부인 사고에 윤석열 캠프 만세 불러 근거는 없다 이러는 안민석 진행자 의혹 근거 있냐 묻자 안민석 정치상식적으로 추정 국민의힘 기발한 가짜뉴스 尹 캠프 전혀 사실 아냐 입장 윤지오 적색수배 최순실 1억 배상 안민석 과거에도 헛발질 UPRCzRpqiD
44797, 경기 안방 도 놓치는 이재명 윤석열과 지지율 자꾸 벌어진다 f8t0P9VeqB 대선 예비 후보때 20 중반에서 낮았을 땐 10 후반까지 저조했던 지지율이 대선후보가 되자 갑자기 지지율이 두배 가까이 올랐다 이걸 국민들 보고 믿으란 얘긴가 
44798,천재 이재명 조선일보 고맙다 국민의짐 감사하다 대반전 03mI1wuN1Y 출처 YouTube
44835, Jaemyung_Lee 이재명 후보님은 최우선 순위로 획기적인 당원 증가운동을 전개해야 됩니다 특히 2030세대를 많이 확보하여 사이버 선거전과 유세전에 대비해야 되고 온라인 입당절차를 간소화 더불어 민주당 홈페이지에서 한장에 입당절차가 완료되게 하세요 입당 및 복당절차가 국민의 힘 대비 너무 복잡합니다 
44840,21일날 문재인대통령께서 국민과의 대화를 한다고 하네요 참석하시는 모든 분들이 대장동게이트에 대한 엄중하고도 신속한 조사를 해달라고 건의했으면 합니다 선거개입의 우려를 불식시키고 정당한 법의 집행이라는 명분을 만들어 줍시다 이재명_절대_안찍는다 이낙연으로_대선후보_교체하라
44846,이낙연 대표 시절까지 그나마 남아있던 토론과 협의 문화가 완전히 사라지고 이재명과 함께 걸리는건 다 치워버리고 말겠다는 독재 마인드를 가감없이 내뿜는 민주당 의원들 근데 그러면 그럴수록 국민들의 실망은 더 커지기만 할 것임 겸손을 잃어버린 정치인이 폭망하는건 국힘당이 보여줬음
44849, 2415kang 국민들은 이재명에 분노한다 이재명은 흠도 많고 대장동몸통의혹도 있고 비리의혹도 많고 조폭유착의혹도 있고 구역질도 나고 형수쌍욕도 하고 반문수괴인 5급수 오물덩어리다 유시민_이재명앞잡이_등극 유시민은_주둥이_닥쳐라 이재명_절대_안찍어 이재명_5급수_오물덩어리 NO재명
44859, sahanty17 신세계 정용진 부회장과 똑같이 25만원 받아서 좋으셨겠어요 재난지원금 전국민이 아니라 당신처럼 가난한 사람에게 더 주겠다는 정부 방침을 못 알아 먹으니 이재명이나 지지하고 있지 
44863, Jaemyung_Lee 민주당 홈피는 당원들을 위한 폐쇄형입니다 국민의 힘은 개방형 이러니 국민의 힘에 밀릴 수 밖에 없어요 당원이 아닌 일반 국민들도 의견을 표할 수 있는 개방형으로 바꾸세요 그래야만 당원들이 증가하고 확장성이 확보 될 것입니다 지금 당장 당원들만 보는 홈피는 폐쇄하새요 
44874,윤호중도 화천대유 했냐 코나아이 낙전 수익 눈독들이며 기본소득 주장하는 이재명과 한 패거리지 국민의 뜻은 세금으로 국가 재정을 튼튼히 하고 미래 세대를 위해 준비하라는 것이다 국민에게 현금으로 돌려준다고 그럼 세금을 덜 걷으면 되겠네 boVccMo1d8
44895,출처 KBS 제목 이재명 민주당에 대한 국민 기대가 실망으로 변질되고 있어 진짜 배은망덕한 쓰레기 민주당 지지율이 떨어지는 원인 중 하나가 이재명 널 결선투표 없이 후보로 만들어주려고 한 사사오입인데 그런 민주당 지지율 떨어지니까 민주당 탓 야이 양아치 새꺄 
44903, Jaemyung_Lee 와 이러니 이래서 이재명이죠 서민들의 등을 시원하게 긁어주는 대통령 후보 당신에게 대통령의 권한을 주면 국민들 살기 편해질테고 나라는 부국강성의 길로 갈 것이란걸 온나라의 국민들에게 알립시다 
44917, jinyeongkim2000 이재명 후보 전 국민 지원금과 지역화폐는 반대하는 국민이 더 많은데 썩은 동아줄 아닙니까 그만 버리세요 
44928, Jaemyung_Lee 가진자들의 표를 받겠다는 심보 참 다수의 국민들은 세금 꼬박꼬박내며 사는데 있는사람들이 더 세금을 내지않겠다는 마음자체가 잘못된 생각이죠
44938, 이재명측 김혜경 사고 의혹 배현진에 사과 안하면 법적대응 이재명 향해 소시오패스 원희룡 배우자 경찰 수사 착수 여기저기 고소왕 자기 반대하는 전 국민의 70 는 오늘자 지지율대비 피소 당할지도 모름 
44978,윤이나 국힘당이 여기에 대한 답이 없다는데에 대해서는 500원을 걸수는 있지만 민주당이나 이재명은 이 문제에 대한 답이 있을까 제발 대선전에 좋은 해답을 들고 나와 국민을 설득할 수 있길 바란다 
45008,국민의힘 더불당을 망친 핵심 원인은 경상도 패권주의다 경상도 출신이면 무슨 짓을 해도 대선 후보 문재인 이재명 MB 박근혜 가 되는 반면 비경상도 출신이면 어이 없게 나가떨어졌다 국민의힘에서 충청도 출신 윤석열이 후보가 되면서 처음으로 깨진다
45060,이재명 한일해저터널 우려에 국민의힘 일본만 까면 표 되나 다음 뉴스 8zw5JLRhva 그럼 방사능 물 바다로 내보내는데 찬성하는 왜구만 되면 표가 절로 굴러들어오나 이런 식이라면 북한 땅굴도 찬성할 집단들이네 
45087, newsgongjang 윤석열과 국민의힘 쫄게 만든 이재명의 폭탄 선언 1qWjvNfPvm 윤석열 김만배 박영수특검 관계 윤석열은 김만배의 소개로 박영수가 변호했던 화천대유 관련 대장동 사업자금 대출비리 수사를 받던 부산저축은행 사건을 덮어줬다 OMcFhr5t61
45094, 이재명 폭행설 키우려고 차량 4대로 스토킹 하는 언론들 더팩트 이효균 기자의 만행 gn3TG6OlnD 출처 YouTube 민주당의 언론개혁 묵살하는 직무유기로 인해 국민들은 고통받고 있다 TheMinjoo_Kr ssaribi jk_space
45095, nzqrcs 윤석열과 국민의힘 쫄게 만든 이재명의 폭탄 선언 1qWjvNfPvm 윤석열 김만배 박영수특검 관계 윤석열은 김만배의 소개로 박영수가 변호했던 화천대유 관련 대장동 사업자금 대출비리 수사를 받던 부산저축은행 사건을 덮어줬다 OMcFhr5t61
45102,공수처돌아가고있는모습이심상치않아보인다 옛날에는정치검찰하던소리가바뀌어정치공수처로불려질모양이다 검찰위에공수처일까 아니면검찰도정치공수처수사로전환하는서로누가더깨끗할까목소리내기경쟁가능할까 공수처에서이재명수사별도하고있을까 혹시나국민들이모르고있을현직정부인사수사건있을까 
45104,이재명 민주당 홍남기 타깃 삼아 文정부 차별화 윤 원내대표는 국가재정 주인은 기재부 엘리트 모피아들이 아니라 대한민국 국민이다 더 걷은 세금은 기재부의 것이 아니라 코로나19로 고통받는 우리 국민의 것 이라며 SPZj1VbqZl
45105, I_the_love_live 살짝만 바꾸면 맞는 말 민주당에 대한 국민 기대가 이재명때문에 실망으로 변질되고 있어
45108, 단독 이재명 성공한 전태일이 우리 곁에 온 건데 글 공유 분발 촉구 출처 국민일보 네이버 뉴스 4ZQXyYkIxe
45121,윤석열과 국민의힘 쫄게 만든 이재명의 폭탄 선언 1qWjvNfPvm
45141, Jaemyung_Lee 이렇게 국민의 불편을 찾아서 해소해 주는 후보 국민의 암덩어리를 끌어안고 빨아대는 언론 
45142, 의원들도 다음 총선을 생각해야지 지지율 경고등에 전략 부재 선대위 쇄신론까지 위기의 이재명 매머드 선대위 꾸렸지만 의원들 안움직여 지적 전략 지휘 핵심그룹 안보여 李 개인기만 의존하다 불안한 리더십 부각 전국민 지원금 지역화폐 예산 등 강구 CTd6qgZahs
45171,진중권 전 동양대 교수는 페이스북에 이재명의 언론 탓 에 대해 지지자들에게는 사이다일지 모르나 대다수의 국민은 마셔서는 안 되는 부동액이라는 것을 안다 며 자기들끼리 온라인에서 조작한 대안현실로 선거를 치를 생각인가 본다 조국 사태 를 보고도 배운 게 없다 고 평가했다 
45179, cwZICRFIxl77WNW 윤석열과 국민의힘 쫄게 만든 이재명의 폭탄 선언 1qWjvNfPvm 윤석열 김만배 박영수특검 관계 윤석열은 김만배의 소개로 박영수가 변호했던 화천대유 관련 대장동 사업자금 대출비리 수사를 받던 부산저축은행 사건을 덮어줬다 OMcFhr5t61
45201,조카가 중학교 들어갈 때 무상교복을 입었고 아내가 애들 낳았을 때는 시에서 산후도우미 지원이 있었다 그게 지금 이재명을 여기까지 오게 한 힘이었다 그러나 지금 어떤 여론 지형인지 이제는 전국민 재난지원금 준다는 것도 반대하는 여론이 비등하단다 나만 가난한가 보다 
45208,이재명이 이런 태도가 정말 화가날 정도로 싫다 자신의 일을 남의 일인양 빗대고 오히려 비판한다 민주당에 대한 국민의 실망은 오로지 자기 때문인데도 그걸 또 비튼다 저런 모습이 저사람의 진실일 것이다 
45217, ganyoung 이재명은 행정전문가 행정천재 서민 삶돌보는 유럽선진국수준 행정전문가 이재명 대통령되야 한다 국가행정 모르는 갑툭튀 윤석열 안철수 국회의원 홍준표 유승민 부류 쓰럐기들 대통령자격 없다 국민의힘 일제간첩 쓰럐기를 보수인줄알고 지지하는 서민은 걔돼지 UZqyEEuuwx
45220,이재명이 민주당에 대한 국민 기대가 실망으로 변질되고 있다라고 했는데요 당신이 민주당 나가면 끝나요 제발 나가줘요 k3kb3c17Yw
45222,대선까지는 많은 시간이 남았다 물론 짧다면 짧겠지만 인내심을 가지고 볼 시간은 있다 무거운 바퀴가 처음 구르기에는 힘이 많이 들겠지만 한 번 굴러가기 시작하면 구르는 힘이 거세지는 법 이재명의 능력을 홍보해야 한다 국민들에게 개혁과 생계의 성과를 보여 줄 수 있는 믿음을 줘야 한다 
45225,이재명식 재난지원금 반대 여론이 높은데 추진하는 새끼들이 미친놈들 이재명식 전 국민 재난지원금 반대 60 40대 광주 전남서도 반대 높아 zX1Gicio1I SRGxqLhyjw
45233, JTBC_news 김선교는 국민의 힘 여주 양평의원인데 더불어박수무당은 넘보지 말아라 그래도 이재명 밀어주는 더불어만주당은 안뽑는다 
45238, KrVJBaaACB 왜 하필 여의도에 김혜경의 수상한 외출 이재명 전과 4범이 국민들을 보고 법을 지키란다
45240, jk_space 박덕흠 5000억 윤석열800억 윤희숙150억 자신들 권력 돈벌이 위해 가난한 서민들 죽여도 된다는 국민의힘 일제간첩 쓰럐기를 보수인줄알고 지지하는 서민은 걔돼지 종부세 대상 상위10 윤석열 지지하면 종부세 비대상 서민90 는 이재명찍어야 정상 아닌가 UZqyEEuuwx
45270,이재명측 올블랙 외출사진 김혜경씨 아닌데 우리도 답답 zv460bN37x 얘들 일부러 논란꺼리 만드는 듯 시선돌리기가 목적인가 보는 국민들은 더 답답하네 
45276,의혹마다 무차별 소송으로 입막음 국민들 공감을 얻을까 저항감이 커질까 이재명 향해 소시오패스 원희룡 배우자 강윤형 경찰 수사 착수 친여단체 공직선거법 위반 고발 고발인 적폐청산국민참여연대 신승목 C2KypqFsL3
45296,이재명 향해 소시오패스 원희룡 배우자 경찰 수사 착수 WrocSwPEu3 적폐청산국민참여연대 신승목 대표는 강윤형씨 자신이 마치 이재명 후보에 대해 정신과적 진료를 통해 진단한 것처럼 사실을 왜곡 허위사실을 유포하며 비방했다 며 공직선거법 위반으로 처벌해달라 고 촉구
45299, Jaemyung_Lee 온라인으로 국민소리 듣고 정책 반영하기 코너를 재안드립니다 이재명은 합니다 대통령가즈아 
45319,이재명이 자신의 거짓말도 안통하고 지지율도 오르지 않으니 민주당에도 성질부리고 문정부에도 성질부리고 언론에도 성질부리고 아내에게도 아차차차차차 국민 여러분 혹시 가까이 계시다면 조심하세요 
45320,김기현 이재명 재난지원금 윤석열과 논의 국면전환 꼼수 다음 뉴스 qclhFWspbn 이거 이거 보세요 전국민 뭐 해주겠다 해도 싫다고 하는데 민주당은 뭐하러 그럽니까 대신 내 세금이나 깎아주세요 국힘당 세비로 여러 복지비로 나가는 내 세금 꼬박꼬박 내기 싫으니까 
45335,대장동 대장동 카는데 이재명 후보가 잘못한 거 하나만 얘기해 보세요 이재명 후보의 비리혐의 하나만 얘기해 보세요 드러난 비리혐의자 열다섯 명 모두 국민의힘 출신들인데 이게 이재명 게이트인가요 국민의 힘 게이트인가요 대답해 보세요 
45341,이재명으로 하여금 전국민 90 중 약 60 는 바보가 되어따 5GdpXw0akZ
45345,이재명이랑 민주당은 성공했네 홍남기 이름만 나와도 좀비 떼같이 몰려드는 지지자들이 엄청 생겼어 공짜 돈 바라지 않고 매일 열심히 사는 국민들이 그들을 보면 어떤 마음이 들지 생각해 봐라 더 어려운 사람 돕자는데 나도 어려워 시발 이라며 달려드는 도둑놈 심보를 가진 사람들 
45373,정치사기조폭집단 국힘당은 인간말종들로 상대를 폄훼 모사꾼들이 국민들을 우롱 기만 하는데 책임을 지도록 해야 한다 일제강점기 일본에 기생해 반민족 모사 모략 일삼는 역적들로 인간말종들집단이 국힘당 이재명측 김혜경 사고 의혹 배현진에 사과 안하면 법적대응 wrZ36Y10WN
45380, Jaemyung_Lee 이재명은 합니다 당연한 말이지만 이재명이 하기 위해서는 국민이 의식주가 안정되어야 멀 하든 관심이 있을꺼 같습니다 기본소득도 필요하지만 결국은 소득수준이 올라가냐하고 사람이 수도권에 모이니 분산시켜야하고요 행정수도를 이전한다고 해서 서울이 망하지도 않고 그럴일도 없고 
45381, 이재명 vs 윤석열 설레바리 설문조사로 민심왜곡하는 검언적폐 및 윤석열의 국민의짐은 100신의무접종 법제화를 강행중이다 선무당이 사람 잡는다는 옛말이 틀림없다 1ML5mttnL5
