,tweet
15, jinsungjoon 이재명 하나 때문에 국회의원 전체가 탄핵 당한다고 정신차려라 니가 이재명에게 무슨 약점을 잡혀 있는지는 몰라도 그건 너 하나 문제로 끝내면 될 것 넌 지금 나라 말아먹을 짓을 하고 있는것이다 전국민이 대장동게이트 주범은 이재명이라고 모두 확신하고 있다 손바닥으로 하늘을 가리지마라
31,민주당 이재명 후보와 국민의힘 윤석열 후보도 연단에 올라 각자 구상하는 국가의 미래비전을 풀어놨습니다 이 후보는 기회가 보장되는 적정한 성장 을 강조했고 윤 후보는 전문가 중심의 국정운영 을 약속했습니다 RXYvUl3eEp
48, Jaemyung_Lee lee_tanhi lovelylawyerjj 박병석 의장 적폐가 입법부 의장 이란것은 국민들의 수치며 치욕 즉시 언론 중재법 상정하라 인간 버러지가 아님 반민족 왜견 찌라시 기더기 출신 부패한 쓰레기속 버러지가 국회의장 이라니 앞으로 의장과 상임위 위원장 선출은 투표로 선출하라
75, mimi24950 복붙 국민과의_대화 문재인대통령님_감사합니다 이재명_특검하라 이재명을_거부한다 이재명_절대_안찍는다 이재명_대장동게이트_특검가자 대장동몸통_이재명을_특검하라 대장동특검이나해라 송영길_탄핵 이낙연으로_후보교체해야_대한민국이산다
81, 적폐 이재명에 속을 국민 많지 않다 이낙연 측근 이상이 민주당 사라질 수도 U7W1sCTY06 뉴데일리
85, TheMinjoo_Kr Jaemyung_Lee 이재명은 반드시 한다 는 걸 믿는 국민들이 많습니다 부디 대통령이 되시어 반역 적폐 세력으로부터 내 조국을 지켜주시기 바랍니다 응원합니다 
108,국민이 이재명이다 
115, TheMinjoo_Kr 이재명만 바라보고 이재명만 향해 나아가는구나 국민은 없다 도저히 참을 수없어 차단 누르려 홈에 갔다가 다시 정신을 가다듬는다 가보자어디 
127,이재명 후보에겐 10분이 넘 짧죠 그의 머리 속엔 국민을 위해 움직여야 할 계획들이 너무도 차고 넘침니다 그래서 원고 프롬프터 없어도 줄줄 나옵니다 자랑스러운 이재명 대한민국 20대 대통령을 누굴 뽑아야 할지 답이 딱 나오지 않습니까 윤석열은 이구 그냥 헐 이다 
149, histopian 개인으로 보면야 이재명은 정치인이고 윤성10은 양아치떼에 불과하지만 정유라의 입시로 표출된 입시 불공정성에 대한 국민분노가 포함된 촛불혁명 정부의 조국 딸 조민이의 엄마 아빠 찬스에 대한 국민분노 문재인 다불러문빠당의 주거참사와 차별적 재난 지원 정책이 
154, Cold_Archer 이재명이 우리 국민의 화이자고 모더나고 얀센이다 
155,문재인100토론 시청후 국민 분노를 감추지못했다 문디새끼가 입만 처벌리면 개구라 집값이 상당히 안정 되있다 다음정부 어렵게 안 할 것이다 시청중이던 국민 문재인 막장드라마를 보았다 이재명은 더나뿐 놈이니 절대 찍지말자 다짐 
184,이재명은 문정권에 부정적인 국민들이 본인을 외면한다고만 생각하나봄 문정권에 호의적인 사람도 너 싫어하는데 
210,이재명의 극악무도함은 간단 증명 범죄를 저지르고도 국민을 감쪽같이 속일수 있다며 조롱하듯 선거운동합니다 이게 이재명의 본질
235,이재명의 문주당보다 더 윤석열의 국민의힘이 필요하게 됐네 김종인 이준석 부류들은 제낄때가 됐지 
242, TheBlueHouseKR 국민과의 대화 에서 문재인이 뭐라고 지껄였기에 문재인이 거짓말을 하는 걸까 아님 참모들이 눈과 귀를 가려서 바지사장이 된걸까 저런 모지리가 국가원수라니 인터넷도 안보나 이재명 지지율 더 폭락하겠네 등등 난리 역대 최악 대통령은 투표에서 문재인이 80 이상의 표로 압도적 1위 
243, TheBlueHouseKR 국민과의 대화 에서 문재인이 뭐라고 지껄였기에 문재인이 거짓말을 하는 걸까 아님 참모들이 눈과 귀를 가려서 바지사장이 된걸까 저런 모지리가 국가원수라니 인터넷도 안보나 이재명 지지율 더 폭락하겠네 등등 난리 역대 최악 대통령은 투표에서 문재인이 80 이상의 표로 압도적 1위 
247, TheBlueHouseKR 국민과의 대화 에서 문재인이 뭐라고 지껄였기에 문재인이 거짓말을 하는 걸까 아님 참모들이 눈과 귀를 가려서 바지사장이 된걸까 저런 모지리가 국가원수라니 인터넷도 안보나 이재명 지지율 더 폭락하겠네 등등 난리 역대 최악 대통령은 투표에서 문재인이 80 이상의 표로 압도적 1위 
249, TheBlueHouseKR 국민과의 대화 에서 문재인이 뭐라고 지껄였기에 문재인이 거짓말을 하는 걸까 아님 참모들이 눈과 귀를 가려서 바지사장이 된걸까 저런 모지리가 국가원수라니 인터넷도 안보나 이재명 지지율 더 폭락하겠네 등등 난리 역대 최악 대통령은 투표에서 문재인이 80 이상의 표로 압도적 1위 
252, TheBlueHouseKR 국민과의 대화 에서 문재인이 뭐라고 지껄였기에 문재인이 거짓말을 하는 걸까 아님 참모들이 눈과 귀를 가려서 바지사장이 된걸까 저런 모지리가 국가원수라니 인터넷도 안보나 이재명 지지율 더 폭락하겠네 등등 난리 역대 최악 대통령은 투표에서 문재인이 80 이상의 표로 압도적 1위 
260, TheBlueHouseKR 국민과의 대화 에서 문재인이 뭐라고 지껄였기에 문재인이 거짓말을 하는 걸까 아님 참모들이 눈과 귀를 가려서 바지사장이 된걸까 저런 모지리가 국가원수라니 인터넷도 안보나 이재명 지지율 더 폭락하겠네 등등 난리 역대 최악 대통령은 투표에서 문재인이 80 이상의 표로 압도적 1위 
263, TheBlueHouseKR 국민과의 대화 에서 문재인이 뭐라고 지껄였기에 문재인이 거짓말을 하는 걸까 아님 참모들이 눈과 귀를 가려서 바지사장이 된걸까 저런 모지리가 국가원수라니 인터넷도 안보나 이재명 지지율 더 폭락하겠네 등등 난리 역대 최악 대통령은 투표에서 문재인이 80 이상의 표로 압도적 1위 
265, TheBlueHouseKR 국민과의 대화 에서 문재인이 뭐라고 지껄였기에 문재인이 거짓말을 하는 걸까 아님 참모들이 눈과 귀를 가려서 바지사장이 된걸까 저런 모지리가 국가원수라니 인터넷도 안보나 이재명 지지율 더 폭락하겠네 등등 난리 역대 최악 대통령은 투표에서 문재인이 80 이상의 표로 압도적 1위 
267, TheBlueHouseKR 국민과의 대화 에서 문재인이 뭐라고 지껄였기에 문재인이 거짓말을 하는 걸까 아님 참모들이 눈과 귀를 가려서 바지사장이 된걸까 저런 모지리가 국가원수라니 인터넷도 안보나 이재명 지지율 더 폭락하겠네 등등 난리 역대 최악 대통령은 투표에서 문재인이 80 이상의 표로 압도적 1위 
269, TheBlueHouseKR 국민과의 대화 에서 문재인이 뭐라고 지껄였기에 문재인이 거짓말을 하는 걸까 아님 참모들이 눈과 귀를 가려서 바지사장이 된걸까 저런 모지리가 국가원수라니 인터넷도 안보나 이재명 지지율 더 폭락하겠네 등등 난리 역대 최악 대통령은 투표에서 문재인이 80 이상의 표로 압도적 1위 
271, iiinnnggg333 아수라이재명보단 백배 나은 인물이고 국민재산 뺏어서 자기 측근 배불린 이권카르텔 척결할 최적의 후보임에 이견이 없다 가붕개들 정신챙기시라 11up9lCjLa
274, TheBlueHouseKR 국민과의 대화 에서 문재인이 뭐라고 지껄였기에 문재인이 거짓말을 하는 걸까 아님 참모들이 눈과 귀를 가려서 바지사장이 된걸까 저런 모지리가 국가원수라니 인터넷도 안보나 이재명 지지율 더 폭락하겠네 등등 난리 역대 최악 대통령은 투표에서 문재인이 80 이상의 표로 압도적 1위 
281, Jaemyung_Lee 국민의 생명과 안전을 빌미로 중소기업을 약탈하고 일자리를 죽이는 K인증 제도를 개혁하여 보수정권이 자충수에 빠져 괴멸되게 하여야 합니다 9uLXK1aER9
282,누가 진정으로 국민을 위하는 사람일까요 생리대 가격이 오르자 저소득층 애기들이 수건이나 신발깔창 휴지로 대신하고 있다는 소리 듣고 바로 예산 편성해서 실시함 xwjyJR6HMK 이재명 성남시장 저소득 청소년 생리대 지원사업 하겠다 
285, patriamea moonriver365 TheBlueHouseKR TheMinjoo_Kr 국민과의 대화 에서 문재인이 뭐라고 지껄였기에 문재인이 거짓말을 하는 걸까 아님 참모들이 눈과 귀를 가려서 바지사장이 된걸까 저런 모지리가 국가원수라니 인터넷도 안보나 이재명 지지율 더 폭락하겠네 등등 난리 역대 최악 대통령은 투표에서 문재인이 80 이상의 표로 압도적 1위 
288, 새로운 1일차 이재명 후보의 사과로 시작한 전국민선대위 a0vGQHxlcT
289,이재명이든 윤석열이든 내게 청렴 단장 맡기면 도와드리겠다 모든 의혹 불식 시켜서 국민 심판 제대로 받아 새 정권 출 범에 큰 도움드리겠노라
303,외부인사 영입으로 중도층 확장과 영역별 싱크탱크가 구성되어야 하는데 영입이 전혀 안되고 있다 의원당 3명씩 할당한다고 될 일은 아니고 근본적인 원인은 이재명에 대하여 국민들이 마음의 문을 닫았음을 의미한다 조직은 어떻게 했다지만 정부 준비는 국정운영 철학과 비전이 통해야 된다 
336,혜경아 국민이 다 아는데 뭘 친절하게 가르쳐주기는 이재명 배임 uscMgX8XSU
356, bkfire1004 국민과의 대화 에서 문재인이 뭐라고 지껄였기에 문재인이 거짓말을 하는 걸까 아님 참모들이 눈과 귀를 가려서 바지사장이 된걸까 저런 모지리가 국가원수라니 인터넷도 안보나 이재명 지지율 더 폭락하겠네 등등 난리 역대 최악 대통령은 투표에서 문재인이 80 이상의 표로 압도적 1위 
389, ojg4008 woomitkfkd 김한길의 영입은 수단과 방법을 가리지 않는 공작 달인들의 술수다 이로서 양심있는 국민은 정치철학 보다 대통령이 우선인 윤석열을 절대 지지하지 않을 것이다 김한길이 윤석열 선대위 참여는 이재명이 정권교체 민심을 끓어 안을 기회를 더 많이 갖게 될 것이다
397,국민들이 정하는 거다 중립은 옳은것 그릇것 똑같이 하는게 아니라 올바른 것을 찾아가는 한가지 방법일 뿐이다 잘못되었는데 그걸 똑같은 권리를 가지고 떠드는게 어떻게 중립이냐 개 꼬리만도 못한 진중권이랑 어느 읍인지 개도읍이랑 말같지도 않은 소리 그만하고 민주당 이재명도
404,이재명이 조국 식 화법을 쓰기 시작했다 조국의 아무리 합법적이라 할지라도 일반 국민의 마음을 헤아리지 못하였다 식의 신종 변증법이다 자기를 의심하거나 나무라는 다수 국민의 심정을 깊이 이해하게 되었다는 핑계론이다 DvZ74BNJq2
417,가짜뉴스 찌라시 네거티브로 이재명 후보를 비난하고 이낙연을 지지하는 자들은 모두 국민의짐당 윤쩍벌 똥꼬빠는 똥파리들 입니다 문재인 대통령님을 지지하는 민주당 지지자분들은 이재명 후보를 비난하는 자들을 트웟에서 모두 차단해야 합니다 이재명이 대통령 당선되야 정치보복 막을수 있어요 Ca8aIT1yue
443, 대한민국대전환 이재명은합니다 11월 23일 화 이재명 더불어민주당 제20대 대통령 후보의 일정을 알려 드립니다 당원과 국민 여러분의 많은 관심과 응원 부탁드립니다 더불어민주당 이재명 AMPEKqFwfL
446,윗선 50억 클럽 국민의힘당도 조사 좀 하자 대장동 돈줄에 곽상도 최재경 김수남 이창재 김기동 강찬우 이동열 하나은행 김정태 SK 최태원 등등 개검떡검은 돈 줄 수사 좀 하자 이재명 돈받았는지는 파더만 저놈들은 핵심관련자인데도 왜수사를일절 안하냐 뎃폄 SRHe8VDDjp
447, lt 김은혜 의원 자신 있으면 면책특권 뒤에 숨지 말고 기자회견장에 서십시오 gt 김은혜 의원은 또 다시 출처도 밝히지 않은 녹취록으로 이재명 후보를 부당하게 공격했습니다 국토위 회의장을 정쟁과 허위 폭로의 장으로 만든 국민의힘에 개탄을 금치 못하겠습니다 a5ovcS6TY1
499, hannam1729 입만 열면 거짓말 이 난무한 이재명 을 다시 한번 말해주는 것입니다 이건 사람이 어떻게 한 나라 그리고 국민을 대표 하는 대통령후보 가 될수 있는가 그리고 자격미달 인 사람을 지지하는 국민들이 있다는 점도 문제입니다 국민들의 정치지식 도 성장해야 합니다 
523,윤석열 무식하다고 공격해봐야 쟤는 타격 없음 애초에 퍽이나 스마트한 인텔리라 지지율 나오는게 아닌데 뭐 이재명이 아니기 때문에 저 자리에 있는 애임 박근혜와 이명박근혜 싸움이라면 차라리 박근혜가 낫다고 생각하는 국민이 절반이야 
524, 대장동 의혹 김만배 남욱 정영학 기소 수천억 배임 공모 애네들이 배임이면 이재명도 배임이란 사실을 전국민이 다 안다 이제 
532, Jaemyung_Lee 문재앙은임기전에국민들한데약속한 검찰언론개혁을해야한다 이재명대통령한데미루면안된다 늙은구더기들은180석을주어도 지금까지아무것도못하고있다 초선김남국김용민박주민의원님 들이국민들을위해 들이일을 못하게하고오히려방해만한다 수박들은지금도이재명대통령을 대통령으로인정을안하고있다
544, Jaemyung_Lee 더 간절한 민익우선정책과 시원한 검찰개혁 청사진을 보여주세요 시간이 갈수록 국민의힘 당협위원장들의 기득권지키기와 정권교체 민심에 편승한 윤석열의 실체를 알게될 것이다 속았다는 사실을 알게되는 윤석열의 현 지지자들을 끓어안을 준비하세요 수단과 방법을 안가리고 모습 공작달인들이다
547,이재명 대선 승리의 책임만 남기고 완전히 새롭게 시작 논산선언 zzQWyU4ngX 처음으로 돌아가새롭게 시작 잘못했다 하고 부족한 건 부족했다 인정 낮은 자세로 새로 시작 선대위 역시 다시 시작 국민이 원하는 곳을 향해서 빠르게 달려감 uzFiVQbBqx
554, OhmyNews_Korea 금융실명제와 부동산실명제를 과감하게 실행함으로서 경제민주주의 초석을 다졌으니 현대사에 가장 빛나는 대통령으로 기억한다 위민의 그 높은 뜻을 이어받을 이재명 후보님의 국토보유세가 꼭 실행될수있도록 국민 모두의 뜻을 모아주시길 간절히 기원드립니다
577,민주당이 국민과 당원의 눈치도 보지 않고 아예 이재명당으로 만든다고 한다 지금껏 이런 경우는 없었다 위대한 김대중 노무현 문재인도 그러지 않았다 그런데 하물며 이재명이가 그렇게 한다고 한다 우려한대로 역시 이재명이는 하는구나 가슴이 찢어진다 
581, 전국민 선대위로 쇄신 청년층 끌어안고 외연 넓히는 이재명 다음뉴스 kYmg3X7YLP
597,선관위 이재명 비판한 진중권 인용 보도 제한 논란 뉴스 9 vPCeXdkagS 출처 YouTube 이쯤 되면 우리 국민이 무조건 정권교체해야겠네요 네 놈들이 우리 국민의 뜨거운 맛좀 봐야 정신 차리겠니 
611, TheMinjoo_Kr 복붙 나는 민주당 살릴 생각없다 이재명으로부터 나라만 지키면 된다 국민들은 진영논리를 떠나 국가의 안위를 위해서 투표를 해야 한다 그래서 이재명을_거부한다
634,국가와 국민의 재산 수백조를 갈취하는 온갖 조작질을 자행한 이재명을 띄우는 사람은 모두 공범이다 
640,여론에 일일희비할 시간이 없다 문제는 우리에게 있다는 성찰이다 자만하거나 오만하게 보이면 국민은 차가운 회초리를 든다는 것을 잊지 말아야 한다 이재명 억강부약 대동세상 이재명은합니다
665,화천대유는 누구꺼 국민의힘을 위한 국민의힘에 의한 국민의힘 게이트 국민의힘 윤석열 고발사주 국민의힘 윤석열 가족사기단 이재명 검찰 그 긴 시간 동안 뭐 했나 궁금 조건 없는 특검 빨리 하자 다음뉴스 r1fjkqPxgw
678, AumxzZcHFB 서울포스트논단 이재명당선 예측리뷰④ 지 형 형수한테 씹새끼 씨발년 등 욕설 한 이재명은 대통령 되어서는 안될 쌩양아치급 개잡놈 국민 서민 삶 챙길줄 알아 미래 아젠다에서 꿀만 빨고 살아온 윤석열보다 훨씬 낫다 2021 08 15 
686,국민이 판단하는데 비판을 이재명이 틀어 막자는 것에 진중권이 막가파도 아니고 경우가 있는데 HWQn0543IX
716, sungsulee FhbZs7DtfxWgaGG 같은 생각입니다 이재명정권이 들어서면 토건족과 사채업자들 부당한 불로소득으로 국민을 착취하던 대다수 범죄집단과 기레기 언론들 모두 철퇴를 맞을거라 봅니다 그래서 저들도 그걸 알기에 죽기살기로 여론조작해가며 방송까지 총동원해 국민을 세뇌시켜가고 있죠
730, marthen623 lmgwoo 11 22 하루백번복붙 리트윗 말고 복붙 국민과의_대화 문재인대통령님_감사합니다 이재명_특검하라 이재명을_거부한다 이재명_절대_안찍는다 이재명_대장동게이트_특검가자 대장동몸통_이재명을_특검하라 대장동특검이나해라 송영길_탄핵 이낙연으로_후보교체해야_대한민국이산다
750,송영길 지역당원에 이재명 공부 시켜라 당내 의원들 타박만 하나 INWTqZJljP 좀있으면 전국민 집집마다 리재명 수령동지 사진 걸어두라고 하겠네 이재명 송영길 더불어공산당
809, SangYi21 전화 한 사람이 잘못이다 그러나 이상이씨 당신은 학교에서 연구만 하시라 노벨상 발바닥도 못가는 연구에 전념 해주시길 이재명 탓하지 말고 무식한 국민 눈에는 주제 파악 못하는 인간 으로만 보일 뿐이다
819,정부는 종합 부동산세 납부자가 국민 전체의2 도 안된다고 한다 그 영향은 차치하고라도 2 는 국민이 아니냐 편가르기가 이 정부의 기본이냐 천배 넘은 투자이익을 갖도록 설계한 이재명과 대장동 범인들은 국민의 몇 나 되나 5천만분의 10이하 너무 작아 계산이 안된다 약탈자 박살하자 fZbAf6S0fQ
831,조금 무서운 뉴스 장기표 이재명과 경기동부연합 무슨 관계인가 종북정권 시즌2 바라는 北 선전매체 화천대유는 국민의힘 것 주장 xG3c1sjyk1 뉴데일리
841,갈수록 점입가경이다 대선후보면 외부인사는 영입을 안해도 모여드는게 정상적인 후보지 후보가 영입하고 싶은 사람은 직접 모셔오고 외부인사 영입난은 이재명 니가 대통령감이 아니라는 반증이기도해 국회의원이 국민머슴이지 니 머슴이냐 민주당놈들아 부끄러운 줄 알아라 선수교체해라 
842,차기총선서 민주당 이낙연은 영원히 아웃 설훈 윤영찬 특히 박광온이 오영환 홍영표 이광재등 절대 당선시키면 안될 인간들임 원팀은 고사하고 지들 선거운동 하고 있었고 이낙연은 아직도 딴 마음 품고있었음 이러니 이재명이 너무 힘들다고 국민들에 호소를 하죠 싹다 물갈이 하고 이낙연 출당하라
846,국민의힘 자승자박 自繩自縛 대장동이 이재명 게이트인줄 알았는데 국힘게이트로 들어나면서 진퇴양난 進退兩難 에 빠졌다 필사적으로 메달려보지만 국민 대다수는 이제 알고 있다 박근혜정부가 추진하여 만든 작품이란 것 그런데 이재명이 중간에서 막으니 얼마나 속이 상했을까 7Glvlylsi3
877, 이재명 밀어 주는 북한 장기표 이재명과 경기동부연합 무슨 관계인가 종북정권 시즌2 바라는 北 선전매체 화천대유는 국민의힘 것 주장 북한 이재명 친북정권 수립 위해 文대통령과 딜 가능성 분석 xG3c1sjyk1 뉴데일리
905, Jaemyung_Lee 후보님 개인적으로 쭉지지해온 국민중 한 한명입니다 정말 국민위한 대통령이되시고 싶다면 앞으로 상대방 후보 흠잡는데 1도 신경쓰지마시고 본인의 정책방향에만 신경써서 선거운동해주세요 다른 후보들 흠이있다면 그건 국민들이 알아서 밝혀깝니다 이런글은 오히려 마이너스라는걸아셨으면해요
919,이재명 윤석열 둘이 아무리 지지율격차가 크더라도 이런씩으로 국민을 우롱하면 안되지 않나요 mIQLiKuqZm
925,이재명 후보는 22일 오전 국회에서 열린 제1차 전국민 대전환 선대위 에 참석해 청년 선대위와 만나는 첫 회의가 이재명의 민주당 새로운 민주당의 첫 공식 활동 이라며 정책 발굴과 집행 조직 명칭 모두 최대한 자율적으로 활동해달라 고 주문했다 Yz22ZJ7WIx
941,이재명 후보는 왕이 아니라 진정한 머슴이 되겠다 저는 아무것도 가진 것 없는 사람이다 학벌도 지연도 돈도 조직도 정치적 후광도 없는 사람이다 혈혈단신으로 이 자리에까지 온 것도 여기 계신 한 분 한 분 국민 여러분이 이끌어줬기 때문 gW33un7UVe
944,장기표 이재명과 경기동부연합 무슨 관계 인가 최근 북한이 대남 선전 매체를 통해 화천대유가 국민의힘의 것 이라고 주장 JQm24rEPKs
949,민주당은 적폐이재명을 축출해야 국민의 지지를 받게 될 것 입니다 이재명_민주당에서축출해야 이상이교수님_응원합니다 CeiYcw3vlV
952,靑 이재명 정부 이해하고 전국민지원금 결단 靑 개입 안해 iun9dzgL72 박수현 수석 文 임기 내 부동산 하락 안정세 언급엔 시장심리 변곡점 입구 느낌 종부세 폭탄 표현 불안감 조장 98 는 고지서도 받지 못해 
962,국짐과 민주당이 국민에게 스트레스 주기 경연을 하고 있어 어디서 저런것들을 후보라고 뽑아서는 뭐 그래도 고민 1도 없어 이재명은 절대불가라는 대원칙이 있으니까 박근혜때 나라 망가진것은 이명박때와 비교하면 애교수준이니까 단 각자의 목숨은 스스로 조심해야겠지
996, TheMinjoo_Kr 이재명의 민주당 민주당은 당원의 것이고 국민의 것이다 어디 감히 이재명의 당이라니 우리는 절대 범법자에게 가족에게 쌍욕하는 인간에게 우리의 가치를 팔지 않는다 이재명의 민주당이 되고싶다면 너희가 민주당을 떠나라
1042,이재명 후보와 민주당의 정치적 적폐 어떻게 할 것인가 aD3ihniXhO YouTube 의인義人 이상이 교수님의 명강의를 듣고 이땅의 안개속 대선 정국을 보시며 번민하는 모든 국민들께서 정파를 떠나 이 방송을 시청하시고 옳음에 공감하는 영감과 용기를 얻으시라고 여기에 올려 봅니다 
1056,IQ높기로 소문난 한국인들 이재명이 범죄자라는 걸 다 아는데 소환 조차 안 하는 검찰 국민 알기를 너 무 개 돼지로 본다
1069,3부 이재명 측에 돈 줬다고 진술하는데도 수사 않는 검찰 조용한 언론 국민 이 나라가 썩었다 2021 11 22 VDfY4sojsA 출처 YouTube
1075,윤석열 이재명 둘 다 뽑고 싶지 않은데 이재명이 모든 분야에서 가지가지 다 하니까 오히려 윤석열은 어르고 달래가며 국정 이끌 수 있지 않을까 하는 희망사항까지 생김 반면에 이재명은 전 국민 고소 쌉가능 시발놈
1104,문재인은 탁현민이 기획한 대로 움직이는 아바타지만 이재명은 제 스스로 쑈를 기획하는 모양이다 문재인은 장황하나 이재명은 어설프다 마누라와의 쑈도 어설프고 눈물쑈도 어설프다 그에 속아넘어갈 유권자인 국민은 더이상 없으리라 
1105,이교수님을 협박하는 자들 국민들이 보고있다 선을 넘지 말거라 이재명후보 지지자들 
1121,이재명이반성한다 사과한다고했다 그런데 그말이진심이라고 믿는 국민 은 얼마나될까 어리석지 않다면 이재명 말을믿지않을것이다 문재인 도 잘하겠다 고 얼마나 허풍을쳤던가 그런데 문재인 은 나라를박살을내놨다 거짓말 그것이 좌파들의 본질이다
1133,국민에 대한 예의문제야 대통령의 메세지는 정확하게 전달되어야 하게 때문에 원고를 반드시 확인하며 읽어야 하는거야 대통령이 영어 못한다고 통역 쓰겠냐 원고조차 준비안한 이재명 저 양아치 새끼는 국민에 대한 예의가 없는거야 4v6OeyEE5a
1134,민주당 의원이나 당직자 중에 이재명 비판하는 사람들 꽤 있죠 그들 발언은 항상 이렇습니다 이재명 후보의 발언은 문제가 있다 국민들이 싫어한다 부동층이 싫어한다 제발 좀 솔직해지세요 국민들이 싫어하는 게 아니고 당신들이 싫어하는 거잖아요 도와주기 싫으면 최소한 닥치세요 
