,tweet
16341, Jaemyung_Lee 국민의힘 이자들의 이중적 위선의 행동을보라 대장동 그렇게 매일같이 비판하더니 법안을 반대한다 이넘들 정말이지 할말이 없다 썩을넘들
16342, Jaemyung_Lee 당당하고 청렴한 이재명은 꿀릴게 없고 적반하장 국민의 힘의 대장동 비리는 낱낱이 밝혀질것입니다
16362, 국민과 소통하고 약속하고 실천하는 이재명 을 좋아하지 않을 수 없다 거기다가 말하면 실천하는 공약이행률은 98 이재명은 정말 완벽한 정치인이다 앞으로 이재명 같은 정치인 절대 안 나오니 국민들은 이번 기회를 놓치지 말자 이재명 디씨 인증샷에 댓글 폭발 WcyRAV8SXq
16367, gazefor Jaemyung_Lee 이게 정책이고 국민을 위한 정치고 사랑입니다 이러면 동물들도 훨씬 치료받고 건강해져 사람으로부터 버림받는일이 많이 줄어들겁니다 
16372,깨시연 집회 서초동현장 yyVUxaUn8m 여의도 민주당사 집회도 응원합니다 송영길_탄핵 이재명_윤석열_구속 대세는_후보교체 여야_모두_후보교체 국민은_정상적후보에게_투표하길_원한다
16397,정권교체를 위한 자유국민전선 토크콘서트 생방송 윤석열 후보 확정 이후 보수우파의 갈 길을 묻다 이재명 김혜경과의 전쟁인가 WNyuC5LitA 출처 YouTube
16412,어디내놔도 남부끄러운 대선후보 이재명과 진짜 어디내놔도 쪽팔려 디져버릴 것 같은 당대표 송영길의 콜라보 이런데도 민주당이 안망할 것 같냐 이대로 한달만 더 지나면 민주당은 국민들에게 의해서 강제해산 된다 이말이야 이 멍청한 민주당 국회의원놈들아
16418, SangYi21 그럼 더 잘해서 이낙연 세우시지 국민의힘 안 갈거면 싫어도 이재명하세요 아니면 분열되거 윤석열 치하에서 사시던가 누군 좋아서 
16424, 국민의 민주당을 만드는 게 아니라 이재명의 민주당이요 이거 한 정당을 사유화하겠다는거지 사유화해서 지를 위한 발언만 하고 지를 위한 법안만 추진하겠다고 말하는 거로 해석되는데 아니 국민들을 위한 정치를 하시라고요 제발 6meSF3x93a
16430, c584637 lovelydorrit 대한민국 국민의 일원인 이재명이 아니라 이재명의 대한민국을 만들겠다는 것과 같음 
16438,더불어민주당 의원들 180석의 국민들의 개혁의 열망도 잊은 채 서울 부산시장 선거도 참패하고 아직도 정신 못 차리고 있다 이재명 후보를 대권주자로 지명해놓고 지금 뭘 하고 있는가 180 의석으로 해결하지 못 하는 개혁 이재명을 중심으로 개혁해야 한다 제발 정신 차려라 답답하고 화가 치민다
16459,이재명 종일 대전 누비며 민생 밀착 행보 이재명은 학벌도 지연도 돈도 조직도 정치적 후광도 아무것도 없는 사람이다 혈혈단신으로 이 자리에 온 것도 국민 여러분이 이끌어줬기 때문 국민 집단지성을 믿고 지금까지 왔던 길처럼 똑바로 앞으로 나가겠다 NSOqNTxxnn
16463,뜯남아 송뜯남아 우리 송닝기리 대표님 진짜 국민들이 이재명을 진지하게 공부해도 되겠어 이재명을 가장 잘 아는 사람들이 이재명을 가장 혐오하는 우리 문파들인데 이재명은 알면 알수록 혐오하게 될 수밖에 없는 그런 놈인데도 진심이니 교보재로 문파는 다들 하나씩 갖고있는 찢폴더 푼다 GMUyS141Qf
16470, 국민반상회 부산에서 청년들과 나누는 일자리 이야기 이재명 매타버스 국민반상회 부산 일자리정책 청년취업 TfFHIfnJc8
16492,이재명 민주당의 이재명 아닌 이재명의 민주당 만들 것 국가와 국민을 위한 정당이 아닌 이재명을 위한 사당화를 공개적으로 언급하고 있다 아직 구속을 안시키니 주접을 떤다 민주주의자는 이런 말을 안한다 김일성 주체사상을 추종하는 주사파 이재명의 민주당 공산화전략으로 판단한다 
16493, JamesCh22367033 younha2002 v3aJTBNfbf4VQ7x 이재명 국민들이 혐오하는 인간으로 추락 이재명 지지하는 인간들 주위 1도 없더라 온라인 이재명지지자 현실에선 부끄러워 입도 못떼는 상황
16501, ezra10004 이재명 논리 바탕으로 설득력이 뛰어남 국민들이 알아듣기 쉽게 설명하는게 장점임 
16510,이재명의 집권은 민주화세력이라는 기득권자의 승리가 아니다 주권자요 서민 민중 의 승리다 왜냐하면 이재명은 민주화세력의 이익보다는 국민의 이익 다수서민의 이익을 대변할 것이기에 이재명은 친문세력이나 시민사회세력 그리고 폐미세력의 이익엔 관심이 없다 그가 홀대 받는 이유다 
16519,김남국 이재명 대장동 사건 터지자 더 신나했다 lhN78YVZyB 경선기간 수행실장했던 김남국 다스뵈이다 출연 이 후보 너무 좋은 기회다 정책알릴 수 있는 기회 李 부당이득 대한 국민 허탈감 읽는 데 부족했다 
16526,변화 선언한 이재명 대장동 의혹에 일단 사과 범죄는 사과한다고 용서되는게 아니야 처벌을 받아야돼 검찰이 수사를 안하고 있어 정치권이 미쳐돌아가니까 국민들이 투표로 해결할거야 8Jy3IaQeM3
16527, 지금부터 한 두달내에 특검을 받아 성남시와 경기도땅 문제를 해결하면 국민이 알아서 찍어줄텐데 그렇지 않고 시간끌고 입만열면 거짓말에 남탓으로 돌리니 안되지 알면서 음흉하긴 이재명 새벽 반성문 국민신뢰 잃어 새로 시작 IJfu1a13Av
16560, 적폐 이재명에 속을 국민 많지 않다 이낙연 측근 이상이 민주당 사라질 수도 당 내부 자체에 혁명적 변화 절실 지금이 교체 적기이니 민주당 정치인 용기 내라 lxhyHsK8fr
16579, 꼭 대통령 돼 달라 울먹인 시민에 눈시울 붉어진 이재명 다음 뉴스 8emlwWZvox 국민의 따끔한 질책 이재명의 메타버스를 이용한 민생투어 국민의선택을 받을것이다 진화하는 승부사 대한민국의 행복한 꿈을 견인해주세요 아자아자 
16583,이재명 후보의 진솔한 대국민 사과와 재발 방지 약속을 요구합니다 vonwacFWuJ 출처 YouTube
16585,朝變夕改 이양수 수석대변인 이재명 차라리 선거구호를 이재명은 조변석개 합니다 로 바꿔라 국민의힘 이양수 수석대변인이 20일 대장동 비리 특검 요구 와 관련해 이재명 후보가 특검에 조건을 붙이고 시간을 끌고 있는 것에 대해 지적 b1dXTsScKO
16616,민주당 대권운동은 윤석열의 국민의짐과 보수 언론과 유투버들 이낙연지지자들 남의일 처럼 보고 있는 더불어민주당 의원들 이런 이들을 상대로 대권운동을 치르고 있구나 참으로 이재명의 고군분투가 애처롭고 눈물겹다 하지만 화이팅 하시라 이재명 힘 내시라 당신 뒤에는 깨 국민들이 있다
16625, 딸이 죽었는데 백신 피해 유가족 정은경 청장에 항의 출처 세계일보 네이버 뉴스 pyQgmiWilG 광딸녀 호남혐오 추가 됨 국민정서 이재명에 악재가 준첩이다
16631, c584637 뭔 생각들을 하고 사는지 논산시장 황명선은 제6차 상생위로금 지역화폐로 전국민 지급해야 한다며 설레발 치고 있고 지역구 국회의원 김종민은 초롱초롱한 눈빛으로 이재명 화이팅 을 외치고 있고 이인제 에 이어서 김종민 차기 총선에 나서는 황명선 까지 액풀이라도 해야 할 듯
16632, Jaemyung_Lee 당신은 국민의 편 시민의 편 헌법의 편 결국 나라의 편 나는 오로지 한 사람 이재명의 편 눈시울이 뜨거워지려 하네요 그저 한편이라서 
16652,이재명 후보가 조선일보 OUT 피켓을 든 순간부터 조선일보와 그 똘마니 언론의 목숨을 건 싸움은 시작되었다 여기서 패배하면 국민들이 개돼지였음은 증명되는 것이며 민주개혁세력은 재기가 어려운 몰락의 나락으로 떨어질 것이다 지금은 전쟁이다 국민이 진정한 주인이냐 조선일보의 나라냐 
16673,이재명이가 이재명의 민주당 을 만든다니 난 찬성 이젠 각자의 정체를 국민들께 드러내고 선명해져야할 때 저 놈을 추종하는 년놈들과 친문은 다르다는 걸 세상에 알려야 이제 헤어져야하고 갈라져야할 때가 온 듯 열민당이 들어갔고 친문은 나와서 창당하는 게 순리 
16686,이재명 지금 디시 유저를 국민취급하고 걔네랑 소통하는거야 이 새끼 안되겠네 이거 이재명은 이제 글렀다 이재명은 이제 우리편 아니다 우리는 우리만 국민취급해주고 우리 얘기만 들어주는 후보를 원한다 글 내용은 결코 중요하지 않다 디시 인증을 했다는 사실만으로 이미 충분히 쓰레기다
16691, 안철수가 점지사 뼈를 타격 했구나 대깨명들 총출동 해서 부들거리는거 재밌네 안철수 전국민 재난지원금 철회 이재명 대국민 사과하라 출처 데일리안 네이버 뉴스 nEMe01vHKZ
16721,정당에서 대통령 후보로 선출했다면 좌고우면하지 않고 후보를 중심으로 국민에게 희망의 메시지를 전하는 것이 대선의 당연한 모습이다 민주당의 이재명에서 이재명의 민주당으로 변화와 혁신을 보여주겠다는데 반대할 사람 있겠나 나는 지지한다 그것이 경선한 이유다 NmOQjL7X9g
16724,RT ohmynews_korea 이재명 새벽 반성문 국민신뢰 잃어 새로 시작 이재명 더불어민주당 대통령 후보 소중한 기자 YwGxk4yS5q 오마이뉴스 읽어봐야만 할 기사 
16758,이재명 민주당의 이재명 아닌 이재명의 민주당 만들 것 다음 뉴스 JVfNaCbNJn 이 후보는 그 사람이 가진 경력 지위 관 이런거 다 던지고 오로지 실력과 국민을 위한 충정 그리고 열정을 가진 사람으로 다시 시작할 것 이라며 
16765,이재명 새벽 반성문 국민신뢰 잃어 새로 시작 180석으로 뭔가 할 줄 알았는데 기득권만 되었어요 개구리 올챙이 적 생각을 못합니다 겸손하고 절실함이 보이지 않아요 내로남불 이미지가 가시질 않습니다 잘못을 지적하면 왜 나만 갖고 그러냐며 대드는 느낌 LaidMaHqh8
16773,임기를 거의 끝낸 문재인이 지가 대선에 나가는 양 국민과의 대화 한다고 두문불출 문재인 니가 대선 나가냐고 아마 대화에서 대장동 철저히 수사해야라 입털거라고 그러면 이재명은 이제 아웃 시작될 거라고 변희재
16798,국민 머슴 이재명을 뽑을까 국민 상왕 윤석열을 뽑을까 아니면 본 부 장 가족사기단 수괴 윤석열에게 나라 곶간 맡길래 
16799, Jaemyung_Lee 끔찍히도 대통령이돼서 그 정치라는 도구를 화 려하게 국민을위해 사용 하고 싶으신 모양이다 
16809,디씨 인증한 이재명 청년들의 가장 합리적 선택 되겠다 대통령의 권한으로 왕이 아닌 머슴이 되길 자처한 이재명 정말 성군과 같은 국민의 대통령이 될 것을 믿는다 YW32FpBgF9
16819,3개월3주후대선정국복잡중요한시기에대통령은우리의운명으로뽑혀질것이다 이낙연보다이재명자격미달인데앞선게묘하고이재명보다한단계더국민마음을얻어가는윤석열에안철수는여론에정치인이된분이다 어쨌던죄형법정주의무죄추정등등헌법수호최대피해자는박근혜대통령이고대선판국현제는윤석열유리하다 
16831,경주이씨 이재명 문제들 개인의 민주당은 개당 개인당 위헌정당인데 독재자처럼 아주 위험한 생각 마음 자세 태도 말들을 하는구만 국민들의 민주당은 정당 으로 자유 법치 민주주의들 전주이씨들은 왕족들 급진 개혁파들은 외면 거부 당한다 혼자만 깨끗해서는 않돼 최 측근들이 뇌물들 나눠먹으면 
16837, 이재명은 학벌도 지연도 돈도 조직도 정치적 후광도 아무것도 없는 사람이다 혈혈단신으로 이 자리에 온 것도 국민 여러분이 이끌어줬기 때문 국민 집단지성을 믿고 지금까지 왔던 길처럼 똑바로 앞으로 나가겠다 x5rEyuBrE5
16840,이재명 정치인은 국민을 지배하는 왕이 아니고 국민을 위해 대신 일하는 일꾼 저는 왕이 될 생각이 전혀 없다 이 나라의 주인은 국민이고 국민을 위해 대신 일할 사람은 왕이 아니라 진정한 머슴이 돼야 한다 왕이 아니라 머슴이 될 사람 누구라고요 x5rEyuBrE5 이재명이요 
16849,이재명 새 나라를 정치인이 만드나 국민이 만드나 정치인은 지도하는 사람이 아니고 국민이 원하는 바를 국민이 준 권력으로 국민이 맡긴 세금으로 대신 일하는 것 맞죠 다른건 몰라도 국민이 명령하는것 반드시 나라에서 해야할일 시키는대로 정말 잘할 자신 있다 x5rEyuBrE5
16851,거북목과 삐딱 뽕 어깨의 한판승 사사오입으로 대한민국 여당의 대선후보가 된 이재명씨 그런데 민주당의 후보가 아닌 이재명의 당 민주당 후보가 되겠다 합니다 대한민국 국민으로써 민주당은 후보 교체해야 이낙연님으로 교체해야 당이 살거라는걸 다시한번 외쳐봅니다 이재명은 절대 안찍어요 v0ejmOKNdP
16857, 난리 난 대전 현장 이재명 왕이 아닌 국민의 머슴될 것 hudAWyz10l YouTube 2GT0meqbzs
16860,이재명 새벽 반성문 국민신뢰 잃어 새로 시작 vkPEVaMlUa 20일 오전 1시께 SNS 통해 깊이 사과 민주당 고인물 넘어 게으른 기득권 
16870, 9vgkTyUn5D 이재명식 민주당 사당을 만들겠다 당원이 주인인 민주당 국민이 사랑하는 민주당 국민을 위해 신속하게 일하는 민주당 으로 변화 혁신 하겠다고 해야지 이재명 생각엔 지 자신뿐인가 지구가 이재명중심으로 돈다고 착각하는 오만방자한 발언이다 
16871,뉴데일리 적폐 이재명에 속을 국민 많지 않다 이낙연 측근 이상이 민주당 사라질 수도 UHn8lDahrq
16885,이재명의 잠 못드는 밤 3 깨시연의 고소는 신의 한 수였다 녹취록이 나온 이상 수사를 안할 수없다 이 자금의 원천인 화천대유까지 거슬러 올라가고 결국 이재명 까지 갈 수밖에 없다 검찰만을 지켜볼 수없다 국민이 나서야 한다 국민이 수사팀을 옥죄여야 한다 이제 이재명의 끝이 보인다 
16888,같은 갱상도인데도 죄명이는 싫다 숨소리 빼고는 전부 거짓같다 선대위 해체하고 후보 중심으로 재편한다 해도 대세에는 영향이 없다 콩으로 메주를 쓴다해도 믿는 국민이 없다는 것이 작금의 현실이다 이재명_불신
16892,이재명 주식 공약 이재명 주식 공약 이재명은_합니다 재명이네 속지말자 김건희_주가조작 국민의짐 노노재팬 가짜뉴스 B7o98xGGo2
16901, 난리 난 대전 현장 이재명 왕이 아닌 국민의 머슴될 것 ldKtSyqyok 출처 YouTube
16908,화천대유로 거대한 싱크탱크를 조직한 이재명 경선기간 그 싱크탱크가 민주당으로 녹아들어 민주당을 접수햇고 이제 민주당을 변환시키는 동력이되고 잇다 민주당 뿐아니라 정치판 전체가 이재명의 뜻대로 바뀌어 나갈고다 국민이란 항시 침묵하는 말엄는 단 한번의 표를 행사하는 무기력한존재 
16913,닥치고 특검부터 가자 국민들이 모든것에 합리적 의심이 든다는 건 특검 받고 죄 없는 사람은 당당하게 나오면 되지 않는가 머리의 뇌가 정상인 자유대한민국 국민들은 알겠지 李 이재명의 민주당 만들겠다 선대위 당 다 다시 시작 OC5cSESVZF
16915,진심은 눈에 보이는게 아니라 상대가 맘속으로 느껴지는게 진심인거야 이재명이 대장동 사건에 대해 부당이득권자들에 진심어린 사과부터 했어야 했는데 자신이 깨끗하다고만 생각해서 국민들 박탈감 뒤늦게 깨달았다 댓 후보 둘다 뒤늦은 사과 마음속으로 느껴지는가 진심어린 사과 보였다 
16916,이재명갤에서 lt 이거 보고 이재명찍기로했다 gt 가 풍년 이재명 안좋아하고는 못베깁니다 이재명의 사고방식은 보수도 진보도 아닌 옳은길이고 실용적이며 유능하기까지 합니다 나이를 떠나 전국민이 좋아할 수 있는 국민리더 이재명을 지지하는 것이 자랑스럽습니다요 PPVxBeDhvo
16921, Jaemyung_Lee 한다면 한다는 이재명 후보님 좋은 나라에 국민 편인 이재명 대통령 응원합니다 
16936,머리아프지만 우리가 이재명 별로다 하는 지점들 때문에 이재명이 낫다고 생각하고 우리가 국민의 힘보다 민주당이 그래도 낫다고 생각하는 지점들 때문에 민주당 싫다는 분들도 많은게 사실이죠 
16957,이재명 논산 화지시장 즉설연설 살아온 삶이 진실이라 원고없어도 술술 그 사람이 가진 경력 지위 관 이런거 다 던지고 오로지 실력과 국민을 위한 충정 그리고 열정을 가진 사람으로 다시 시작할 것 이라며 민주당의 이재명이 아니라 이재명의 민주당으로 만들어 갈 것 jTIvIska8i
16960,대장동 사건으로 이재명 예비후보의 지지율이 급락하고 있는 가운데 민주당 지지자들과 국민들 사이에서 후보 교체론이 떠오르고 있습니다 후보가 교체 된다면 선생님께선 민주당 후보로 누가 되어야 한다고 생각하십니까 가나다순 
16965,똑똑한 국민 올바른 국민들 이라면 적페대상 언론들이 윤석열 뒤에 딱붙어 뛰우기에 속지 마십시요 마치 윤석열이가 지지도가 높은것 처럼 대서특필 하는데 국민들 대부분은 이재명을 지지 합니다 일을 잘 할줄아는 이재명은 한다면 꼭실천하는 과거부터 약속을 지키는 사람 입니다
16972,이재명 대장동 의혹 사과 국민 마음 읽기 부족했다 mIlbOszBzd
17008, Jaemyung_Lee 국민들의 목소리를 꼭 기억하세요 이재명후보님 응원합니다 이재명은합니다 우리도합니다
17019,국민의힘 김건희는 주식사기 민주당 이재명은 주식강의 화천대유는 누구꺼 국민의힘 게이트 많고 많은 후보중 내가 제일 잘났지 이래도 안 넘어올래 와이스트릿HL Gc1A6FiNsd via YouTube
17061, Jaemyung_Lee 말씀이 감동적입니다 국민의 삶만 보입니다 누구의 편도 아닌 국민의 편만 들겠습니다 대통령이 되셔도 국민을 위한 선한마음 잘 간직해 주세요 이재명은_합니다 제_20대_대통령이_되시길 
17079,국민들은 이재명당 폭망시키겠자는데 
17081,주디 그만 털고 후보직 사퇴하고 꺼지라고 이 사기꾼 새끼야 RT ohmynews_korea 이재명 새벽 반성문 국민신뢰 잃어 새로 시작 이재명 더불어민주당 대통령 후보 소중한 기자 x0UKM66DPm
17084,세금 갖고 장난치면 역풍 맞는다 안철수 전국민 지원금 철회한 이재명에 돈 내놓으라고 정부 핍박하더니 출처 조선비즈 네이버 뉴스 HVaOChANy6
17090, 전체적인 프레임이 잘못 형성돼 있는데 이게 또 언론 때문이다는 것은 호소력이 없다 대장동 이슈에 갇혀 있는 상황을 넘어서야 국민의 귀에 이재명의 이야기가 들리기 시작할 것이다 그는 선거는 이슈보다 이슈를 다루는 태도가 더 중요하다 고 덧붙였다 Ymx5zSzSRq
17091, 반면 이재명 후보는 자기의 정치적 근거지인 인천경기 지지율 37 4 35 7 35 1 을 보면 3주 연속 빠지고 있다 기타 후보 지지율도 국민의힘 후보가 확정되면서 줄어드는 경향을 보인다 결국 대부분 지지자는 마음의 결정을 내렸고 부동층만 남았다고 봐야 하는데 지지율의 퀄리티가 문제다 
17112, someday0912 국민을 위한 대한민국이 아니라 이재명을 위한 대한민국을 만들겠다는 말처럼 들립니다 정말로 위험하고 대통령이 되서는 안되는 사람입니다 사람이 아닐수도 있겠군요 
17119,이재명 대장동 의혹 사과 국민 마음 읽기 부족했다 다음 뉴스 ZzMBGlDSpc
17125, patriamea 전혀 국민섬길자세 준비도안됨 아픈상처 광주분들께진실성없는 사과쇼 폭탄주 본인이덮고 은폐한수사껀들 김건희주가조작 김명선여러건위조 가짜 최금순양평땅기타 많은비리안고 거짓으로 공정을외치는 파렴치한 역시준비된 민주4기대통령 이재명혼자 이곳저곳뛰는 검찰언론개혁적임자 민주4기대통령
17146, 대장동 늪 빠진 이재명 지지율 탈출할 수 있을까 국민기대는 100 공영개발이고 그걸 못한 책임을 이재명이라는 공익의 대표자에게 모두 묻고 있다 출처 세대공감 블로그 VGh8FgpCul
17147,이 새끼들이 말하는 국민은 도대체 누군거야 국민 70 가 대장동 몸통을 이재명으로 생각하고 특검이 필요하다고 말하는고 있는데 뭘 판단에 맡겨 개새끼냐 우상호 대선주자 겨냥한 특검 반대 국민 판단에 맡겨야 다음뉴스 TG2CisNemv
17169, Jaemyung_Lee 지지합니다 응원합니다 더 좋은 국민으로 화답하겠습니다 새로운 대한민국 이재명은 합니다 홧팅 
17180,홍영표 김종민은 이낙연 등판하면 이제는 정면에 올려놓고 쓸 수 없는 말이 되었다 민주당을 버려야 살 수 있는 상황인데 이재명을 저렇게 묻히고 다니면서 일반 국민에게 차별화를 홍보할 수 있나 무릎으로 기어다니며 국민에게 용서 비는 쇼나 하고 다녀야지
17184, lt 논산 화지시장에서 시민분들을 만났습니다 제 손을 꼭 부여잡고 격려해주시는 시민분께 더 좋은 나라로 보답하겠다고 약속드렸습니다 제 눈에는 국민의 삶만 보입니다 제 앞에는 국민의 미래만 있습니다 누구의 편도 아닌 국민의 편만 들겠습니다 이재명답게 하겠습니다 gt eseEfXoFEo
17185, cmcApKLVvDpeTqg 이재명 특검수사 국민판단 찬성 70 다 대장동 공범 50억클럽멤버 우상호 적폐놈아 
17186,이재명이 민주당을 지적하며 당내 인사들의 흠결은 감싸기에 급급했다 고 했다 그 흠결 중 가장 대표적인 게 너예요 추미애 이해찬 송영길 지도부 체제의 민주당을 봐 이재명 감싸기에 급급했던 결과가 국민에게 신뢰를 잃은 지금의 민주당이 된 것이니까 그러면서 거듭나겠다 그만 좀 속여라 
17195, c584637 bears181818 국민이 목숨 받쳐 만들어낸 당인데 그곳을 훔쳐 혼자 이득 보니 눈에 뵈는게 없는 미친놈 이재명 선혈의 피 앞에서 자신을 내려놓아도 부족할 판에 민주주의 민 자도 모르는 무식한 놈을 왜 민주진영이 받나 국힘에나 가라
17198,이재명 민주당도 새롭게 태어나면 좋겠다 민주당은 국민의 신뢰를 잃어 거듭나야 한다 헐 민주당 박수회 일당들 이해찬과 송영길이 이재명만을 위한 부정경선 했기 때문인데 남 애기하듯 하는구나 이재명은 뻔뻔한 해명 보다 사과를 먼저했어야 했고 이제는 사과 보다 후보직 사퇴해야지 2av3ix3Rsg
17201, actormoon 이인간은 국민을 섬길자세가안됨 역시준비된 민주4기대통렁 이재명 이재명은 어떠한환란속에서도 묵묵히 해내었고 할겁니다 가슴에멍이든체 자식과남편 아내가족을잃은 광주에아픔상처분들을 진실성사과가아닌 쇼사과후 폭탄주거짓말 참순준낮고 저런자를후보로내보낸 국짐당은 뼈저린반성이필요함
17204, c584637 국민 이재명의 민주당 박살낼 것 
17205,안철수 전국민 재난지원금 철회 이재명 대국민 사과하라 출처 데일리안 네이버 뉴스 7CJe0Hs8zE
17206,여의도 셈법 잘 생각들 하셔라 여의도 셈법이었으면 노무현은 김영삼을 따라갔어야 한다 국민을 보고 큰 정치를 해야 하는 상황에서 이재명과 한 묶음으로 보이는 행보 이중첩자놀음이라고 지금 양해해달라는 것인가 누구에게 
17210,이재명의 반성문인가 임기응변인가 욕설 등 구설수에 해명보다 진심 어린 반성과 사과가 먼저여야 했다 대장동 의혹도 내가 깨끗하면 됐지 하는 생각으로 많은 수익을 부당이득에 대한 국민의 허탈한 마음을 읽는 데에는 틀렸다 news articleView html idxno 3941
17219,2022년 혈의누 피바람의 시대는 보수파의 재건과 도약 복수혈전이 기다린다고 봐야겠지 오히려 이 광경을 기다리거나 원하는 국민들이 증가하고 있다는 것이 더 큰 관심사야 민주당이 이재명과 송영길과 함께 완전한 쓰레기 개차반 집단으로 변했기 때문이지 역사는 수레바퀴로 돌고돌아 다시 그자리로
17225, 적폐 이재명에 속을 국민 많지 않다 이낙연 측근 이상이 민주당 사라질 수도 당 내부 자체에 혁명적 변화 절실 지금이 교체 적기이니 민주당 정치인 용기 내라 맞아요 민주당 침몰 중이예요 MjDPI9sSwV
17247, Jaemyung_Lee 혼자서 노젓기 힘드시죠 지지하는 국민들이 함께있으니 힘내십시오 
