tweet,date,retweets_count,link
딱히 심상정의 당이 뭘 잘할 거라는 기대는 엄청나게 없어요 근데 까놓고 보면 민주당이랑 하는 짓이 고만고만할 거란 정도 이쪽으로 바뀌어도 세상은 무너지지 않고 오히려 여성 이슈나 노동 이슈에 대해서 그냥 무시하고 부동산이나 해쳐먹자고 이런 태도는 안 나오겠거니 하는 부분 ,2021-11-21,0,https://twitter.com/misaki3031/status/1462308503985405952
윤석열이 종부세는 세금 폭탄이라고 허위 사실로 선동하고 있다 민주 사회를 위한 변호사 모임 시가 20억 아파트의 소유자 70세 보유기간 10년인 경우의 종부세는 많아야 25만 원이다 정의당 심상정 의원 집 부자들 대변하며 부자 감세에 앞장선 후보로는 대한민국 부동산 문제 영원히 해결 못 한다 ,2021-11-21,11,https://twitter.com/leesk0104/status/1462212426443542533
20 30여성들이 심상정 뽑으면 뭐하나 40 50대 기혼 여성들이 오로지 부동산 문제 때문에 집권당 바꿔야 한다고 국민의 힘 뽑는다고 함 버는 수입으로 건보료 책정한다는 미친 인간을,2021-11-20,1,https://twitter.com/dl_HNRS/status/1462002141808103428
 국민 채점단 이재명 윤석열 박빙 승부 부동산 민심 잡을 공약은 BM5MioQJLw 이재명 후보 54 0점 윤석열 후보가 53 8점입니다 안철수 후보 51 8점 심상정 후보 50 5점입니다 집주인으로 가장 만나고 싶은 후보는 누군가요 이재명 후보가 26 4 윤석열 후보 20 9였습니다,2021-11-20,2,https://twitter.com/sks4147/status/1461722718148042758
의정부 캠핑장 서창녕 신영규 심상정 박루피 사빈 성지현 부산 부동산 강병식 고령 조건만 남 경산시 부동산,2021-11-19,0,https://twitter.com/j3T5EvwOoypjUmU/status/1461435886693138433
 누가 부동산 투기 잡을 상인가 우리 시민들께서 가장 궁금해하십니다 좋은 종 또 세 vs 나쁜 종부세 폐지 vs 이상한 국토 보유세 중에서 여러분은 무엇을 고르시겠습니까 0Y4thuVQs2,2021-11-16,7,https://twitter.com/sangjungsim/status/1460525629766795264
시민들은 이런 폭탄 좀 맞아봤으면 좋겠다 고 합니다 막대한 불로소득에 세금은 눈곱만큼 그야말로 조세 불평등 주의입니다 윤 후보는 부동산 문제는 시장 문제라고 하는데 아닙니다 부동산은 철저히 정치와 의지의 문제입니다 집부자들 종부세 부담 경감이 윤 후보의 목표라면 집값부터 잡기 바랍니다 ,2021-11-15,17,https://twitter.com/sangjungsim/status/1460152700843139072
윤석열 후보가 종부세를 없애버리겠다는 취지의 글을 올렸습니다 지난주 봉하마을서 다정한 서민의 대통령이 그립다 고 하더니 집부자에게만 다정한 대통령이 될 생각인가 봅니다 집부자들 대변하며 보유세 흔들고 표 계산하며 부자감세하는 후보로는 부동산 해결 못 합니다 ,2021-11-15,60,https://twitter.com/sangjungsim/status/1460152696669757442
