,tweet
3755, 김동연 심상정에 안철수 힘 좀 합쳐라 어차피 니들끼리 해봐야 당선 근처 어림도 없어 각자 정책과 비전 내걸고 단일화 해라 각자 가진 전뮨성과 지지층이 있고 Gpe8OAHTNV 공통의 메시지로 뭉쳐 1명이 나온다면 중도층에서 비호감 재들 아닌 3후보 먼저 선택한다 시작은 20대 여성
3757,후보들중 세계화를 추진하고 미래비젼을 제시하는 사람 서울시장을 당선시켜서 정권교체의 디딤돌을 만든사람 시대교체를 이룰 사람이 안철수후보다 단일화를 말하는 것은 양당중심에서 벗어나지 못한말 차분하게 국민들에게 다가가면 두자리수 지지율도 가능하고 3자대결도할수있다 lt 이태규의원 gt ZP0hpS017B
3765, SamSpadeInHell 아 그리고 안철수가 먼저 윤에게 광팔듯 단일화 제의하면 나는 윤석열 뽑을거고 울가족 모두 윤석열뽑을거임 이것도 박제해 
3766, SamSpadeInHell 안철수가 윤석열보다 먼저 단일화 이야기하면 난 탈당할것이고 더이상 안철수 지지하지 않을게요 박제해 
3769,예 완주 응원해요 안철수가 단일화 운운하면 꼭 밟아 주세요 그때가서 딴 소리 하지 마시고요 
3777,그러니까 당신들이나 안철수는 단일화 어쩌구 해도 되는데 윤석열이나 윤 지지자들은 단일화 말하면 아구창을 날린다는 말이네 욕하다가 닮아간다고 안빠들 내로남불도 만만치 않네그려 
3788, 이슈 amp 직설 대선 최대 변수는 단일화 심상정 안철수 일단 완주할 것 출처 SBS Biz 네이버 뉴스 27kPNKhJXK
3790,며칠전에 안철수가 심상정 김동연과 단일화 어쩌구 하지 않았나 안빠들 안철수에게 아구창 날리는거야 
3827,윤석열 박근혜 시대로 회귀 이재명 20대 남성 눈치만 보는 포퓰리스트 심상정 4 9퍼센트 안철수 4퍼센트 이러다 또 민주당으로 단일화하라는압력받겠지 2022 대선은 도대체 어디로 가는건지 하아 
3838,난 안철수 보다 심상정이 단일화 할지가 더 궁금함 
3867,단일화는 무슨 안철수는 당대당 통합같은 망상 부리지 말고 그냥 나홀로 국힘 입당을 하던가 완주를 하던가 알아서 하는 게 좋다 
3877,여차하면 안철수는 윤석열과 단일화할 것 사실상 끝난 게임 배우자를 범죄자 만들려고 을 떨어봐야 편집증 환자나 그걸 믿지 역효과나 날걸 
3880,단일화를 하든 하지 않든 안철수 찍는다 민주당 재집권 시킬 윤은 찍지 않는다 
3923,심상정 하고 단일화 하면 윤석열도 안철수랑 단일화 할테고 양자 대결에서는 윤석열이 50 가 넘어 등신들아 
3945, B5944Xr5JuR1rc1 휴 다행이네요 저렇게 지지율이 벌어졌으니 더이상 안철수가 표를 분산시킨다느니 단일화니 이야기는 절 대 안하겠어요 너무좋다좋다 우리 안철수는 괜한 애국심과 애민심으로 정권교체를 위한답시고 갈등하지 말고 끝까지 끝까지 완주합시다 단일화 이야기 꺼내면 국짐 수꼴통들 디진다 
3952,대선 최대변수는 단일화 게임 심상정 안철수 일단 완주할 것 fLWiZ9PYZR
3959,청와대 나는 각하다 나는 LAW다 나는 왕세자이다 제20대 대통령 선거 정치통합당 신전호 1968년생 후보자가 윤석열 이재명 두후보가 가위바위보 이기거나 제비뽑기하여 뽑힌 후보자가 신전호후보자에게 단일화하면 안철수후보는 합류하는 정치시나리오를 힘겨루기 위아래 아는 협의하여 진행하십시요 44J9zLU77a
3964, lt 윤석렬 gt 윤석렬은 정권교체를 바라는 다수 국민이 직접 선택한 것 김종인 불러들이면 득보다 실이 많을 것 대선승리는 안철수와의 단일화가 필수 김종인할배와 준석이는 걸림돌에 불과 
3975, lt 윤석렬선대위 gt 김종인이 들어오면 안철수 홍준표와 원수가 되고 이준석의 힘을 안빼면 안철수와의 단일화는 물건너 간다 
3979,안철수 김동연 단일화 질문에 힘 합칠 여지 있어 다음 뉴스 xo4RysqLhu
3994,일단이 아니라 끝까지 완주 한다 헛물 키지 마라 가 짖어도 간다고 대선 최대변수는 단일화 게임 심상정 안철수 일단 완주할 것 출처 조선일보 네이버 뉴스 D1RC1cS8Od
4021,개가 짖어도 간다 안철수 심상정 김동연 제3후보 단일화 셈법은 출처 MBN 네이버 뉴스 sC5Ikhxbm0
4022,흠 흥미로운 얘기를 들었어 이재명과 윤석열의 실제 지지율은 5 가량의 차이인데 15 의 차이라고 연일 발표되는 이유가 윤석열과 안철수의 단일화 저지로 윤의 단일 선거만이 이재명이 우세할수 있다라는 시나리오 때문이라는군 현재 발표되는 여조도 조작이라는 군 어디서 들었어 저 쪽 
4038,안철수 김동연과 단일화 힘 합칠 여지 있다 AXZWM7ylip
4039,윤석렬 김종인 이준석으로 하여 안철수 홍준표와 척을 지게 되면 선거도 어려워진다 두사람을 버리고 단일화를 통한 국민을 택하라
4040, lt 윤석렬선대위 gt 김종인이 들어오면 안철수 홍준표 와 원수가 되고 이준석의 힘을 안빼면 안철수와의 단일화는 물건너 간다 
4046,막산꼬점양아치를 떨어트리기위한 단일화 그것만 동의한다 범여권 단일화는 수면 아래로 안철수 김동연과 힘 합칠 여지 있다 다음 뉴스 6EtbxmisSb
4048,범여권 단일화는 수면 아래로 안철수 김동연과 힘 합칠 여지 있다 EB0IqDnOqw 범여권에 안철수심사짜김동연이 왜있어 글고 허경영 미만 잡 으로 해주자 애들 괜히 돈만 쓰잖음 이제 곧 교체 될 이낙연후보 윤석열안철수혀경영 까지만 여론조사 돌리고 토론회를 하자 
4064,윤석열과의 후보 단일화에 안철수 그쪽이 양보해라 나는 완주한다 vLYi9Utkcj
4068, 윤 신동아 단독인터뷰 종인할배 그냥 들어와 제3자훈수는 언제나 있어 한사람의견 구조 NO 여러사람 의견 구조 YES 종인할배 비선 문고리3인방 비교 다선중진 직함있는분 비선아니지 안철수단일화 아직 말할때 아냐 8BCzuqoAOR
4069,범여권 단일화는 수면 아래로 안철수 김동연과 힘 합칠 여지 있다 다음 뉴스 Ri532kkRIs
4078,제3지대 정치권도 바쁘게 움직이고 있습니다 정의당 심상정 후보는 민주당과의 단일화 가능성에 거듭 선을 그으며 이번 대선은 3자구도라고 했습니다 국민의당 안철수 후보는 김동연 전 부총리와 힘을 합칠 여지가 있다고 했고 완주 의사를 강조했습니다 SB52dn7PXl
4083,NO 범여권과 심상정과 안철수 단일화 반대 새로운 물결 TuunuXfUoh
4087,안철수 입장에서는 단일화가 의미 없다 국민의 힘당이 대선에서 지면 아예 폭삭 망함 사실상 안철수한테 마지막 기회가 대선 이후 열리고 국민의 힘당 대선에 기여한다고 지분을 줄 일도 없음 
4097,범여권 단일화는 수면 아래로 안철수 김동연과 힘 합칠 여지 있다 출처 파이낸셜뉴스 네이버 뉴스 hBCnT7LVNT
4098,범여권 단일화는 수면 아래로 안철수 김동연과 힘 합칠 여지 있다 출처 파이낸셜뉴스 네이버 뉴스 WMHwIgdspU
4119,지지율 15 만 끌어올리면 1 1 다이다이 붙어도 안진다 윤석열과의 후보 단일화에 안철수 그쪽이 양보해라 나는 완주한다 s3Iugk596I
4124,안철수 김동연과 단일화 힘 합칠 여지 있다 다음 뉴스 yhgbsfZj64
4141, 인터뷰 심상정 이재명과 후보 단일화 가당찮아 민주당과 연정 없다 민주당 개혁열차 이미 탈선 차악으로 힘 모으자는 논리 안 통해 안철수 김동연과 제3지대 연대 양당 체제 종식 공조 거기까지 drCz8ZDUjK
4168,김동연이는 당을 만들기는 했나 당이름은 뭐지 뇌물종인이 좋아하는 모양이던데 킹메이커 김넝감을 상왕으로 모시지 그러냐 안철수 김동연과 단일화 힘 합칠 여지는 있다 다음 뉴스 F53TFHFb6e
4178,윤석열과의 후보 단일화에 안철수 그쪽이 양보해라 나는 완주한다 DBmttFWJeO
4188, cheolsoo0919 대한민국 정치 변화를 위해 이 보다 더 나은 다른 방안이 있을까요 세 분의 단일화로 선거를 치르는 과정에서 양보와 권한 분배 등의 안으로 세부적으로 협치하실 수 있지 않겠습니까 존경하는 안철수님이 선봉장이 되길 바랍니다 긴 글 읽어 주셨어 고맙습니다
4196, 가 짖어도 사생결단 전력투구 우리는 끝까지 간다 안철수 김동연과 단일화 여지는 있다 출처 더팩트 네이버 뉴스 vuqsN5LpU8
4198,나는 이제 정의당에 관심을 갖지 않을겁니다 무운을 빕니다 심상정 단일화 없다 이준석 안철수와 단일화 필수조건 아니다 다음 뉴스 XMzhsuVwh7
4200,안철수 김동연과 단일화 여지는 있다 다음 뉴스 Ootz8UUcYq
4216,김동연과 단일화 질문받은 안철수 제안 없어 힘 합칠 여지 있어 다음뉴스 CCfYfGENlo 안철수가 정치 입문 초기에는 박원순에게 양보도 하는 등 진보적인 면이 있었는데 결국 독과점으로 큰 중소기업 대표 출신이라서 우파쪽으로 기울었다 
4234,안철수 김동연과 단일화 힘 합칠 여지는 있다 다음 뉴스 wUHTHwzLvm
4239, 로컬투데이 심상정 이재명과 단일화 NO vs 안철수 김동연과 단일화 YES 3KB3VY0jt9
4245, jsk437 예 단일화 없이도 최소 10 많게는 20 차이 정도로 이길거로 봅니다 안철수는 단일화 잇슈 아니면 뭐 할게 없는 형국이고요 
4248,안철수가 심상정 김동연과 단일화할 수 있는 정치력이 있다면 희망적인 것이겠지 그정도 정치력이 있던 시절이 없었잖냐 
4270,안철수 김동연 단일화 질문에 힘 합칠 여지 있어 출처 이데일리 네이버 뉴스 7mLoMzQ8Vd
4288,김동연이도 똥연이가 되는구나 안철수 김동연과 단일화 힘 합칠 여지는 있다 다음 뉴스 bbl5KtoD3Y
4292,안철수 대선 완주할 것 당권 없는 이준석 말 신경 안 써 출처 데일리안 네이버 뉴스 7vlJxDX7sK 너무나 당연한것 아닌가 단일화 완주니 뭐니 이딴말 입에 담지도 말라 이런것 계속해서 짓거리는 것들이 안철수에겐 송충이 같은 존재들임 2KeEWZfbmz
4299,안철수 김동연 단일화 질문에 힘 합칠 여지 있다 출처 SBS Biz 네이버 뉴스 PHWjuIVDkY
4300,대신할수 없는 미래 시사뉴스 안철수 김동연과 단일화 질문에 힘 합칠 여지 있어 Zz3AJOeO6a
4304,안철수 김동연과 단일화 힘 합칠 여지는 있다 다음 뉴스 ny9107qgJL
4305,안철수 김동연 단일화 질문에 힘 합칠 여지 있다 다음 뉴스 zpuXYJ2yXZ
4310,안철수 김동연과 단일화 가능성에 힘 합칠 여지 있어 출처 이데일리 네이버 뉴스 JGP8Xp2pZB
4314,안철수 김동연과 단일화 질문에 힘 합칠 여지 있어 5Y0YUnkZvs
4322,안철수 김동연과 단일화 힘 합칠 여지는 있어 w39sDaAriA 안철수 대표는 사퇴하는 것이 옳다고 본다
4337,안철수 김동연과 단일화 힘 합칠 여지는 있어 다음뉴스 bBZi829rkl
4383, 니네 같으면 단일화 하겠니 랭킹쇼 심상정 안철수 단일화일까 완주일까 출처 매일경제 네이버 뉴스 ok4IF7sIsF
4390, cheolsoo0919 안철수 후보님 지지한 지도 벌써 3년이 넘어가네요 서울 거주하는 20대 남 입니다 중도확장성을 대표하시는 대표님 총선부터 국민의 당을 강력하게 지지해왔으나 서울시장 선거 과정에서 결국 단일화를 진행하실때 많이 실망하고 지지를 철회했습니다 현재 서울 및 경기 2030에게 주어진 선택지는
4393,브로커 야당 자금이 자신 돈으로 망상 한다 공적 자금 개인 재산도 구분 못하니 깡깽이와 소수 빨갱이와 썸을 뛰어 넘어 동조 내지 공범인 것은 아닌가 윤석열 대통령 후보가 20 이상 압승하게 만들 수 있게 브로커 출당 시키고 종인이 아예 버리면 된다 안철수에 허리 굽혀 단일화 해야한다
