,tweet
42,김종인이 내부 막말 단속 이상의 월권을 행사하려든다면 윤석열 입장에서는 같이 안하는 게 맞겠지 차라리 안철수랑 단일화를 하는 게 더 이득일듯 
82,잘 하는 짓이다 이준석 팽시키고 권성동 장제원이 당을 개편 혹 국민의 당 안철수와 단일화 윤석열 김종인 총괄선대위원장 임명 보류 이상 기류냐 일시 연기냐 8mhav55vnf
91,KBS NEWS 안철수 후보에게 듣는다 후보 단일화에 대한 입장은 youtube com 안철수 안철수 제3지대 정책 공조 시작할 수 있다 KBS 2021 11 20 U7TouSsNlS
122,제3지대 단일화는 반대하지만 안철수후보가 제안하는 쌍특검은 환영합니다 lt TV조선 패널 gt 정의당과 단일화보다는 정책연대를 하자는 것입니다 1qevceTXtM
173,하나의 메시지가 나올 수 있는가 좌는 좌로 우는 우로 향해야 한다 적어도 좌는 우와는 분리되고 독립되려는 생각을 해야만 한다 좌파가 우익에 붙으려고 한다면 그것은 진보진영에 대한 저열한 배반이나 다름없다 그것을 부추기는 것이 옳은가 2012년 민주당이 왜 안철수와 단일화했음에도
268,때문에 그렇게 된다면 결국은 국가의 미래가 위험해 질 수 있기 때문에 바꾸려는 것이 가장 크고 대선과 관련해서 많은 방해를 받거나 꼭 필요한 안철수 후보와의 단일화 등에 절대적으로 장애물이 되기 때문에 합당을 통한 단일화로 당대표를 교체해야 한다는 것임 이건 반드시 필요한 것임 
283,현재 대선 판도에서 가장 중요한 안철수 후보와의 단일화가 사실상 불가능에 가까워지기 때문에 안철수 후보와의 합당을 통한 단일화로 이준석을 당대표 자리에서 내려오게하는 방식으로 단일화를 진행하는 것이 필요하다고 이야기 하는 것임 이게 이준석의 부정적인 영향을 제거하면서
342,심상정 안철수 조건 없이 만나자 공조 제안 단일화에는 선을 그으며 양당 체제 종식과 시대 교체를 위해 어디까지 함께 하고 어떤 노력을 할지 적극적으로 대화를 시작해보자는 의미라고 설명 BvPKxtXx5I
347, MVNMEujsdIPIu5T 안철수와 단일화를 예상한 건가요 두명이 보이네요 
397,안빠님들 적당이들 하세요 어자피 안철수 윤석열 단일화로 갑니다 나중에 어쩌실려고 
443,이준석의 방해를 막기 위해서는 반드시 합당을 통한 안철수 대표와의 단일화를 통해서 이준석이 선거 후에 다시 당을 장악하거나 당대표 직으로 복귀하지 않을 것이라는 것을 실무진들과 사람들에게 알게 해야함 그리고 빨리 여의도 연구원장을 교체해야함 
456,여기서 이준석 쫄따구다 한마디로 어른들 말하는데 네 네 하고는 얼버무리고 말것이다 안철수 김한길 택도없는 소리 적이다 지금 철수는 죽는한 있어도 단일화 없단다 AnD3VL6OOy
521,그사람들이 프로 근성이있어 기대해봐야지요 안철수 중심 단일화 정권교체 꿈
575,정치평론가들 나와서 떠드는 거 보면 진짜 아무말대잔치여 인물도 참 없다 정치텔링 후보 단일화 가능할까 이재명 승리 공식은 안철수 qlBYZlF552
576,이재명 안철수 단일화에 대한 이야기가 나오누 민주당 조차도 이재명을 부담스러워 한다는 이야기인가 그럴리 만무하지만 혹 그러던지 말던지 안철수는 민주당을 법에 의거해서 원칙적으로 대할테니 너무 기대하지는 말고 
580, 정치텔링 후보 단일화 가능할까 이재명 승리 공식은 안철수 gycI7GLRXI
591,윤석열 대통령 후보는 내가 트윗에 썼듯이 깡깽이와 소수 빨갱이 플랜 B나 플랜 C가 있어도 모든 대체 플랜을 강력히 격파할 것이다 윤석열 대통령 후보는 압승 할 것이다 당원이 출당 시키는 애는 당원의 뜻 받아들여 당원들의 선택을 받아들여야 한다 압승 하더라도 안철수와 단일화 해야 한다
598, 정치텔링 후보 단일화 가능할까 이재명 승리 공식은 안철수 X6o7tk9hxB
679,근데 난 이거 응원하는 입장인데 저 셋이 단일화하면 가장 유의미한 지지율을 보이는 안철수가 단일화를 안한다는 의미고 난 어차피 심상정의 지금 포지션에 별 불만이 없음 그양반들은 심상정 없어지면 투표포기나 민정당뽑을거라서 
700, OhmyNews_Korea 안철수후보님 문재인정권 심판이 정치 목적이아니라 본인의 정책적 가치 실현을 위해 뛰어 주세요 제발 양보니 단일화니 그런 쇼 좀 이젠 그만 그럼 당신의 정치철학은 사장되는 거에요 미래먹거리 애기하면서 국짐의 과거기득권에 몸을 맡긴다 
732,윤석열후보는 智 德 勇 삼박자를 갖춘데다 품격 정직 화술까지 탁월하니 대선민심 쏠릴 수밖에 없다 선대위 구성도 담대함과 포섭력 돌파력으로 관철했다니 극치의 용인술이다 장재원의원은 대여 일당백이니 중용 당연하고 홍준표의원은 삼고초려로 영입해야 하며 안철수대표와의 단일화는 숙명이다 
742,이미 도망친 패배자가 다시 대선판에 뛰어들었다 안철수도 자신이 당선될 거라고는 생각지 않을 것이다 자신의 정치 경력을 위해서는 대선 막판에 될성 부른 후보에게 단일화 해주고 총리 따위 약속 받고 차후를 도모하는 것 쯤일 것이다 
773, 오히려 만약 심상정 안철수 김동연이 정당 간 연합정치와 후보 단일화에 합의하면 어떤 일이 일어날까를 물어야 한다 지금보다는 더 재미있는 일이 벌어진다 그런 식으로 제3지대에서 서로 맞지도 않는 세력끼리 뭉쳤다가 개박살난 전례가 있죠 바른미래당이라고 zj1563mswa
777, 양당 기득권 독재 종식 시키는데 못할게 뭐있냐 진정한 다당제는 숙명이다 중도당이 못할게 뭐있냐 솔직히 골수들 빼고는 가능한거 아닌가 제3지대 단일화 물꼬 틀까 안철수 심상정에 특검 공조 제안 이투데이 lsg0bMknYm
817,그럴싸한 개소리도 정도껏이지 대체 3지대 단일화에 무슨 의미가 있는지 모르겠다 7BE4Jcw81T 민주당하고 연정하면 진보 아니고 안철수랑 단일화하면 그래도 진보인가 아무리 우리가 하찮아졌어도 이런걸 받아들일 순 없는거다 압도적인 투표거부로 의사표시를 해야한다 
870, 메타벌스 안철수 대통령후보 11시에 쌍특검관련 기자회견를 합니다 그러기전에 지금 우리 폴리버스 에서 마당을나온아재님과 40대분과 열띤 토론중입니다 말씀을 요약하면 단일화 없이 가야만 이 나라가 위기를 벗고 경제 도약을 할 수있다는 대세론이다 즉 정권교체만 목적 되선 안된다는것
885, 5공때 뇌물 쳐먹고 빵 갔다온 전과자랑 잘해봐라 이젠 단일화 하자고 징징거리진 않겠구나 다시한번 안철수 부글부글해하는 尹측 꽤 있다 승리 뒤 갈등 김종인 선거사 출처 중앙일보 네이버 뉴스 e0ujsuw6Fi
1143,최명길 배우 배우자분이야 갓종인과 사이가 나쁜 안철수 후보와 단일화하는 데 써먹을 수 있겠지만 짭종인 코스프레하시려다가 망한 양산형 비대위원장은 대체 용도가 몰까 궁금 
1192,나라 망처 온 사표심리만 없어지면 안철수가 대통 될 수 있다 역시 정신 승리 밖에 바랄 게 없나 사표심리는 안철수도 동의했던 거 그래서 국민 뜻대로 비례나 결선투표제 도입도 주장했고 보궐 때 단일화도 외쳤던 거지 거지같은 정치제도 떄문에 국민한테 선택의 여지가 없는 거지 
1382,심상정 안철수 단일화하면 이재명 제낄 수 있겠는데 와 이재명은 합니다 
1522,김한길 국힘행 안철수 흔적 묻어있는 걸로 대접만 받을 게 아니라 안철수로 단일화하는 반전 드라마 만들어서 구국의 영웅이 되어 보시기를 
1533, 라민기자의 시선집중 보매 윤석열의 자기우월감은 병적수준인것 같다 만사가 다 자기에게 복종되여야 한다는 식의 사고로 안철수더러 단일화의 희생양이 되라고 은근히 강박하고있으니 말이다 그러니 안철수가 윤석열은 덜 익은 술 이라며 발끈할수밖에 
1585,잠깐 짬 내서 댓글 달고 왔습니다 대전환기 대통령 선거에서 정권교체 단일화 프레임이 통한다는 게 다시 5년의 불행을 말하기에 마음이 아픕니다 아는 만큼 보이기에 불행한 일인 D포럼 안철수 수능 내신만의 정시전형 원전과 신재생에너지 활용 9JKWcUULOX 출처 YouTube
1830,지랄들 한다 니네가 뭔데 단일화 여론조사 하고 지랄이냐 안한다고 했는데 이게 정상적인 조사냐 똘아이들 아니냐 MBN 여론조사 대장동 고발사주 동시특검 47 6 안철수 윤석열 단일화 42 9 출처 MBN 네이버 뉴스 sIJnSJEjn0
1837, MBN 여론조사 대장동 고발사주 동시특검 47 6 안철수 윤석열 단일화 42 9 출처 MBN 네이버 뉴스 yqzAtRb3Fe
1860, MBN 여론조사 대장동 고발사주 동시특검 47 6 안철수 윤석열 단일화 42 9 다음 뉴스 eTBcezyq9D MBN이 실시한 여론조사에서 대장동과 고발사주를 동시특검하자는 여론이 47 6 로 나타났습니다 한편 안철수 윤석열 단일화 여론은 42 9 로 나타났습니다
1890, mbn여론조사 lt 국민의힘과 단일화 또는 제3지대 단일화 가능성이 제기되는 안철수 후보의 향방 gt WNzAZeJh8o
1925,안철수 심상정 김동연과 4자 단일화하면 혹시 모름
1942,난 개인적으로 안철수가 이재명이랑 단일화 하자고 붙어 먹었음 좋겠다 그럼 개막장 될텐데 
2018,윤석열 대통령 후보 5자 대결 47 7 당선 가능성 52 2 안철수는 운석열 대통령 후보와 단일화해야 42 9 MBN과 매일경제 여론조사업체 알앤써치와 함께 지난 11월 15일 사흘간 13차 ARS 여론조사 진행 출처 mbn 종인이와 브로커가 파리떼 하이에나라더니 야당 뜯어 먹으려는 것은 니들 같다
2019, 정당지지도 국민의힘 36 더불어민주당 33 태도유보 20 대통령 국정운영평가 긍정적 평가 44 부정적 평가 52 대선후보 관심 사안 이재명후보 대장동 특혜의혹 35 gt 윤석열후보 고발사주 의혹 22 gt 윤석열 안철수 후보간 단일화 16 gt 이재명 심상정 후보간 단일화 7 
2161,열린민주당과 합당이라 좋네 9대1 단일화 같은 결과 뻔한 이야기가 아니라 합당이라면 충분히 이슈가 되겠지 그리고 저쪽 노인의힘에선 대응이라고 한답시고 안철수당이랑 합당한다 소리가 나온다 그런 저쪽은 자중지란 아싸라판 되는거야 
2176,여권은 줄줄이 합당 단일화 할것 밥그릇 사수및 감방 안가려고 지금 양당후보 똑같이 저질이라고 지껄이는 전통 진보 웩 유권자도 지지표명 이어질것 또 여론조사 장난질 통해 오차범위내 접근 언플질 할 것이고 그때도 안철수 지지율 비웃던 윤석열빠들이 그럴수 있을지 궁금 분명 협박질하겠지
2303, sanyacho211 p9wQIRIU20OYvhc 조작당은 뭔 짓을 할 지 모른다니까요 지난번 보궐선거때 보세요 그때도 공정한 경쟁했나요 토론때부터 반칙하고 협상룰 깨고 국민과의 단일화 약속날짜까지 아무렇지 않게 어기면서 안철수 압박했던 좀비집단이에요 오직 국민만 생각해서 양보한 거죠 지금도 정치하면서 가장 긴 밤을 보냈다는
2314,반문짓 하던 안철수 김한길 윤석열 싹다 국힘당 가잖아 안철수는 국힘당 외곽에서 단일화놀이만 하고 반문 이해찬이재명계 미래 모습임
2320, 3i5v4vSuVF 국민의힘 내부를 통합하고 정체성이 크게 다르지 않은 안철수 국민의당 대선 후보와의 단일화 내지는 연대를 통해 힘을 합쳐야 한다 라고 조언했습니다 
2387,전에도 한번 얘기했지만 안철수를 무시했던 김정인 체계에서도 오세훈은 안철수와 단일화했다 야권연대는 후보의 의지가 중요하다 윤석열이 의지가 강력하다면 김종인과 최후에 틀어져도 된다 
2403, ZMW4MdJgqU 양보 단일화 이런 말 주둥아리 닥쳐라 이거야 윤석열 빈쭉정이 이재명 가식과 위선의 결정판 안철수가 최고다 이거죠 
2406, 둘은 영원한 맞수냐 앙숙이냐 그래도 눈 앞에 이권을 두고는 합치는 척 하겠지 이번에는 단일화 정말 안하나 이번 단일화에 안철수의 정치생명이 걸렸다 이준석 李 尹 모두 깐 안철수에 우회전 맞냐 또 수틀리면 좌회전 VPExTViDV1
2428,재산 반 기부해 국가도 버린 소형원전 지원해줘 컴퓨터 백신 전국민 무료화 해줘 드루킹 여론조작 겪어 대통 양보하고 찬조 연설 해 줘 설 시장 경선 승복하고 열심히 유세에 참여해줘 도대체 얼마나 더해야 해 안철수는 왠 야권 후보는 매번 국힘당이어야 해 야권 단일화 하자구 안철수로 
2434,안철수 측 단일화 후보 양보할 생각 추호도 없다 동아닷컴 X1G6aHXpdb
2512,안철수 측 단일화 후보 양보할 생각 추호도 없다 출처 동아일보 네이버 뉴스 uvhCa5JDBh 지금은 2012년이 아니에요 아저씨 2021년이야
2563,안철수 측 단일화 후보 양보할 생각 추호도 없다 agWktPVo3U
2592,안철수 속셈은 선거 막판에 총리정도 되는 자리 약속 받고 단일화 해 준 뒤 총리 경력을 지렛대 삼아 차기를 도모하고 싶을 것이다 그러려면 윤과 이가 박빙의 상태가 되어야 윤이 단일화에 몸이 달테고 단일화 반대급부 쟁취도 쉬울텐데 벌써 이죄명이 고꾸라졌다 이죄명 천하에 도움이 안된다
2605,안철수 측 단일화 가능성 일축 양보할 생각 없어 1vufsxK5Z6
2612,안철수 철수를 안하겠다고 그래봐야 소용없다 이름이 철수인데 c70gqNXW6H 안철수 측 단일화 후보 양보할 생각 추호도 없다 
2648, 전국민 재난지원금 반대 60 1 찬성 32 8 출처 연합뉴스 네이버 뉴스 ZTtW8eQxMo 재난지원금도 재정에 무리가 가니 반대를 하는데 기본소득을 내세워서 이재명의 망언을 덮어주고 국민들이 경악하게 만들겠다고 안철수를 버리고 김동연과 단일화 기자의 소설이겠지 KvQoaz5l21
2711,안철수 측 단일화 다른 후보에게 양보할 생각 추호도 없어 다음 뉴스 3PU1G8jL62
2724,尹 국민통합위원장에 김한길 영입 추진 반문 빅텐트 치나 다음 뉴스 LCTvCjQAH3 김한길 생각만 해도 소름끼친다 80세 노옹과 윤은 오직 안철수 대표에게 피해만 준 인간들로 집합체를 만드는구나 단일화꿈도 꾸지마라 승리도 어림없다
2736,윤석열도 안철수 비판 삼가는데 대깨수준 일부 지지자들이 지지율 낮다고 비웃는걸 보면 참 안철수와의 단일화는 마지막 보험일텐데 
2741,이재명이 이기려면 심상정과 후보 단일화 하고 김동연도 영입하고 안철수도 끌어들여야됨 불가능한 시나리오 
2792,안철수 이재명 윤석열 당선되면 내전 일어날 수도 李 尹 서로 감옥 보낸다 별러 국민통합 불가능 후보가 기소된채 대선 치러지면 전세계적 망신 국힘이 양보하면 나로 압도적 정권교체 가능해 단일화 한다고 내 지지층이 尹에 가진 않을 것 aVzJEqXP2v
2824,안철수 지지자들이 의외로 많다 더불어당이 목에 힘주는 것은 이 점이다 너거들이 둘이 갈라치기 하면 우리한테 못 이긴다는 확신이 들기 때문이고 삼척동자도 그렇게 생각 할 것이다 단일화만이 살 길이고 정권교체의 길이다 안하면 또 5년 개고생 한다 명심하길 바란다 철수야 
2951, chang301411 happymoments56 wonnney 안철수로 단일화되면 현재의 윤지들도 다 우리편이니 너무 싸우지들 마시구요 
3061,요새 제3지대 심상정 안철수 김동연 단일화 정치 플랫폼 이야기 스멀스멀 나오는데 자칭진보라는 사람들한테사도 나오고 중앙일보에서도 나오고 전혀 동의 안되는 기획이지만 누가 이 기획을 시작했을지는 궁금하다 
3101, Nonbinory123 cheolsoo0919 sangjungsim 심상정의 안철수 김동연과의 단일화는 진보정치에도 도움이 안된다고 봐요 차라리 이재명이랑 단일화하면서 정의당이 내각 참여한다던가 아니어도 조건들 걸면 조금이나마 될 수도 있겠죠 지지랑은 별개로 총체적 난국인 대선 같아요 저도 지지후보도 아직 못정했어요 투표는 못하지만 
3154,제3지대 인사들 뭉칠까 안철수 김동연 심상정 합종연횡 0선대통령 양당체제 야권단일화 V0B8lA0M8G
3166, 만약 심상정 안철수 김동연이 정당 간 연합정치와 후보 단일화에 합의하면 어떤 일이 일어날까 rZd1lkx9ty
3250,윤석열 단일화해서 안철수에게 공약 외주해라
3262,이런 상황에서 과거 안철수 대표를 향해 정치적 비판이 아니라 정신이 이상한 사람 이란 식으로 인격 모독성 발언을 서슴지 않고 가했던 그것도 지속적으로 밝혔던 김종인 이사장이 윤석열 후보의 총괄선대위원장 이 된다면 소위 야권 단일화 는 난망이라고 할 수 있다 
3264,김종인이 윤석열의 선대위원장이 된다면 야권단일화도 어렵게 될 수밖에 없다 비록 한 자릿수 지지율을 기록하는 안철수지만 그와의 단일화 없이는 정권 교체 를 낙관하기 어렵다 정확하게 얘기하면 안 대표와 단일화를 이루지 못한다면 대선 승리 는 사실상 물 건너 가게 되는 꼴과 같다 
3270,안철수 단일화 생각 없어 완주해 당선되는 게 목표 url UaKkpYqouH
3272,김동연 심상정 안철수 단일화 대화 주저 안해 이투데이 qRe2mfD1R6 그냥 김동연 당신 갈 길 가세요
3282,제3지대 제발 단일화 하자 두 극단주의 포퓰리스트 후보를 무찌를 한국의 에마뉘엘 마크롱 이 필요하다 그것이 안철수가 될지 심상정이 될지 김동연이 될지는 확실하지 않지만 세 후보가 단일화해서 연립정부를 구성하자고 합의하면 양당에 환멸을 느낀 무당파층을 우군으로 만들수 있다 
3288,결론부터 얘기하면 이는 경선 과정에서 불거진 홍준표 의원과의 갈등 양상을 더 심화하고 안철수 국민의당 대표와의 이른바 야권 단일화 를 내팽개치는 악수 라고 할 수 있다 또 공정 정의 새로움 이란 윤석열 후보가 내세우는 구호의 정당성 을 훼손하는 자충수가 될 가능성이 크다 
3292,이거 심상정 안철수가 제3지대로 후보 단일화해도 못이기겠네 끔찍해
3305, 만약 심상정 안철수 김동연이 정당 간 연합정치와 후보 단일화에 합의하면 어떤 일이 일어날까를 물어야 한다 지금보다는 더 재미있는 일이 벌어진다 l4gQOIFaTl
3315,안철수에 대해 진지한 듯 제발 이번에는 단일화니 뭐니 하지말고 종주하기를 지지자들을 봐서라도 그 양반은 종주할 의무가 있음 
3358, 김동연 심상정 안철수 단일화 대화 주저 안해 국토보유세 원칙 안 맞고 종부세는 강화돼야 이재명ㆍ윤석열 후보혐오에 새 대안 열망 있어 기회의 문 열릴 것 이재명 국토보유세 원칙 안 맞아 윤석열 종부세 완화 보유세는 강화해야 Kg3l9YIKWw
3362, 쓸데없이 단일화 이야기 누가 하고 있죠 아 안철수로 단일화 해야한다는 이야기인가 땡큐 uuFzUfQj3R
3370,안철수 단일화 생각 없어 완주해 당선되는 게 목표 DT2kKmyYYY
3372, 징징 거려도 간다 썩을것들아 안철수 단일화 생각 없어 완주해 당선되는 게 목표 출처 세계일보 네이버 뉴스 xov9fPw0fc
3379,반드시 안철수 후보와 합당을 통한 단일화를 해야하고 당내에서 이것에 반대를 할 것으로 보이는 인사들이나 지위에 있는 사람들을 배제하고 교체하는 것으로 진행하는 것이 맞다고 생각함 안철수 대표도 너무 무리한 요구를 하진 않을 것이라고 생각함 주호영 의원을 통해 진행하는 것을 추천함
3388, 이재명 혹은 윤석열과 제3지대 세력이 단일화를 할까 이 질문은 틀렸다 오히려 심상정 안철수 김동연이 정당 간 연합정치와 후보 단일화에 합의하면 어떤 일이 일어날까를 물어야 한다 지금보다는 더 재미있는 일이 벌어진다 양당 체제 붕괴의 서막이 되진 않을까 0MwUFGSCUP
3395, 이재명 혹은 윤석열과 제3지대 세력이 단일화를 할까 이 질문은 틀렸다 오히려 만약 심상정 안철수 김동연이 정당 간 연합정치와 후보 단일화에 합의하면 어떤 일이 일어날까를 물어야 한다 지금보다는 더 재미있는 일이 벌어진다 QJVHIGLaYv
3398,안철수 단일화 생각 없어 완주해 당선되는 게 목표 출처 세계일보 네이버 뉴스 ytYp9oP4k4
3432, 안철수 단일화 생각 없어 완주해 당선되는 게 목표 출처 세계일보 네이버 뉴스 owAvfciAAo Lb5AZSfVgO
3434,안철수 단일화 생각 없어 완주해 당선되는 게 목표 출처 세계일보 네이버 뉴스 zC3gKHyT7k IsCBJI8kIU
3443,이번 대선은 양당 쓰레기들 거르고 진짜 심상정 김동연 안철수 같은 제3지대 온건파 중도 중도진보 후보들이 단일화 해서 이 중 한명이 반드시 대통령이 되어야 하고 이러한 더불어터진당 버러지 쓰레기들을 대체할 새로운 중도진보 자유주의 정치의 장을 열었으면 좋겠다 
3451,안철수 단일화 생각 없어 완주해 당선되는 게 목표 다음 뉴스 fjpkWuudP0
3454,안철수 단일화 생각 없어 완주해 당선되는 게 목표 출처 세계일보 네이버 뉴스 etLrHhxE61
3455,안철수 단일화 생각 없어 완주해 당선되는 게 목표 세계일보 네이버 뉴스 tqSvvPAuNl
3504,김영환 kbc인터뷰 윤후보에게 2가지 요청을 드렸다 하나는 끝까지 안철수와 단일화를 할것과 둘은 호남을 배척하거나 포기하지 않는것 
3576,시중여론은 정권교체지요 악재가 없는한 80 가 윤석열입니다 안철수 김동연도 훌륭하지만 야권단일화로 국민열망을 외면할수가 없습니다 여당이 아무리 이재명을 대선후보로 극찬해도 여론은 이낙연후보를 낙마시킨 당지도부를 원망합니다 당장 이낙연후보로 교체가 민주당재집권의 정답입니다 
3660,안철수가 국짐당 김종인 역할론에 대통령 선거는 후보가 모든 것을 결정하는 선거다 윤석열 후보가 휘둘리지 않는 모습을 보여야 국민들로부터 대통령감으로 평가받을 것이다 라고 훈수했다 남의 집 사정에 감놔라 배놔라 하는 걸 보면 신경이 온통 단일화협상 떡고물 에 있는 모양이다 불쌍하다 
3684,윤석열이 선대위구성으로 시급하게 끌어안아야할 사람은 뇌물종인이 아니라 홍준표다 근데도 홍대신 뇌물종인을 상왕으로 모시려는 한심한짓을 하는 이유는 막판 야권단일화에 맞닥뜨릴 안철수가 두렵기 때문 윤이 나름 사내다운 놈인 줄 알았는데 폭탄주마실 때나 사내지 정치엔 찌질한 찐쫄장부다
3699,김무성 이준석 김종인에 쓴소리 분열의 리더십 몸 낮추고 숨겨라 라는 기사다 기사 내용중에 안철수 얘기 나온던데 또 단일화 얘기를 꺼냈다 이 인간 안철수 이용해먹으려고 수작부리는군 몸 낮추고 숨겨라는 말이 무서운 말이다 FIjl9yTvGh
3713, Ms4DcocUzW 다자대결 지지율 윤석열 45 6 이재명 32 4 KSOI 윤석열 국민의힘 후보가 45 6 이재명 더불어민주당 후보는 32 4 인 것으로 나타났다 다음은 심상정 정의당 후보 4 9 안철수 국민의당 후보 4 0 김동연 전 경제부총리 1 1 등이었다 단일화는 영원히 깨졌냐 
3732,후보들중 세계화를 추진하고 미래비젼을 제시하는 사람 서울시장을 당선시켜서 정권교체의 디딤돌을 만든사람 시대교체를 이룰 사람이 안철수후보다 단일화를 말하는 것은 양당중심에서 벗어나지 못한말 차분하게 국민들에게 다가가면 두자리수 지지율도 가능하고 3자대결도할수있다 lt 이태규의원 gt 
3733,안철수 심상정 둘이 단일화해서 이번 대선에 나와라 그래서 어디 한 번 보자 잘하나 못하나 
3747,제목도 더럽게 뽑으네 그러니 기레기 소리 듲는거다 쨔샤 대갈빡은 장식으로 달고 다니냐 단일화 안하는거 감 못 잡았냐 그래서 밥벌이 해 쳐먹겠냐 진짜 언론개혁 해야겠네 단독 예비후보 등록도 안 하고 공약부터 발표한 안철수 간 보나 SdMmUsEPp6 뉴데일리
3754,민주당과 단일화 한던 말던 신경 안 쓸테니 제발 안철수에게도 신경 꺼 주세요 인터뷰 심상정 이재명과 후보 단일화 가당찮아 민주당과 연정 없다 다음 뉴스 tAZNuL22V1
