,tweet
231,국힘당에서 26년 정치한 홍준표를 퇴짜놓고 윤석열을 선택한 세력이 어떤 모습일까 생각할수록 박정희의 후광을 생각하고 공대에서 4년간 공부한 지식으로 대통령 직을 수행한 박근혜가 보인다 법대4년 사시 9수 윤석열의 인생에는 법밖에 안보인다 그런데 주위에는 위법이 난무하다 제식구 감싸는 법 
365, 사시 9수보단 낫지 홍준표 또 윤석열 뒤끝 저격 다음 뉴스 kB4dypzlP0
392,홍준표 윤석열이 대통령돼면 대한민국이 불행 대선 참여거부 유승민 백의종군 할란다 참여거부 이준석 내 이름 올리지마라 참여거부 김종인 연락두절 잠적 참여거부 윤석열 자체가 후보가돼면 안됐었다 47bnRG8pP3
426,홍준표가 진짜 이렇게 말했다면 이 잉간 말 중에 거슬리는 건 이회창씨처럼 이란 부분이다 이회창의 병풍사건 같은 일이 조작 중인 걸 알고 있단 말인가 이 잉간이 우파들이 뽑아주자고들 한 대선후보였슴다 윤석열을 뽑더라도 곧 후회할 날 오리란 것도 알고 계시길 대선투표 기권하기도 처음
466,윤석열 침묵 방송사고 일파만파 다음 뉴스 7l8An4xblU 홍준표 전 후보 겸 의원조차 윤석열 후보가 대통령 되면 대한민국만 불행해져 박근혜 꼴 나는거지 본인이 얼굴마담인걸 아나 
621,또라이들이 검사가 되는거야 검사만 되면 다 또라이가 되는거야 검사출신치고 제대로 된 사람같은 새끼가 하나도 없어 윤석열을 위시하여 홍준표 곽상도 금태섭 조응천 권성동 김진태 황교안 이용주 박주선 주광덕 자 이중에 사람같은 새끼 하나라도 있나 보라고 검찰조직은 정말 폭파시키야 돼 
679,우리가 언론이다 정보공유운동 전 민주당쓰레기합류한 3김선대위 외인부대 잡탕밥 홍준표가 해냈다 윤석열 저격수 복귀 선대위는 잡탕밥 역대급 팩폭에 국민의 힘도 아사리판 인증 4vAnuNNXab 출처 YouTube
681,1일1망언 가족비리 본인5건수사 남자박근혜로 불릴 정도의 엄청난 무식을 장착하고 대선에서 완주는 불가능하다는 생각ㆍ 그래서 홍준표가 연일 윤석열을 비판하고 합류를 거부하며 몸풀고 있는듯 
721,국힘당은 멍청한 윤석열이 내쫒고 홍준표 불러라
923,글로벌 포럼에서 멍청하게 1분30초동안 가만히 있었다고 비난비판했더니 강골검사 리더쉽뛰어나 라는 기사가 올라오네 기레기 밥버러지들아 홍준표왈 윤석열이 대통령되면 나라가 불행해진다 라는 말이 맞는것 같다 
978,윤석열 김종인 총괄선대위원장 추대 부결 홍준표 선택할까 브레이크뉴스 ioghsvYgzY
1002,이러면어떨까 같은당에서 서로들싸우느니 국힘에서 윤석열창당해서나가고 민주에서 이재명창당해서나가면 국힘에선 홍준표 민주에선 이낙연 4자 대결하면 정말멋진경선이될텐데 
1006, 국민의당 윤석열 홍준표 여당 야당 대장동 9OS8BSZJ
1019,홍준표와 김종인이 윤석열 졸라 까버려라 
1106, 잡탕밥 이어 홍준표 윤석열 잘 몰라서 3金 체제 동아닷컴 3y9M7HE98a 준표씨 당신은 차기도 글렀네 2025년말에도 찌그러져야 할 것이야 만에 하나라도 준표가 보수의 후보가 된다면 처음으로 기권할 것이다 
1114,준표씨 당신은 차기도 글렀네 2025년말에도 찌그 3y9M7HWimi 잡탕밥 이어 홍준표 윤석열 잘 몰라서 3金 체제 
1268, 국민의당 윤석열 홍준표 여당 야당 대장동 Q1R4SUUIALMBH8H
1341,홍준표 국민의힘 의원이 공약으로 내세웠던 공영방송 통폐합 및 민영화에 대해서는 이재명 심상정 안철수 후보가 반대했고 윤석열 후보가 조건부 찬성 입장을 냈다 홍준표 이재명 심상정 안철수 윤석열 국민의힘 공영방송 공영방송민영화 언론중재법 언론 yVipPQxvMa
1344,아마도 이건 윤석열을 스트레스 테스트 해보기 위해 일부러 꾸민 일 일것이다 봐라 대본없이 입도 못떼는 윤석열이 얼마나 무능하냐 홍준표로 안 바꾸면 내년 대선 물 건너간다 윤석열 지지세력을 어떻게 홍준표쪽으로 온전히 돌릴지가 저들의 전략 Weng92orzm
1383, 국민의당 윤석열 홍준표 여당 야당 대장동 2ZP79U8G
1420,나 진짜 이재명윤석열홍준표가 유력 대선후보가 되기 전까진 정치에 관심 1도 없던 사람인데 투표권도 없는 내가 나라 걱정을 하게 해
1468, 국민의당 윤석열 홍준표 여당 야당 대장동 0S9RX4NPD6E
1551, 국민의당 윤석열 홍준표 여당 야당 대장동 FFR6Y6ST9
1585,국힘당 경선시기 홍준표 후보가 윤석열 후보에게 물었다 전쟁이 발생하면 어떻게 조치 하겠는가 한참 있다가 대답하기를 미국 대통령에게 전화 하겠다 글로벌포럼 연설에서 2분간 묵언수행한 윤석열 국가 비상사태때 이사람은 어떻게 대처할까 
1677,홍준표가 안철수과 윤석열 사이의 이간질책을 지대로 골랐네 홍준표가 무슨 드루킹 피해자인가 외려 안철수 지지율 떨어져서 3위에서 2위로 급부상했는데 김경수 핸폰 계자추적 영장 검사는 다 서울지검장이 직접 했데 저 기사 1차장 검사는 왜 나오는 거냐 99aIfvSo6m TM7NY8UscM
1704, 국민의당 윤석열 홍준표 여당 야당 대장동 32PT24FB4C152T
1790, dongamedia 홍준표 윤석열 잘 몰라서 3김 체제 그나저나 서울 동대문을 에서 깨지고 홍씨의 생명력이 바퀴벌레처럼 참으로 질기다 한편 나라가 디비진다 국정원 해킹사건 빨간 마티즈 에 연루된 서훈 국가안보실장 과 신현수 민정수석 가 대검에 치소됐는데 조만간에 구속될 수도 있다 많관부 
1834, 국민의당 윤석열 홍준표 여당 야당 대장동 J1N1YD6W0
1836, 사시 9수보단 낫지 홍준표 또 윤석열 뒤끝 저격 1UgW2mMEY3 yvjfN7eJC8
1858, 사시 9수보단 낫지 홍준표 또 윤석열 뒤끝 저격 못났다 홍찌질 나잇값 좀 하며 살아라 한심한 넘 능력도 깜도 안되 떨어진거잖니 그래서 어쩌라고 5BkLNkKoLP
1936,윤석열이는 말을 좀 하지말고 입다물고 있는게 지지율에 도움될 것 같다고 하니까 아예 연설하는 자리에서 프롬프터 안켜졌다고 침묵하고 자빠졌냐 에휴 뷰우웅신 됐고 국힘당은 속히 홍준표 내놓으시게 
1989,홍준표 윤석열의 3金 김종인 김병준 김한길 두고 잡탕밥 평가 9apV8YBpsk 노인의힘
1994, 국민의당 윤석열 홍준표 여당 야당 대장동 0U7MS0EY
2066, SangYi21 지금즉시 이낙연 신당창당과 홍준표 신당창당으로 이재명과 윤석열을 막아야합니다 그것이 프랑스처럼 국민의선택권을줄것입니다 홍준표는국민의힘 표를 줄이고 이낙연지지자들이 이재명표를 줄여 결국 이낙연이 이길수있는 것이며 여론에 밀리면 홍준표와 합당하여홍준표를총리에 임명하면되는것입
2085, cloud_hyeon_J 지금 시간이없습니다 윤석열과 이재명을 막을려면 홍준표신당과 이낙연신당이 답입니다 만약시행하지않으면 홍준표도 이낙연도 야인으로 돌아갑니다 국민을 위하고조국통일을 위하여 프랑스처럼 국민의 혁명이 필요합니다 더민당과 국민의힘은 절대 후보교체 안합니다 결단이필요합니다 
2200,윤석열 3金 선대위에 홍준표 잡탕밥도 찾는 사람 있다 다음 뉴스 꿀꿀이 잡탕밥도 돼지에겐 만찬이 된다 4YvhjQAxaf
2322, 국민의당 윤석열 홍준표 여당 야당 대장동 조건만남 HZ7ZXF53W10J2S
2374, 국민의당 윤석열 홍준표 여당 야당 대장동 조건만남 8D6B1TG158
2375, 홍준표 3김 윤석열 후보 선대위 합류에 잡탕밥 홍 의원은 다만 윤석열 후보 관련 비판 발언은 자제해달라는 요청에는 알겠다 고 말했습니다 3김 정치 회귀한 잡탕밥 보다 이대녀 이대남 은 꿔준표 라고 비판받고 혼밥 즐기는 무야홍 을 더 좋아해 fXkp94ZSn5
2412,홍준표 9수보단 재수가 낫지 윤석열 또 저격 나섰다 tg98vTxGJx 윤 뒤에 홍 이 뒤에 이낙
2446,홍할배 내게 애인이 생겼다고 노래부르더니 낮술이 덜깼나 4RtgMI19em 잡탕밥 이어 홍준표 윤석열 잘 몰라서 3金 체제 
2517, 국민의당 윤석열 홍준표 여당 야당 대장동 조건만남 XUA57WD33XU26086
2531, 국민의당 윤석열 홍준표 여당 야당 대장동 NLK4Z3335M
2536, 국민의당 윤석열 홍준표 여당 야당 대장동 O0N58FJO08L7E1
2553, 국민의당 윤석열 홍준표 여당 야당 대장동 6K7K6K8M9NO
2563,윤석열 3金 선대위에 홍준표 잡탕밥도 찾는 사람 있다 홍발정이 대권후보자 탈락에 충격이 큰듯 또 발정하고있네 쪼잔하고 옹졸한 찌질이 꿔준표 그릇이 간장종지네 fyaD1BgJ3W
2575, 국민의당 윤석열 홍준표 여당 야당 대장동 조건만남 X7A741A6MV
2610, 국민의당 윤석열 홍준표 여당 야당 대장동 조건만남 LS02ZO3VE2
2631, 국민의당 윤석열 홍준표 여당 야당 대장동 Z269K963GK9NU4
2643, 국민의당 윤석열 홍준표 여당 야당 대장동 BS730Y0D8PI
2664, 국민의당 윤석열 홍준표 여당 야당 대장동 조건만남 3VZQ9J35KRNOS6ARB
2666, 국민의당 윤석열 홍준표 여당 야당 대장동 SV593B124
2684, 국민의당 윤석열 홍준표 여당 야당 대장동 JTOQU0903I
2705, 국민의당 윤석열 홍준표 여당 야당 대장동 조건만남 D1DT6G0N8BXD74J0
2707,국민힘당후보를 홍준표로 빨리 교체해야한다 윤석열로는 절대못이긴다 현재 이재명후보를 추월하지만 이제 시작에 불과하다 김건희와 장모의 부정부폐비리로 법의심판을 절대 피할수없고 덮을수없으며 청와대 영부인으로서 국가를 먹칠할수없다 만약 대통령이되도 민주당은 탄핵시킬것이 뻔하다
2731, 잡탕밥 이어 홍준표 윤석열 잘 몰라서 3金 체제 c7Nw1v0AQV
2741, 국민의당 윤석열 홍준표 여당 야당 대장동 X23FGA76ZT6
2778, 윤석열 비난 자제하겠다 던 홍준표 이번엔 9수보단 재수가 낫다 oyjwgmaHkD
2780, GObalnews 그나마 홍준표씨는 이재명과 토론은 되는 사람인데 윤석열씨는 절대 수첩이나 프롬프트 없이 토론장에 안 나온다 
2841, njLsXkboxG 잡탕밥 이어 홍준표 윤석열 잘 몰라서 3金 체제 
2843, 국민의당 윤석열 홍준표 여당 야당 대장동 조건만남 U0H020X4
2844, njLsXkboxG 잡탕밥 이어 홍준표 윤석열 잘 몰라서 3金 체제 
2884,이번 대선에 이재명 대 윤석열 외에 제미로 이낙연 대 홍준표 낙선자 인기투표도 했으면 좋겠다 홍준표가 압도적으로 이길껄 
2887, 단독 윤석열 후보 김종인 총괄선대위원장 선대위 합류 거부 다음뉴스 윤석열은 대선 승리가 목적이 아니네 아니 그냥 관심이 없어 국힘이 홍준표로 후보 교체 하지 않으면 어려울듯 얼른 김건희 건 수사 진행 되어 윤석열 낙마 하는 수 밖에 33AIaQAeVh
2926, 국민의당 윤석열 홍준표 여당 야당 대장동 H9S6ZU702
2966,솔직히 홍준표가 저쪽 대선후보가 되었으면 그냥 그런가 보다 하고 넘겼겠지 그런데 문재인대통령에 대한 증오심 복수심 하나만 먹고 여기까지 온 인간이 윤석열이다 저런 인간 대통령 되면 문재인대통령 이나라 우리의삶 다 비참해 질수밖에 없다 
2970, 국민의당 윤석열 홍준표 여당 야당 대장동 KDN3QL136XI15MZ6C
2978,틀린말은 아니지 9수보다 재수가 낫지 사시 9수보단 낫지 홍준표 또 윤석열 뒤끝 저격 U1MNOtNNyd
3064, 국민의당 윤석열 홍준표 여당 야당 대장동 조건만남 CD37FJZQ
3084, 국민의당 윤석열 홍준표 여당 야당 대장동 ZUDK3G9R3P6
3095, 사시 9수보단 낫지 홍준표 또 윤석열 뒤끝 저격 다음 뉴스 9X7VcIGQKz 우리 지도자는 바보여도되나 
3102, 사시 9수보단 낫지 홍준표 또 윤석열 뒤끝 저격 T99lJiQVHH 양아치 대선이란다 비굴하고 쪼잔한 양아치가 
3126, 국민의당 윤석열 홍준표 여당 야당 대장동 R286PQE54Y76OFA4Z
3130, 국민의당 윤석열 홍준표 여당 야당 대장동 Z3506079XQ
3181,윤석열 내일 경선 예비후보들과 오찬 홍준표 유승민 불참 twC0YBlUXL 원희룡 최재형 장기표 등 참석
3190,홍준표 버리고 윤석열 뽑아줘서 고마워요 
3209,사시 5수생이 낫지 사시 9수보단 낫지 홍준표 또 윤석열 뒤끝 저격 다음 뉴스 toB8Z04Mlf
3220,윤석열 내일 경선후보들 만난다 홍준표 유승민 황교안 불참 출처 뉴시스 네이버 뉴스 66Cf71FxcV
3232, 사시 9수보단 낫지 홍준표 또 윤석열 뒤끝 저격 다음 뉴스 YjgLsil4lf 민주당으로 오세요 뭘 망설이십니까 함께 해요 
3256, 목적을 위해 수단방법 안가리고 거짓말잘하는 후보는 아님 이번 대선에서 뽑을 후보가 없다 는 말에는 그래도 이재명 후보는 아니다 며 이재명 후보를 찍어선 절대 안된다고 강조했다 홍준표 9수생 윤석열 뭘 몰라서 3김 선대위 그래도 이재명은 곤란 h5tf5XBy0S
3267,홍준표는 형편없는 놈이면서 어디로 튈지 모르는 놈이다 오죽하면 그 지지율에 따르는 의원이 추미애급이었겠는가 그에 반해 윤석열은 친박연대 속의 박근혜처럼 그들의 왕일 뿐이다 그나마 박근혜같은 대중성도 없다 오죽하면 홍준표에게 밀렸겠나 이기기 쉽다 yihbFC78kh
3280, 국민의당 윤석열 홍준표 여당 야당 대장동 7BM2QHS4
3362, 국민의당 윤석열 홍준표 여당 야당 대장동 4KQ0Y7C0137M416X
3372, 사시 9수보단 낫지 홍준표 또 윤석열 뒤끝 저격 Q 재수해야 할 것 같은데 심란하다 사법시험 5수 할 때 심정이 어떠셨느냐 A 9수한 것보다 낫다 아앀 Hx5e4oIn33
3403, 국민의당 윤석열 홍준표 여당 야당 대장동 795Z1L97E65YL
3408,홍가도 손절하는 10원이 사시 9수보단 낫지 홍준표 또 윤석열 뒤끝 저격 다음뉴스 b7kWXddUCM
3411,윤석열 내일 경선 예비후보들과 오찬 홍준표 유승민 불참 다음 뉴스 H5IwvjMtt4 망길이가 꼈으니 망할날만 남았다 도리도리 윤도리
3453,윤석열 내일 경선 예비후보들과 오찬 홍준표 유승민 불참 다음 뉴스 rviPiq3WjP
3458, 국민의당 윤석열 홍준표 여당 야당 대장동 DKPH016SZ059C3
3464, 국민의당 윤석열 홍준표 여당 야당 대장동 SCSZH028A8UGJ
3465, 국민의당 윤석열 홍준표 여당 야당 대장동 C5Y541N7
3494, 국민의당 윤석열 홍준표 여당 야당 대장동 K7SJ2XQP0P6AUR
3496, 국민의당 윤석열 홍준표 여당 야당 대장동 NXF71C6255669
3497,국민의힘 윤리규정 제 20 조 징계사유 징계의 사유는 다음 각호와 같다 1 당에 극히 유해한 행위를 하였을 때 2 현행 법령 및 당헌 당규 윤리규칙을 위반하여 당 발전에 지장을 초래하거나 그 행위의 결과로 민심을 이탈케 하였을 때 홍준표의원의 윤석열 후보 유해언행에 대하여 소추하라
3498, 비난 자제하겠다 던 홍준표 3金 합류한 윤석열 선대위 향해 잡탕밥 ltFiFjgSgy
3527,어르신들이 그러는데 술집여자를 국모로 모실 수는 없지 내 말이 아니라 어른들의 말씀 민주당은 이재명 후보로 정해진 후 국힘당의 후보경선이 진행될 때 홍준표가 되면 투표 안한다 그러나 윤석열이 되면 이재명을 찍는다 왜 윤석열이 되면 안되니까 AaiMTlZln3
3533, 국민의당 윤석열 홍준표 여당 야당 대장동 8M645Y6G8
3534,이재명 살리자고 무리하게 여론 조작 해서 윤석열 끌어내려 봐야 홍준표 등판시계만 앞당겨 줄 뿐이지 홍준표도 나름 노리고 있는거 같드만 
3535,윤석열 엄청난 정치력 선보였다 김한길 합류 소식에 이재명 경악 민주 발칵 뒤집혔다 이준석 홍준표 이제 큰일났다 0rHT2v5uFT
3537,오늘 뉴스공장에서 이낙연 캠프 출신 이상이가 이재명 때린거 다음포털에서 탑에 노출시키고 홍준표가 윤석열 때린 건 노출 안 시킨 거 다룸 AI가 했다고요 거짓말 
3538, 6 선택은 과연 오히려 더욱 몰아주는 것이 상식임에도 배꼽무한대폭발유머이나 국민지지율도 월등하게 높았던 경상도의 뀌요미 이재명후보를 얼마나 불안한 후보로 만들었으면 쯧쯧쯧이나 에 의한 야권의 홍준표의원 국민지지율이 뀌요미 윤석열후보가 높았슴에도 불구하고 국민여론조사에서의
3586, devoix57 넵 드루킹 수사 김경수 휴대전화 추적과 계좌추적 막은 사람은 윤석열이라고 확실히 못박았습니다 전직 검사 홍준표가 없는 사실을 얘기 하지는 않겠죠 emCb8thEP9
3587, 사시 9수보단 낫지 홍준표 또 윤석열 뒷끝 저격 윤석열이 패거리정치 한기리 백구가 새 창당할 경우 홍준표도 당 꾸려 대선에 도전하려나 모르겠군 fMrTZgTNAR
3617,윤석열 내일 경선 예비후보들과 오찬 홍준표 유승민 불참 다음 뉴스 sGet5r6M4C
3622, 사시 9수보단 낫지 홍준표 또 윤석열 뒷끝 저격 다음뉴스 U8WfRvEgfC 이번 대선 누구를 찍어야 합니까 라는 질문에는 착한 사람 찾아보세요 라고 답했고 윤 후보가 대통령이 되면 나라가 정상적으로 돌아갈지 의문 이란 글에는 대한민국만 불행해진다 
3633, 국민의당 윤석열 홍준표 여당 야당 대장동 R0W5154W98R33Z3B5O
3637, 잡탕밥도 찾는 사람 있다 3김 윤석열 선대위 비꼰 홍준표 bEV94n8aiD
3672, 국민의당 윤석열 홍준표 여당 야당 대장동 DZB17ACML2QGP27
3684, 국민의당 윤석열 홍준표 여당 야당 대장동 8VRE3492O
3698,불참자들 워밍업 윤석열 내일 경선후보들 만난다 홍준표 유승민 황교안 불참 dI6nd49rh4
3784, HPwNItHEIq 홍준표 9수생 윤석열 뭘 몰라서 3김 선대위 그래도 이재명은 곤란 
3787, 국민의당 윤석열 홍준표 여당 야당 대장동 63C37L944G7G01
3799,갈 곳을 잃은 이낙연 침묵이 아닌 도피일 게다 세작은 버림받는 순간 죽음인 게다 세작을 보낸 본진에게 홍준표와 같은 의미가 아닌 게다 화천대유 큰 거 한방은 최태원 최순실 곽상도 박영수 윤석열 등에게 게다가 다름 아닌 이낙연 자신이 된 거라고 추정해 본다 낙엽 v1NOmARLX1
3838, 국민의당 윤석열 홍준표 여당 야당 대장동 T30VS7YVY7GIGCRFMG
3840, 국민의당 윤석열 홍준표 여당 야당 대장동 5W487PB5
3849, 국민의당 윤석열 홍준표 여당 야당 대장동 2HE1612I2XLV1W1
3869, 국민의당 윤석열 홍준표 여당 야당 대장동 P91153IC7SZ
3888, 국민의당 윤석열 홍준표 여당 야당 대장동 조건만남 C2G23E323889C
3900, 국민의당 윤석열 홍준표 여당 야당 대장동 88923IBIXR6
3943, 국민의당 윤석열 홍준표 여당 야당 대장동 77AITQ164L5
3953, 국민의당 윤석열 홍준표 여당 야당 대장동 AI3HFMUX
3992, 국민의당 윤석열 홍준표 여당 야당 대장동 S33LE8O594MB9B
4007, 국민의당 윤석열 홍준표 여당 야당 대장동 X0DCN7UTL7454D0XI
4050,김어준 생각 1122 lt 이상이 교수 내부총질 파문확산 이재명은 적폐 조속히 축출해야 gt 기사가 포털의 첫줄에 노출되었다 이상이 교수의 SNS를 기사화한 것이다 반면 홍준표후보의 윤석열 비판은 포털 첫줄에 걸리지 않는다 더 무게감이 있는대도 이것도 AI인가 mCtan1TCOY qkd9wEx0S5
4055,대통령 서울시장 이재명 윤석열 홍준표 원희룡 법조인들이 맹활약 하시네요 법조인 세상 만족하시나요 SbZDK75CTL 법조인 대선후보
4067, 국민의당 윤석열 홍준표 여당 야당 대장동 2318H6Z05
4090, 국민의당 윤석열 홍준표 여당 야당 대장동 3784BYRHA4XH02
4099,홍준표 9수생 윤석열 뭘 몰라서 3김 선대위 그래도 이재명은 곤란 ZyDjL9UZ0I
4102, 국민의당 윤석열 홍준표 여당 야당 대장동 XBCS8A12
4103, 국민의당 윤석열 홍준표 여당 야당 대장동 조건만남 7U5Q166X9
4145, 국민의당 윤석열 홍준표 여당 야당 대장동 조건만남 M11FQ0031F0W6
4194, 국민의당 윤석열 홍준표 여당 야당 대장동 JA824U8M4R4LJ
4202, 국민의당 윤석열 홍준표 여당 야당 대장동 V13MWH75Y4QC3Q6
4207, 국민의당 윤석열 홍준표 여당 야당 대장동 조건만남 3VM5QK697CY83488
4227,홍준표가 해냈다 윤석열 저격수 복귀 선대위는 잡탕밥 역대급 팩폭에 국민의 힘도 아사리판 인증 G8oTxutuyE 출처 YouTube 개혁에목마른 국민들을 외면하고있는 민주수박들 조국과추미애를 감싸지는 못했더라도 일좀해라 시버럴 넘무시키들아 180여석 고스톱으로 땄냐
4269, 국민의당 윤석열 홍준표 여당 야당 대장동 6BU52S7856D
4270, 국민의당 윤석열 홍준표 여당 야당 대장동 조건만남 6S7D8A5G8J9
4285, 국민의당 윤석열 홍준표 여당 야당 대장동 2Q5M83WD4QO6
4304, 국민의당 윤석열 홍준표 여당 야당 대장동 29481LJ3P16ICLH9
4308, 국민의당 윤석열 홍준표 여당 야당 대장동 69YT2074CZ19
4317,요즘 홍준표를 보면 무슨 생각을 하고 있는 사람인지 모르겠다 경선이 끝나자 바로 윤석열에 패배를 인정하는 모습에 박수를 보냈는데 이제는 뒷통수를 치고 있으니 졸장부도 저런 졸장부가 있었나 싶다 차차기를 노린다고 지금 같은 상황이라면 어림 반푼어치도 없다 
4326, 국민의당 윤석열 홍준표 여당 야당 대장동 1QPL3WOWW
4327, 국민의당 윤석열 홍준표 여당 야당 대장동 DNV7PEGM9SUH
4331, 국민의당 윤석열 홍준표 여당 야당 대장동 0SS5A9MTF1S9STH67
4394, 국민의당 윤석열 홍준표 여당 야당 대장동 조건만남 00637WK530
4417, 국민의당 윤석열 홍준표 여당 야당 대장동 54Z0N13X9ZH11
4421, 국민의당 윤석열 홍준표 여당 야당 대장동 FZHYZU5SMRRCF802K7
4422, 국민의당 윤석열 홍준표 여당 야당 대장동 조건만남 5YQ87GOZ
4434, 국민의당 윤석열 홍준표 여당 야당 대장동 9SPHQTC0
4458, 국민의당 윤석열 홍준표 여당 야당 대장동 조건만남 C8G8US9D0ELA68
4460, 국민의당 윤석열 홍준표 여당 야당 대장동 PY91GW75P7
4461, 국민의당 윤석열 홍준표 여당 야당 대장동 조건만남 38KNW57G5NN6IH328Z
4463, 국민의당 윤석열 홍준표 여당 야당 대장동 9JZ271510
4465, 국민의당 윤석열 홍준표 여당 야당 대장동 OS5N1U4NZ8ET2E9
4469,홍준표가 해냈다 윤석열 저격수 복귀 선대위는 잡탕밥 역대급 팩폭에 국민의 힘도 아사리판 인증 udVligTkzR YouTube
4482, 국민의당 윤석열 홍준표 여당 야당 대장동 0G99BLP81YI90FSKR
4488, 국민의당 윤석열 홍준표 여당 야당 대장동 031ZPFKJ27816FR7M
4503, 국민의당 윤석열 홍준표 여당 야당 대장동 KE34FR525LL8
4505, 국민의당 윤석열 홍준표 여당 야당 대장동 E92D123PHE
4514, YuriYuriChang 이낙연 신당창당 홍준표 신당창당만이 윤석열 이재명범죄자들 막는 길이다 촛불혁명하라 독립운동정신으로 
4531, 국민의당 윤석열 홍준표 여당 야당 대장동 N93Q0634X
4533, 국민의당 윤석열 홍준표 여당 야당 대장동 조건만남 B1D5K1025207527721
4534, 국민의당 윤석열 홍준표 여당 야당 대장동 0677T0CZNKN
4539, 국민의당 윤석열 홍준표 여당 야당 대장동 조건만남 Q7QG60T12VLG3N5
4549, 국민의당 윤석열 홍준표 여당 야당 대장동 조건만남 73EWKDB3R390QH28
4552, 국민의당 윤석열 홍준표 여당 야당 대장동 MYD51R0W
4558, 국민의당 윤석열 홍준표 여당 야당 대장동 조건만남 AD58EIW5KO
4565, 국민의당 윤석열 홍준표 여당 야당 대장동 CMG6GEZF8BK9DRXZE9
4568, 국민의당 윤석열 홍준표 여당 야당 대장동 59429357QG66F
4587,이준석이 당원을 모욕했다 김종인에게 전구너을 주라 윤석열에게 말했다고 지랄들 한다 여기서 당원이란 누구들 지칭하는 건지 이준석 홍준표 인기가 왜 있는 지 생각합시다 새로나온 핸드폰 사용법 익히면 새로운 모델 나오는 세상에서 203040 지지 못 끌어내면 정치인 아닙니다 
4595, 국민의당 윤석열 홍준표 여당 야당 대장동 조건만남 JDJC42NE38757
4599, 국민의당 윤석열 홍준표 여당 야당 대장동 478GY978
4608, 국민의당 윤석열 홍준표 여당 야당 대장동 조건만남 TWQ0TNM7I3O64UX8MV
4627,김한길 김병준만 해도 끔찍한데 홍준표까지 있었으면 그야말로 상한 음식 되는 것이지 홍준표가 빠져준 게 윤석열에겐 도리어 도움이 되지 않을까 5lCk6UyT69
4635, 국민의당 윤석열 홍준표 여당 야당 대장동 조건만남 P813MZVQ03CXOZ1E
4636, 국민의당 윤석열 홍준표 여당 야당 대장동 90LF7K47NX359S
4639, 국민의당 윤석열 홍준표 여당 야당 대장동 조건만남 PVG2Q2TS3P9317Q
4653, 국민의당 윤석열 홍준표 여당 야당 대장동 5HV3N4G5I2823D
4657, 국민의당 윤석열 홍준표 여당 야당 대장동 7M69FV7O3X3V3OL1
