,tweet
8,윤석열 선대위에 특공조직 윤희숙이 이끄는 이재명 저격팀만든다 bKm56BOPEu
34,윤석열이 이런 저런 실수도 많지만 이 두 물건만 확실히 묻어버려도 정치입문 5개월만에 고수반열에 오를 것 장담한다 단독 김종인 이준석 만나 패싱 에 격노 윤석열 선대위 덜컹 91ZtrzKi0B
63,최병묵의 팩트 윤석열 선대위 관점 G9Z9rbwmlH
97,김종인과 이준석 왜 몰래 만나다가 들켰을까 도대체 이준석 이건 뭐하는 작자인가 행실과 행태가 절대로 윤석열즁심의 선관위 구성에 안맞는 짓만 구리게 행동하고 있다 단독 김종인 이준석 만나 패싱 에 격노 윤석열 선대위 덜컹 출처 YTN ys9uqCIyk7 Ud2zCzERPx
119,윤석열의 선대위목표는 가족사기단이 선거로 패밀리 비즈니스를 확장하는것이다 김건희 당권 공천권 접수 김건희 주가조작 김건희 표절논문 김건희 허위경력 조작 윤석열 장모 요양병원 건강보험23억사기 아산 땅투기132억 은행잔고3백억위조 양평 불법개발아파트 8백억수익 농지법위반
121,사기꾼 국힘 놈의 새끼들 국민을 바보로 아나 선거법을 위반했으면 사과는 못할망정 사기를 치다니 수행원들 식사비가 77 000원이 나왔으며 지난 20일 국민의힘 김병민 선대위 대변인은 이들 식사비 영수증을 윤석열 후보 본인 몫으로 지불했다고 제시한 것이다 pTlH2bbIvm
141,김종인 윤석열 선대위 발언 부인 NntsLcjj2q
144, 뉴있저 이재명 선대위 쇄신 첫 행보 김종인 윤석열 인사에 격노 YTN 0lnebjmbND YouTube
161,김종인 윤석열과 연락 끊고 합류 거부 찬바람 심상찮다 金 이준석 통해 내 이름 올리지 말라 尹 총괄선대위원장 없이 갈 수도 끝내 갈라서는 최악의 상황도 대비 0UjHNTMUXP
196,김종인 결국 불참하나 국힘 선대위 출발부터 최악 내홍 P0Inv35bJd 윤석열은 뇌물 전과 2범과 같이 안할 것이다 이라고 한 사람과 같이 한다고 
241,Y횟집에는 이광래 등 전 목포시의원과 윤석열 후보 일행을 포함해 총 12명이 폭탄주를 마시며 만찬회동을 했었다 수행원들 식사비가 77 000원이 나왔다 국민의힘 김병민 선대위 대변인은 수행원들 식사비 영수증을 윤석열 후보 본인 몫으로 지불했다고 제시한 것이다 jqAe94mV9g
263,이수정 교수님은 여자문제면 어디든지 가서 하시는 분이라서 이재명이 조져있고 말 나왔으면 선대위 합류하실 분 그건 그렇고 거의 오피셜로 윤석열 여성관 조졌네 
267,Y횟집에는 이광래 등 전 목포시의원과 윤석열 후보 일행을 포함해 총 12명이 폭탄주를 마시며 만찬회동을 했었다 수행원들 식사비가 77 000원이 나왔으며 국민의힘 김병민 선대위 대변인은 수행원들 식사비 영수증을 윤석열 후보 본인 몫으로 지불했다고 제시한 것이다 jqAe945jKG
275,Y횟집에는 이광래 등 전 목포시의원과 윤석열 후보 일행을 포함해 총 12명이 폭탄주를 마시며 만찬회동을 했었다 수행원들 식사비가 77 000원이 나왔으며 국민의힘 김병민 선대위 대변인은 수행원들 식사비 영수증을 윤석열 후보 본인 몫으로 지불했다고 제시한 것이다 jqAe945jKG
278,윤석열 3김 대신 양김 선대위로 김종인 합류 거부 다음 뉴스 3KTrqpIi5Z
287,김종인이 선대위윈장에 취임하지 않으면 윤석열은 이길 수 없는가 김종인이 취임하면 윤석열이 이기는가 이 두가지다 틀렸다 중요하지만 가장 중요한 것은 아니다 김영환
290,김종인의 윤석열 국민의힘 선대위에 불참을 선언했다 정책머리 똥머리인 윤석열이 김종인 없이 과연 뭘 할수가 있을까 또 남의정책 카피하면서 절도를 할까 한번보자 국민의힘 선대위가 제대로 돌아가는지 김종인의 필요성을 인지하지 못하는 멍청한 대가리로 뭘하겠냐 국민의힘 X맨은 윤석열
296,김종인 선대위 합류 보류 윤석열과 기류 심상찮다 다음 뉴스 98l5N4IKFQ
305, 단독 김종인 이준석 만나 패싱 에 격노 윤석열 선대위 덜컹 다음 뉴스 wqT594Vzr3
328, 단독 김종인 이준석 만나 패싱 에 격노 윤석열 선대위 덜컹 다음 뉴스 SvqAcoduIF
351,김종인 윤석열 후보에 시간 더 달라 선대위 이상 기류 출처 MBN 네이버 뉴스 WYGLxOdvq2
364, 뉴있저 이재명 선대위 쇄신 첫 행보 김종인 윤석열 인사에 격노 YTN RrjevY4gSa 출처 YouTube
404, 단독 김종인 이준석 만나 패싱 에 격노 윤석열 선대위 덜컹 다음 뉴스 Y2BG25vrvD
410,나경원 윤석열 선대위 안 간다 계산기 두들겨보고 답안나오니깐 안간거겠지 너같이 탐욕의 화신이 양보를 햇다고 hnSxV3Wyxt
418,윤석열은 아직 김종인의 가치에 대한 인식이 부족한 것 같은데 이번에 총괄선대위원장 인선이 불발되면 차후에 무릎 걸음으로 달려가 애걸해야 할 상황이 발생할 수도 
425,장제원은 아들이 음주 측정 거부 경찰관 폭행 혐의로 구속된 바 당분간은 자숙 모드로 가는 것이 맞는 것 청와대 청원까지 진행되고 있는 바 무리하게 비서실장에 윤석열 김종인 이상기류 김 선대위 인선안에 더 할 말 없다 출처 한겨레 네이버 뉴스 2P9BsIP2BT
427,김종인 윤석열과 연락 끊고 합류 거부 찬바람 심상찮다 Qyn1Lh6Rt7 金 이준석 통해 내 이름 올리지 말라 尹 총괄선대위원장 없이 갈 수도 끝내 갈라서는 최악의 상황도 대비 
481,뭔 일이래 그래 이제 본격적으로 치고패고 싸워라 이것들아 줏대도 없이 한 자리만 찾아 쫓아댕기는 늙은 암세포들 단독 윤석열 후보 김종인 총괄선대위원장 선대위 합류 거부 다음 뉴스 oSQWR1D47t 8hJZ3OCtVE
496, 뉴있저 이재명 선대위 쇄신 첫 행보 김종인 윤석열 인사에 격노 YTN kq2QE4i3Xj 출처 YouTube
523,김종인 이준석 만나 패싱 에 격노 윤석열 선대위 덜컹 다음 뉴스 7HDct3yiHx
530, 단독 김종인 이준석 만나 패싱 에 격노 윤석열 선대위 덜컹 YTN Wg8T4QmYNP YouTube김종인과이준석 주제 파악을
546, 김종인 빠진 선대위 인선안 수락 유보 金에 막판 혼돈 ULNuLADCSo 국민의힘 윤석열 대선 후보의 선대위 인선이 막판에 덜컹거리고 있습니다 DFNoGbE0y9
585,김종인 윤석열과 연락 끊고 합류 거부 찬바람 심상찮다 다음 뉴스 金 이준석 통해 내 이름 올리지 말라 尹 총괄선대위원장 없이 갈 수도 끝내 갈라서는 최악의 상황도 대비 mXmWXknKbg
594,윤석열 목포 폭탄주 오락가락 언론 대응에 선대위 혼선 까지 RX5U7hefVW
599,김종인 윤석열과 연락 끊고 합류 거부 찬바람 심상찮다 EQvnrrkSyj 냉랭한 김종인 더 이상 할 말 없다 金 이준석 통해 내 이름 올리지 말라 김종인과 갈등 감추지 않은 윤석열 尹 총괄선대위원장 없이 갈 수도 끝내 갈라서는 최악의 상황도 대비 
618, ojg4008 woomitkfkd 김한길의 영입은 수단과 방법을 가리지 않는 공작 달인들의 술수다 이로서 양심있는 국민은 정치철학 보다 대통령이 우선인 윤석열을 절대 지지하지 않을 것이다 김한길이 윤석열 선대위 참여는 이재명이 정권교체 민심을 끓어 안을 기회를 더 많이 갖게 될 것이다
623,윤석열 목포 폭탄주 오락가락 언론 대응에 선대위 혼선 까지 RX5U7hefVW
624, 단독 김종인 이준석 만나 패싱 에 격노 윤석열 선대위 덜컹 KD0fBwM4mR
627, 단독 김종인 이준석 만나 패싱 에 격노 윤석열 선대위 덜컹 YTN SBLqm80hrZ 출처 YouTube
642, 2022 대선 이슈 3김 선대위 이상기류 윤석열 시간 더 필요 김종인 요청에도 김병준 인선 확정 선대위 출범 박차 87FUfmtaaT
671,잘 하는 짓이다 이준석 팽시키고 권성동 장제원이 당을 개편 혹 국민의 당 안철수와 단일화 윤석열 김종인 총괄선대위원장 임명 보류 이상 기류냐 일시 연기냐 8mhav55vnf
679,우리가 언론이다 정보공유운동 전 민주당쓰레기합류한 3김선대위 외인부대 잡탕밥 홍준표가 해냈다 윤석열 저격수 복귀 선대위는 잡탕밥 역대급 팩폭에 국민의 힘도 아사리판 인증 4vAnuNNXab 출처 YouTube
691, 단독 김종인 이준석 만나 패싱 에 격노 윤석열 선대위 덜컹 다음 뉴스 2fvRKyFwNz 김종인 전 국민의힘 비상대책위원장이 이준석 대표와 만나 패싱에 격노했다고 오늘 YTN이 보도했습니다 이로서 윤석열 선대위는 흔들릴 처지에 놓였습니다
692,윤석열 김종인 총괄선대위원장 임명 보류 이상 기류냐 일시 연기냐 aaGYlMRaLT
720, YoungpyoHong 민주당 선대위는 지금 다들 손절인 지 도망인 지 하나 둘 눈치게임처럼 빠져나가던데 민주당 후보가 윤석열한테도 지지율에서 지는데 어떻게 원팀이 되겠어요 비호감도만 높은 민주당 후보 빨리 교체해야 이길 거예요 남 구경 전에 내 티끌 보시길 
730,비열한 거리의 배신자들 윤석열 후보 김종인 김병준 김한길 선대위 발표 김한길 새시대준비위원장 결론은 정권교체 2slLnRpkmD 출처 YouTube
763,꼰대들 꼰대질 잘하고있음 윤석열의 3김 선대위 제동 김종인 더 할 얘기 없어 다음뉴스 hbYWYYX5AB
804,나경원 윤석열 선대위에 내 자리가 있다면 내놓겠다 B7Jf4oa4LM 뉴스만 보면 대체 김종인은 뭘 노리나 자신 없으면 빨리 못하겠다고 해라 옹고집과 과거의 카리스마로는 안된다 
814,윤석열 목포 폭탄주 오락가락 언론 대응에 선대위 혼선 까지 QJOFuQr4XS
889,윤석열 선대위 총괄 김종인에 이해찬 등판론 선긋는 이재명 출처 머니투데이 네이버 뉴스 zPQdLunq0G
916,윤석열 목포 폭탄주 오락가락 언론 대응에 선대위 혼선 까지 다음뉴스 CUD9BRtpoO
922,윤석열 선대위 빨리 들어가주세요 나경원 선대위 내 자리있다면 작은 자리도 내놓겠다 다음뉴스 7vuZGoeXWn
949, 단독 윤석열 후보 김종인 총괄선대위원장 선대위 합류 거부 다음뉴스 9u4IaPoVQY
974,윤석열은 낭독도 낭독이지만 내용도 엉망이었다 수사만 요란하고 뜬구름만 잡는 아무말 대잔치 선대위에 제대로된 연설문 하나 작성해 줄 인물이 없다는 증거 혹시 쥴리가 써준 건희 그런 건희 이재명 연설 kqgBuuZ1Kk 윤석열 낭독 qn0mPAIsgf
978,윤석열 김종인 총괄선대위원장 추대 부결 홍준표 선택할까 브레이크뉴스 ioghsvYgzY
1018,세상에 이런 일이 김한길이 국민의힘에 입당하여 윤석열 선대위에 합류한다고 민주당 국회의원 시작 gt 노무현대통령 시절 장관 gt 민주당 대표까지 한분이 할짓인가 지금도 권력이 갖고 싶나 만일 그런다면 그것은 스스로 망신 당하는 행위이며 故 노무현대통령과 국민에 대한 배신행위이다 
1057,나경원 전 국회의원께서는 윤석열후보의 대선패배를 예측하시어 선대위 불참을 선언하시었다 한발빠른 손절은 성공의 지름길인 것을 
1068,윤석열 김종인 이상기류 김 선대위 인선안에 더 할 말 없다 n5TdABLSZu 누가보면 김종인이 대선 후보인줄 
1075, AjaAjaJaem8888 les_ted 김병민 국민의힘 선대위 대변인은 윤석열 후보는 지난 10일 있있었던 목포횟집 만찬 후 개인 식사 비용을 지불했으며 개누리 것들은 입에서 나오면 거짓말이구나 저거 타고난 능력 같은데 사기꾼들에게 주로 발달한 저 능력 
1104,이준석 대표 윤석열 후보한테 당 주도권 뺏김 김종인 총괄선대위원장 윤석열 후보한테 팽당함 복수를 다짐하며 연합
1150,나경원 윤석열 선대위 내 자리 있다면 양보 외부 영입 인사에 주라 출처 뉴스1 네이버 뉴스 P2OaYP1H8P 나경원 눈치하나는 알아주네 바로 도망가는거 봐라 
1172,2030한테 젊게 비춰지려고 지보다 더 늙은 애들만 줏어모아 선대위 꾸민다며 준석인 바쁘것다 늙은이들 수발들려면 딱하다 도리도리 윤석열 연설 침묵에 여권 비난 다음뉴스 SQke9W0FNJ
1188,하여튼 눈치 하난 기가 막히게 빠르단 말이야 나경원 윤석열 선대위 내 자리 있다면 양보 외부 영입 인사에 주라 출처 뉴스1 네이버 뉴스 717XAiVERu
1206,2부 요즘 누가 사람보고 표 찍나 윤석열 선대위 구성에서 진짜 빠진 것 2021 11 22 정치분석 8tIMXCOu8t 출처 YouTube
1212,나경원 윤석열 선대위 내 자리 있다면 양보 외부 영입 인사에 주라 출처 뉴스1 네이버 뉴스 VxnF2fFftT 양보라 썼지만 거절이라 읽으면 됩니다
1256,그 동안 윤석열이 뇌물종인을 상왕으로 모시려는 팔푼이짓을 심하게 깐 보람이 있네 김종인 尹 김병준과 와서 본인 얘기만 강한 불쾌감 선대위 안온다 출처 뉴스1 네이버 뉴스 45HSCPstph
1279,윤석열을 저 반열에 올려놓은 일등공신 추미애씨는 뭐하십니까 윤석열 공동선대위 추천합니다 
1314,이건 100 윤석렬 선대위의 잘못이다 이런거 쉴드치면 안돼 잘못한건 잘못한거다 윤석열 국민의힘 대선후보가 생방송 도중 2분 가량 침묵하는 해프닝이 벌어진 것을 두고 더불어민주당은 남자 박근혜 프롬프터 없이는 말 한 마디 못하는 후보 라고 공세에 나섰다 EE9LePTMQc
1379,윤석열 김종인 총괄선대위원장 임명 보류 이상 기류냐 일시 연기냐 vCUgHhKNbc
1453,오늘도 맨발 안진걸 급등 이재명 윤석열과 0 5 초접전 민주당 모두 매타버스 가 되어라 dnPakUVTZW 출처 YouTube 민주당선대위쇄신 지지율격차축소 매타버스운용제안 종합부동산세
1538,한주만에 13 p 좁혀져 요동 李 지지층 결집 尹 컨벤션 주춤 A0AZseP0X2 윤석열 40 이재명 39 5 초접전 정당 지지율도 민주당 상승 국민의힘 하락 유연해진 李의 변화 尹 선대위 갈등 등 영향 미친 듯 이번주도 다시 출렁일 가능성
1587,윤석열의 3김 김한길 김병준 에 대해서는 그리 거부감이 없다 헌데 김종인 부분에선 상당한 거부감이 느껴진다 결국 선대위에 주춤하며 시간을 달라한다 그냥 선대위에 참여안하는 김종인이었으면 한다 윤석열이 대권후보지 김종인이 대권후보냐 참 한심한 노인네다 주객전도 
1646,윤석열 목포 폭탄주 오락가락 언론 대응에 선대위 혼선 까지 출처 미디어오늘 네이버 뉴스 9yJTAA3XYb
1648,수행원들 식사비가 77 000원이 나왔으며 지난 20일 국민의힘 김병민 선대위 대변인은 이들 식사비 영수증을 윤석열 후보 본인 몫으로 지불했다고 제시한 것
1665,윤석열 선대위 기회 다음엔 역시 위기 시장흐름을 전혀 못읽고 이재명한테 심폐소생기회를 주고 잇어 술좀 그만 처먹어래도 
1709,윤석열 목포 폭탄주 오락가락 언론 대응에 선대위 혼선 까지 HCeX8gvbd4 eA84ZqgC4s
1732, 2iOZ52ktJh 윤석열 22일 이준석 김병준 상임선대위원장 인사안 보고 金 하루 이틀 시간 더 달라 하셨다 尹 김병준 때문이냐 질문에는 정확히 모른다 뭔 이리 추근추근 추접스럽게 당신은 윤한테 팽 당한거야 
1801, ael_ael 이분은 남편과 아들 모두 법조인이고 남편이 원래 윤석열이 검찰총장이던 시절부터 친했어요 국힘 선대위 들어갈때부터 여성피해자들한테 성범죄 당했거나 억울하면 신고하라고 했던 분임 
1812, 김종인 총괄선대위원장이 윤석열 후보에게 하루이틀 시간을 더 달라고한 것에 대해 윤 후보가 이를 거부하고 김한길 김병준 위원장 체제로 가기로 전격 결심했다 XfgdStRrCZ
1835,오 사실이라면 윤석열 정치판에 들어와서 처음으로 한국정치에 크게 기여했다 김종인 넝감 제거 한국정치에 나름 중요한 전환점이라고 봐 김종인 尹 김병준과 와서 본인 얘기만 강한 불쾌감 선대위 안온다 출처 뉴스1 네이버 뉴스 zpsy2tr0CI
1843,김종인 野 선대위 합류 보류 fJLeWuvASC 윤석열 국민의힘 대선후보가 김종인 전 국민의힘 비상대책위원장을 총괄선대위원장에 인선했다고 공식 발표한지 하루만에 김 전 위원장이 선대위 합류 최종결단을 보류한 사실이 드러났습니다 김종인
1867, NqNG7anSU2 윤석열 40 이재명 39 5 초접전 정당 지지율도 민주당 상승 국민의힘 하락 유연해진 李의 변화 尹 선대위 갈등 등 영향 미친 듯 이번주도 다시 출렁일 가능성 한주에 13 p 가 왜 벌어졌는지는 기레기 니들 분석 안하냐 표본 과표집 
1885,지난 20일 김병민 국민의힘 선대위 대변인은 윤석열 후보는 지난 10일 있있었던 목포횟집 만찬 후 개인 식사 비용을 지불했으며 민주당 선대위 대변인이 주장한 내용은 새빨간 거짓말 이라고 주장했었다 왜 김병민은 금방 들통날 거짓말을 저렇게 당당하게 했지 언론믿고 7urvpHWMxY
1893,윤석열 목포 폭탄주 오락가락 언론 대응에 선대위 혼선 까지 출처 미디어오늘 네이버 뉴스 kjYax9Skrf
1909,나베 눈치 빠르네 윤석열 낙마 나경원 윤석열 선대위 내 자리 있다면 양보 외부 영입 인사에 주라 nDrn9sol4t
1935,윤석열 81세 김종인 고집 결국 꺾었다 3金 선대위 퍼즐 완성 다음 뉴스 HV0T8cruWp 정치력 캐비넷에 김종인 자식 관련 뭐 하나 있었나 라는 생각이 먼저 드네 
1959,윤석열 목포 폭탄주 오락가락 언론 대응에 선대위 혼선 까지 출처 미디어오늘 네이버 XcPBceNAYG
1987,국민의힘이 선대위 구성을 두고 한참 시끄럽더니 결국 간판만 바꿔달았습니다 오로지 복수의 신념으로만 정치하는 윤석열 후보에게 꼭 맞는 유행지난 맞춤복같습니다 과거로의 퇴행인가 미래로의 전진인가 윤석열 후보는 권력에 대한 탐욕을 정권심판으로 포장하며 과거에만 매몰되어 있습니다 n6IHEf78Ou
1990, 원톱 김종인 김병준 김한길과 3김 金 한묶음 에 격분 다음 뉴스 lIP24w3eUL 윤석열 이준석 김병준 인선만 처리 김종인 완전한 원톱 선대위 체제 원해 김종인 김병준과의 앙금도 여전
2004,윤석열 목포 폭탄주 오락가락 언론 대응에 선대위 혼선 까지 XTVsIFi0lU 안 마셨다 며 최초 해명 있었지만 거짓말 논란 휩싸여 안 마셨다 한 사람 누군가 라며 오히려 언론에 되묻기도 응 너네 대변인 
2009,윤석열 목포 폭탄주 오락가락 언론 대응에 선대위 혼선 까지 JhyuewQxJQ
2032,윤석열 후보 김종인 총괄선대위원장 선대위 합류 거부 다음 뉴스 RO1RwzqUE3 김종인 없이 김한길 김병준 위원장 양 날개 체제로
2058,뇌물전과자의 말로 참 꼬숩다 단독 윤석열 후보 김종인 총괄선대위원장 선대위 합류 거부 다음뉴스 RbesgHtCUk
2060,오 대박 행운의 여신이 안대표에게 단독 윤석열 후보 김종인 총괄선대위원장 선대위 합류 거부 c6z11xe9xf
2121, 팩트TV 출범도 전에 삐걱 국힘 선대위 윤석열 총괄선대위원장 김종인 빼고 최고위에 안건 올려 RISH6Q56ds
2163,윤석열 좀 하는데 전두환 국보위 때 데뷔해서 전노 시절 뇌물 2차례나 먹고도 지금까지 큰 기침하는 김종인 넝감만 제거해도 한국정치에 크게 기여한 거다 취재해보시라 윤석열 김종인 선대위 합류 늦어지는 이유 정확히 몰라 출처 머니S 네이버 뉴스 qdvPDWmP3n
2164, 추호할배가 밖에서 꼬장 부리면 더 무서울텐데 좋으나 싫으나 붙잡아 놓고 쥐어 패야지 밖에서 떠들어 대는 꼴을 보게 될게다 젊은꼰대 준석이는 추호할배도 없는 곳에서 찌그러져 있겠구먼 단독 윤석열 후보 김종인 총괄선대위원장 선대위 합류 거부 다음 뉴스 JtyhPyxSog
2169,이날 윤 후보 측 핵심 정무 관계자는 김종인 총괄선대위원장이 윤석열 후보에게 하루이틀 시간을 더 달라고한 것에 대해 윤 후보가 이를 거부하고 김한길 김병준 위원장 체제로 가기로 전격 결심했다 고 밝혔다 LA5uSxCsYk
2186, 단독 윤석열 후보 김종인 총괄선대위원장 선대위 합류 거부 url 7Xv6l0jqcc
2200,윤석열 3金 선대위에 홍준표 잡탕밥도 찾는 사람 있다 다음 뉴스 꿀꿀이 잡탕밥도 돼지에겐 만찬이 된다 4YvhjQAxaf
2204,김종인 거들먹 거리다가 팽 당했다 윤석열 김종인 총괄선대위원장 선대위 합류 거부 4MnsccRkZP
2207, 단독 윤석열 후보 김종인 총괄선대위원장 선대위 합류 거부 다음 뉴스 BcUGG1RulW 이 사진 석장을 보면서 국짐은 평탄할 거라 단정 짓는 사람은 극히 적을 것이다
2219,김종인 빠진 선대위 선임안 尹 시간 더 달라 하셨다 LzlhyQzOhW 윤석열 국민의힘 대선 후보가 미래비전을 발표하기 위해 연단에 섰으나 프롬프터가 작동되지 않아 2분 가까이 침묵하는 해프닝이 연출됐다 원문보기 2ykZoKOGaE
2239,윤석열 김종인 총괄선대위원장 선대위 합류 거부 다행이다 윤짜장 대신 유일하게 메시지 관리할 안물이었는데 이제 윤짜장은 거의 기우는게 보이네 MmElxWSmX7
2250,당장 내일이라도 병풍뒤에서 향냄새 맡으셔도 이상하지 않으신 분들이 대국민사기단 국민의힘 윤석열 가족사기단 짜왕 항문침 천승 고발사주 단독 윤석열 후보 김종인 총괄선대위원장 선대위 합류 거부 다음뉴스 CAYoncUsr7
2276, 단독 원톱 김종인 김병준 김한길과 3김 金 한묶음 에 격분 윤석열 이준석 김병준 인선만 처리 김종인 완전한 원톱 선대위 체제 원해 김종인 김병준과의 앙금도 여전 247gifFQpR
2281, 판이여 단독 윤석열 후보 김종인 총괄선대위원장 선대위 합류 거부 ePh3eBfCHG
2315,윤석열 81세 김종인 고집 결국 꺾었다 3金 선대위 퍼즐 완성 pEnLucfpjK
2317, 단독 윤석열 후보 김종인 총괄선대위원장 선대위 합류 거부 다음뉴스 GYIpjZ2nLR 추호 vs 쩍벌
2342,삼등분으로 나뉜 불편한 동행 윤석열 이준석 김종인 피 튀는 주도권 전쟁 내막 국민의힘 선대위 김종인 전 비대위원장 이준석 대표 yNYBtAG7xZ
2364,윤석열 amp quot 이준석 김병준 선대위원장 선임 김종인은 시간 더 필요 amp quot 브레이크뉴스 pAtmbNtyQo
2370, 단독 윤석열 후보 김종인 총괄선대위원장 선대위 합류 거부 윤석열 측 김종인이 왜 박근혜 문재인 전 대통령에게 팽 당했는지 이제야 이해가 된다 80JyeF1624
2375, 홍준표 3김 윤석열 후보 선대위 합류에 잡탕밥 홍 의원은 다만 윤석열 후보 관련 비판 발언은 자제해달라는 요청에는 알겠다 고 말했습니다 3김 정치 회귀한 잡탕밥 보다 이대녀 이대남 은 꿔준표 라고 비판받고 혼밥 즐기는 무야홍 을 더 좋아해 fXkp94ZSn5
2385, 단독 윤석열 후보 김종인 총괄선대위원장 선대위 합류 거부 다음 뉴스 Kwxb7loEZB 김이 아니라 윤이 거부한거네 
2401, 단독 윤석열 후보 김종인 총괄선대위원장 선대위 합류 거부 M8ytOCwF4U 김종인의 상왕 요구도 웃기지만 윤석열의 거부도 가관이네 팝콘각 
2413,풀릴 듯 풀리지 않는 윤석열 선대위 김종인 빠진 채 인선 시작 newsvop vWDvVcwbX8
2414, 단독 원톱 김종인 김병준 김한길과 3김 金 한묶음 에 격분 다음 뉴스 GzZjkm5Pdj 윤석열 이준석 김병준 인선만 처리 김종인 완전한 원톱 선대위 체제 원해 김종인 김병준과의 앙금도 여전 총괄 선대위원장은 좃선의 방가 아니냐 
2418, 단독 윤석열 후보 김종인 총괄선대위원장 선대위 합류 거부 윤석열이 뭘 안다고 거부씩이나 하느냐 권성동과 패거리들이 시키는대로 한거겠지 찌라시들 조작 윤석열 지지율에 들뜬 양아치들이 염불보단 잿밥에 미쳐 날뛴다 정말 가소로와 웃기지도 않는다 등신종자들 aJPjSrOysK
2423,노욕 배틀중 단독 윤석열 후보 김종인 총괄선대위원장 선대위 합류 거부 다음 뉴스 XTXOVO9j3z
2436,뇌물전과자 구태정치 왕똥파리주제에 상왕노릇하며 거드럼이나 피우는 뇌물종인은 백해무익하지 뉴시스Pic 윤석열 최고위원회의 주재 당 중심 국민 일하는 선대위 구성할 것 출처 뉴시스 네이버 뉴스 MMOKtO9yMk
2439,윤석열 후보 오늘부터 국힘당 전체 회의 주관하며 대권후보로서 당을 이끌어 가기 시작했는데 늦었으나 잘한 일이다 김한길 김병준 임명과 김종인 전 비대위장 선대위 임명 뜻대로구성한 것도 잘한 일이다 꼭두각시 대통령 후보 역을 하지 말아야 소통 중요한 비서실장도 장제원이 가장 적합하다
2480,김종인 윤석열 선대위 합류는 아직이다 윤석열 국민의힘 김병준 김종인 kXerE2Ltel 이경태 기자
