,tweet
13197,더디긴 합니다만 윤석열 선대위의 벽돌이 하나하나 쌓여가고 있는 것 같습니다 VZsvdlqaYP
13198,국민의힘에서는 윤석열 후보의 선대위 구성에 속도가 붙고 있습니다 3Pe6BPSa4U
13199, 더 워룸 김종인 쉽지 않은 윤석열 선대위 취업길 orko0IwwBS JHADFRqd0F
13204,윤석열 처가 양평 공흥지구 개발 특혜 의혹 정식 수사 당시 양평 군수는 국민의 당 김선교 의원 이었고 윤석열은 해당지역 관할여주지청장이었다고 한다 그런데 김선교의원이 윤석열 캠프 경기 선대위원장이라고 한다 
13213,김종인 이준석 동시 제동 윤석열 3金 영입 선대위 삐걱 TlXm4QuDRN 윤석열 선대위 출범 지연 왜 尹 조직표 들고 金 만났지만 金은 부인 불편한 속내 비쳐 3金 김종인ㆍ김병준ㆍ김한길 개인적 관계도 좋지 않아 李대표 金 이견 있어 만남 부인 3金 역할 겹치고 밸류도 차이 
13223,속보 윤석열 김종인에 최후통첩 선대위원장 교체 2021 11 18 o1JB8D6vav
13233, 더 워룸 김종인 쉽지 않은 윤석열 선대위 취업길 4PA4O4jBgs 출처 YouTube
13261,시사저널 윤석열 지지율 12월 되면 뒤집힐 수 있다 4개월이나 남았고 언제든 뒤집힐수 있는게 선거판입니다 지지자들은 긴장하되 포기해선 안되며 당에서는 선대위 제대로 꾸려서 대응해나가야 합니다 UYguGi9SL4
13287,특혜 의혹이 불거진 이유는 문제가 불거진 뒤 묘한 관계도 드러나는데 당시 양평군수는 현 김선교 국민의힘 의원 윤석열 후보는 당시 해당 지역 관할하는 여주지청장 김 의원은 지난 8월 최근 윤 후보 캠프에서 경기 선대위원장 
13351,민주당 선대위는 보고 있냐 민심을 완전히 깔아 뭉개고 조작된 여론조사로 세상을 속이고 있지만 헤벌레 미소만 짓는 송영길과 선대위 정말 한심하다 이낙연 눈치보는거냐 국힘 YTN 항의 방문에 민주당은 뭐하냐 부럽다 조선일보 윤석열 대통령 돼도 탄핵 재밌네 hD2EIhaPYk
13362,윤석열은 정치 초년생이 구태정치 왕똥파리를 상왕으로 모시려 하질 않나 시대 뒤떨어지게 구태정치 패거리들 쪽수로 경쟁을 하겠다고 하질 않나 쪽팔리는 줄 알라 안철수 국힘에 옛날처럼 매머드 선대위 통하는 시대 아냐 다음 뉴스 Wysp4wdTIE
13380, 단독 윤석열 수사 공수처 차장 이재명 선대위 의원과 접촉 논란 출처 조선일보 네이버 뉴스 mYi3sqMWV9
13403,김종인 이준석 동시 제동 윤석열 3金 영입 선대위 삐걱 다음 뉴스 qoMMzSe42t 김종인 전 국민의힘 비상대책위원장과 이준석 국민의힘 대표가 동시에 제동을 걸었습니다 이로 인해 윤석열 후보의 3김 영입 선대위가 삐걱거렸습니다
13416,이재명이라는 후보자체에 문제가 있는것 윤석열은 아직 선대위도 없고 홍준표 유승민 원희룡한테 도움도 못받고 있는데 지지율1위임 기획 위기 놓인 이재명 선대위 문제 맞나 TRPAd8AyZN
13535,안철수 윤석열 겨냥 매머드급 선대위 통하는 시대 아냐 url JTIhsQpD78
13543,김종인 이준석 동시 제동 윤석열 3金 영입 선대위 삐걱 다음 뉴스 dCroE32bwl
13553,오늘 이재명 후보님 야구 보러 가셨네 김혜경 여사님과 나란히 윤석열이랑 심하게 비교 된다 시구도 하셨나 보던데 시구 잡은 선대위 누군지 모르지만 잘했쓰 
13606,전북일보 정윤성의 기린대로418 김종인 원톱 선대위 구성 윤석열을 위한 비단주머니는 국민의힘 윤석열 대선 선대위 인선 막판 진통 국민통합위 중진 배치 주도권 기싸움 김한길 김병준 영입 이준석 김종인 반대 김종인 원톱 3김 쓰리톱 이준석 비단주머니 크라켄 ai윤석열 w5kGqvMROj
13637,썩을 녕감 고비고비마다 몽니를 부리네 뭐 그 때마다 윤석열이 어떻게 고비를 넘기능가 것도 관전 뽀인뜨 겄지만 말임 윤석열 선대위 인선 삐그덕 김종인 김한길 김병준 거부 다음뉴스 FT5MzAuDoB
13714,안철수 윤석열 선대위 구상에 매머드급 통하는 시대 아냐 tUwyguBoum 사이가 많이 좋은 철수랑 석열이 첤 좀 이상한 게 전국단위의 선거에 캠프가 매머드급이 아니면 그게 더 이상하지 않나 
13720,윤석열 측 선대위 김한길 합류 김한길 측 막판 고심 4jcIU7QSQj
13729,민주 윤석열 장모라서 양평 개발사업에 수상한 행운 당시 군수는 경기 선대위원장 MwSg28Vk6Y SndyhDiFm0
13791,윤석열 측 김한길 선대위 합류 수락 김종인과 담판만 남아 dywFt9L3n2 B20d0Xh7CE
13816, 불나방 집합소 안철수 윤석열 선대위 구상에 매머드급 통하는 시대 아냐 출처 SBS 네이버 뉴스 ySsNHBysCC
13908,윤석열 측 김한길 선대위 합류 수락 김종인과 담판만 남아 다음 뉴스 kPRSx7cFqS 처먹고 싸지르는거 말곤 그닥 할 줄 아는거 없는 철새 개종자들 잘 수거 했다 한군데 모아 놓는 순간 부터 오물통 냄새가 진동할끼다 
13977,김한길이 윤석열 선대위에 합류한단다 뭐 놀랍지도 않다 이미 김대중 정부의 비서실장 출신이었던 한광옥이 박근혜 캠프의 국민대통합위원장을 맡았던 선례가 있지 않았던가 삐까번쩍 금박 입힌 명함이 제 이름값의 명예인 줄 아는 인간을 역사와 민중이 어떻게 기억하는지 부디 오래 사시라 
13991,김종인이 말 뿐인 총괄선대위원장으로 와도 별로 할 일이 없을 듯 윤석열 캠프는 김한길 김병준 투톱 체제로 갈 공산이 커 보임 
13993,김한길의 합류를 먼저 기정사실화 임태희 총괄선대본부장 안이 받아들여진다면 모를까 권성동이 사무총장 겸 총괄선대본부장 역할을 한다면 윤석열 측 김한길 선대위 합류 수락 김종인과 담판만 남아 출처 뉴시스 네이버 뉴스 B62H9l2Zx7
13999,진중권도 합류시켜라 윤석열 측 김한길 선대위 합류 수락 김종인과 담판만 남아 다음 뉴스 qqK6aDnZrF
14012,윤석열 측 김한길 선대위 합류 수락 김종인과 담판만 남아 ZaUeHAte3x
14026,윤석열 측 김한길 선대위 합류 수락 김종인과 담판만 남아 출처 뉴시스 Q7AwtzQkH1
14056,윤석열 36 vs 이재명 35 다자대결서 격차 1 p차로 좁혀져 3DWW1mrIYx 글쎄 여론조사 믿기도 힘든데 사실이면 선대위 구성에서 삐걱거리는 소리가 자주 들리기 때문일듯 우쨋든 국민의 미래를 힘들게 하는 사기꾼은 안된다 
14062,국짐당 윤석열 선대위 김종인 김한길 구시대 정치꾼들 옛날 회기하내 이럴때 이재명은 젊고 참신한 신진 인사들로 채워야 한다 민주당은 과거가 아니라 새로운미례로 나가야 하니까
14157,안철수 윤석열 겨냥 옛날처럼 매머드급 선대위 통하는 시대 아냐 출처 헤럴드경제 네이버 뉴스 uuzcp4YVNl
14169, 윤석열 김종인 선대위 김종인도 이준석도 반대하는 윤석열의 반문 모으기 rVm76sMtOG
14222,즉 비록 지적과 불만이 있고 언론이 아무리 포장해도 사실 이재명과 민주당 선대위가 국힘당 윤석열보다 휠씬 멀쩡한것 이제는 역동성과 명민함을 추가하면 금상첨화인것 
14224,윤석열 장모 재판의 판사가 나경원 남편인 김재호라면 나경원이 윤석열 캠프의 선대위로 가는건 명백한 이해충돌 방지법에 위배되는 예비 범법행위다 하는 짓거리 마다 더티한 음모와 꼼수가 숨어있는 윤석열은 대선후보 자격 1도 없다 
14250,지금 윤석열 선대위와 국힘당은 대세론에 취해서 공약은 중도 고려없이 Anything but Moon으로 막 던지는데 대응은 안일하고 윤석열 김종인 이준석은 서로 논공행상에 자리다툼하고 데려올 사람은 그저 김병준 김한길 나경원등 떨거지인데 그렇다고 계속 이재명을 마타도어해서 여유도 안 부림 
14263, 단독 국민의힘 선대위 빠르면 주말 발표 김종인 없이 갈 수도 url JVpUNKW2Wx
14276,윤석열 선대위 인선 삐그덕 김종인 김한길 김병준 거부 김한길은 안철수와 함께 호남과 민주당을 실컷 이용해 처먹고 오히려 민주당을 망치고 나서 버람받은 정치 쓰레기 입니다 확장성은 커녕 오히려 분탕질만 하는 인간들이지요 제발 김한길도 빨리 데리고 가길 바란다 
14390,윤석열과 일당들이 국짐당 선대위라고 짠 인물을 보면 나는 덕수 일당이 바로 떠오른다 서로 끌어 당기는 나쁜놈들 인력의 법칙이겠지 4qVRg4bybW
14402,이준석 선대위 구성 이견 없다 는데 윤석열 김종인은 삐걱 IV5KN676eq
14455,윤석열이 김종인 김한길 나경원 등 쓰레기들을 불러 모을 때 참신하고 젊은 인재들과 전문가들을 선대위에 전면배치하고 이재명후보는 메타버스로 민심의 한가운데로 뛰어들면 금방 지지율을 역전시킬 수 있고 승기를 잡아나갈 수 있다 져서는 안되는 선거다 모두 힘을 모아야 한다
14477, 국민의힘이 반듯이 과거로 회귀할 때 민주당은 담대히 미래로 가겠습니다 김종인 전 비대위원장이 국민의힘의 선대위 원톱으로 합류한다고 합니다 이준석 대표와 윤석열 후보 간 힘겨루기의 결과물이 김종인 전 위원장이라는 것에 실소를 금하지 않을 수 없습니다 WlqBtKOoJN
14547,김병준이 윤석열 선대위원회 가는 이유는 김건희 juli yuji 인연이 박사땄다는 그 물박사대학 출신의 정치인이거든 국민대 건 어떻게든 막아내야하거든 아킬레스 건으로 작용할 게 빤하거든 김병준 국민대 홍성걸 이런애들 다 국민대 교수들이니 뭐 정치권에서 다들 한자리씩 하는 놈들
14569,속보 윤석열 김종인에 최후통첩 선대위원장 교체 2021 11 18 3DI0B0tze7 via YouTube
14621,고영신TV 윤석열 권성동 사무총장 임명 선대위는 내주 중 인선 발표 고영신TV 이재명의 언론탓 지지율 격차가 언론의 기울어진 운동장 때문 소가 웃을 소리 출연 이종근 전데일리안편집 PxmhaPxXlX
14627,고영신TV 속보 윤석열 사무총장 권성동 의원 내정 김종인과 17일 선대위 인선 협의 출연 김정기 동국대 석좌교수 전 상하이 총영사 wa7ebCOLle
14635, newsvop 국민의 힘이 2021년 11월부터 2022년 3월 9일까지 윤석열의 선대위 활동을 전혀 구성과 지원을 하지 못하게 해주세요
14780,윤석열 김종인 김한길 영입 놓고 갈등 선대위 발표 내주 연기 동아닷컴 Gkb3yD99Eg 우당 아니라 민주당과 배신의 아이콘들 집합소 
14794,김종인 압박하는 윤석열 측 언론 플레이 단독 국민의힘 선대위 빠르면 주말 발표 김종인 없이 갈 수도 E0WiPVVHAF
14805, 윤석열 선대위 막판까지 삐걱 이준석 반문 집합소 안 돼 newsvop GvliAyyW7L
14852,출범 전부터 삐걱 윤석열 김종인 선대위 구성부터 당대표 패싱 논란까지 국민의힘 이준석 대표 인터뷰 eIL9pmXlzy 출처 YouTube
14853, 도이치모터스 주가조작 연루 의혹 김건희 거래내역 전체 공개하면 깔끔 홍사훈 여 흔들리는 원팀 선대위 야 선대위 구성 밀당 우원식 홍문표 김어준의 뉴스공장 lGuOrVk2r7 윤석열 최은순 본부장 범죄가족 국민의힘 국민의짐 빨리 구속수사해
14940, 정문일침 83 윤석열 선대위 올드보이들의 귀환 hIpBIo1NO6 via YouTube
14955, 현장연결 윤석열 선대위 구성 원만하게 진행 곧 발표 출처 연합뉴스TV 네이버 뉴스 70LeH2STE1
14970,국힘은 경선 상대였던 홍준표가 양아치 대선 으로 규정하고 아직 선대위도 못 꾸렸는데 윤석열의 지지율이 고공 행진하는 이유는 이재명 효과 외엔 없지 원팀 아니라 우주를 통합해도 패륜범으론 대선 이미 끝났어 
14981,윤석열 만났다 VS 김종인 만난 적 없다 선대위 이견 공개 노출 8JuOZSs4Gl
15025,연두의 오늘그림 윤석열이 나경원에게 공동선대위원장을 제안했대요 이 두 사람의 지난 발언들만 보면 우리나라 대선인지 일본 대선인지 모르겠어요 21 11 18 8CAaZCzpT5
15045,댓글이 가관이구만 조국 문제 정리도 못하는 넘들이 한마디 던져주니까 따라서 떵떵거리네 어랍쇼 조국 무죄 또 외치는 놈들이 있음 윤석열 총괄선대위원장에 조국일세 7xqATLDdk0
15065,이준석 선대위 조직 틀 바뀔 수 있다 윤석열 구조 관련 김종인 조언 받아들일 의향 있어 vxy8fETj8k
15086, nocutnews 김한길이 2021년 11월부터 2022년 3월9일까지 쭈욱 윤석열 국민의 힘 선대위를 전혀 하지 못하게 해주세요
15087,김종인 지난 총선때 구김당 선대위원장으로 나와서 민주당한테 180석 상납하고 역대급 패배했는데 김옹이 윤석열 선대위에 들어와도 하나도 도움이 안된다 구김당 주변에 얼씬거리지 말고 남은 여생은 공기좋은 시골 용양원에나 가서 조용히 지내시길 
15120, 윤석열 후보가 이재명 후보를 두 자릿수 지지율 차이로 따돌리면서 위기감이 고조되는 때에 김한길 전 대표의 국민의힘 합류 소식이 전해지자 선대위 내부에서는 적잖게 당혹스러워 했다는 것 W6kwagFA4G
15145, actormoon jk_space 홍준표와 이준열과 김종인과 유승민과 김무성이 모두 2021년 11월 1일부터 2022년 3월 9일까지 쭈욱 윤석열 국민의 힘 선대위활동을 전혀 하지 못하게 해주세요
15160, 지금 이럴 때가 아니잖나 지금 윤석열 뿐만 아니라 치열하게 붙고 있는 쟁점에 대해 붙어줘야 하는데 제가 보기엔 아무도 안하고 있고 이재명 후보 혼자 하고 있다 경선 초기에도 그렇고 선대위 꾸려지고 나서도 계속되고 있다 고 질타했다 7WnKYwbsVA
15200,떨거지 철새들을 다 데려다 쓰는군요 저사람이 여권인사 안철수랑 합작해서 공격하고 정치생명이 다한 퇴물을 데려고 간다고 누가 그를 지지할까요 국민을 바보로 아는건지 권영세 김한길 윤석열 선대위 합류 가능성 尹과 교류 다음뉴스 3dfC4PVfHE
15201,변화가 절박한 시점입니다 열린민주당이 악역을 맡겠습니다 선대위에 활력을 불어넣고 생기를 되찾는데 기꺼이 메기 가 되겠습니다 열린민주당은 작은 정당이지만 윤석열 국민의힘 후보에 맞서 누구보다 가열차게 싸워왔다고 자부합니다 거짓과 배신 그리고 부패로 얼룩진 후보만은 막아야 합니다
15205,돌아온 나경원 윤석열 공동선대위원장 맡는다 다음 뉴스 2TV83Z6kdX 나베망쪼
15215,그러니까 낮은 지지율에 대한 답이 gt 특검받겠다 대장동은 윤석열 탓이다 gt 민주당 열민당 통합 gt 추캠프 이캠에 합류 인데 그 와중에 이탄희가 선대위원장을 반납함 
15223, Jaemyung_Lee 11월 17일 수요일 전북 군산에 가신 이낙연 선대위 상임고문입니다 앞에서는 원팀 뒤로는 후보교체를 외치니 이재명 후보 지지율이 오를리가 있겠습니까 전국을 돌면서 똥파리에서 도깨비라고 이름 바꾼 윤석열 찍는다는 애들 만나서 챙기고 계시니 참으로 속터집니다 baHP779oAA
15224,1 경선 당시의 이재명캠프보다도 현저히 떨어지는 선대위의 전투력과 능력 2 전력질주해도 이길지 말지 모르는데 달릴 생각이 없어보이는 의지 3 혹시나 법적 재제로 바뀌지 않을까하는 헛된 기대 이따위 모습을 보여주는데 윤석열이 싫어서 관심을 가지기 시작한 외부에서 보기에 뭐로 보이겠나 
15242,문틀란 TV 윤석열 김종인의 막판 몽니 일언지하에 제압 윤석열 의중대로 선대위 구성 PEmH3E5iTS
15243, TheMinjoo_Kr 11월 17일 전북 군산에 가신 이낙연 선대위 상임고문이 이러고 있는거 민주당은 아냐 모르냐 전국을 돌면서 똥파리에서 도깨비라고 이름 바꾼 윤석열 찍는다는 애들 만나서 챙기고 자빠졌네 윤석열이 대통령 되면 문재인 대통령 감방보내는게 공략 1순위인데 민주당 너희 무사할것같아 정신차려라 nEqRHumYCr
15282,윤석열의 선대위 구성은 이념적 일관성이 결여되었고 탄핵 진실을 결코 막겠다는 의지가 역력하다 공범들로 측근을 채우고 탄핵진실을 봉쇄하고 있다 어부지리로 탈색된 보수당의 옷을 입고선 마음이 놓이지 않아 당 자체를 바꾸려는 노력이 보인다 그의 보수우파로의 정치적 외침이 기대된다 PTKB5FF0lW
15289,이 여자를 윤석열 캠프의 비상임 선대위원장으로 강력 추천합니다 입만 열면 윤후보의 지지도가 올라 갑니다 연일 尹 때리기 몰두 추미애 제가 다 화병이 나려고 합니다 출처 세계일보 네이버 뉴스 t8RXxAc9CE
15358,윤석열이 뇌물종인의 꼭두각시같은 병신짓 빨리 버리고 당장 김종인 이준석 이 두 민주당 세작부터 정리하지 않으면 결국은 대선 폭망할 것 국민들도 세번째 재앙메이커는 용납하지 않는다 이준석 선대위 틀과 사람 바뀐다 김종인 자신 들이박은 김병준 거부 뉴스1 YhmhqqQtgr
15389,쫄보 준돌이 녀석은 굴어들어온 진짜 비단주머니를 걷어차네 원희룡이 종로에서 당선되면 바로 차차기 보수의 강력한 대선주자로 부상할 것 좋은 선택이다 단독 원희룡 종로 출마로 굳혔다 윤석열 선대위 합류 후 보선 출마 fznDsUmXwy 뉴데일리
15402,윤석열 나경원에 공동선대위원장 제안 MSO23lHKoG
15413,이재명이랑 윤석열이랑 원팀인데 윤석열 선대위가 싹다 쿨MB
15415,윤석열 오늘 권성동 당 사무총장 인선 선대위 구성 막바지 절충 친MB 선대위 XuwHF5XcdH
15603, 만났다 는 윤석열 아니라 는 김종인 선대위 인선 삐걱 2S6cwtPEAQ
15604,윤석열 김종인 김한길 영입 놓고 갈등 선대위 발표 내주 연기 다음뉴스 fvrpViCrPL 김한길 흘러간 인물 대려다 뭐에 쓰려고 
15613,윤석열은 2030을 위해서라도 홍준표를 선대위로 자리를 마련함이 좋겠다 그리고 단순히 어떤 정당을 지지하는것 만으로도 당원이 되는 민주적인 당원제도로 개정 합시다 
15627,국짐당 선대위구성 진통은 어쩌면 안철수대표 때문인지도 모른다 80세 노욕 김종인과 애늙은이 나이만 청년 이준석은 오직 앉덜수이름 석자 지우기에 올인중이고 후보자 윤석열은 어떻게든 안철수와 연대내지 동행을 꿈꾸고 있다 당사자와 제3자의 시각이 다르다는 것 그래서 이들은 혈투중이다
15644,오영환은 지역구 일 열심히 하는데 대선 일 안 한다고 욕먹고 있더라 김광진은 선대위 들어가서 윤석열은 안된다며 이제이재명 외치고 있더라 
15664, 만났다 는 윤석열 아니라 는 김종인 선대위 인선 삐걱 尹 통합 약자 청년 상징 기구 구성 金 기구에 몇 사람 넣어서 통합되나 fG2pMtTP5E
15677,윤석열 선대위 인선 삐그덕 김종인 김한길 김병준 거부 출처 한겨레 네이버 김종인이 얼굴마담 하기 싫으면 나가라고 하니 그냥 있는 중인데 뭐 거부 한겨레 니들 소설 잘 쓴다 하기사 답답해 미치겠지 꿀빨다 그지로는 다시 못가겠지 qeYCmu4DEl
15714, jnjfilm 윤석열이 나베에게 선대위원장을 제안했다 아베와 일본을 위해 앞장서던 매국노 이완용 같은 토착왜구와 친일파들이 왜국을 위해 다시 뭉친다 우리도 똘똘 뭉쳐 혈혈단신으로 왜적을 물리친 이순신 장군과 일본총독 이등박문을 쓰러뜨린 안중근 의사의 정신으로 토착왜구 친일파를 완전히 뿌리뽑자
15725, 뉴있저 민주당 선대위 쇄신론 부상 윤석열 원팀 난제 YTN VMT2ir1K4X 출처 YouTube
15740,윤석열에 대해서는 한 마디도 못하는 웃기는 정치 자영업자 맨날 퇴장이래 양정철 선대위 등판설에 선 긋고 대선 후 정치에서 퇴장 ElpgRhgrNK
15752,오죽하면망국당의홍준표씨가윤석열이대통령되는순간부터나라불행이라고했겠습니까민주당정말정신차리고선대위재정비하고이해찬유시민씨투입하고열린우리당합당해서세를불려야지 윤가와조중동은한팀으로움직이는데도대체뭘믿고사보타지하냐대선에지더라도의원은영원하다고믿는거야 이려다다죽게생겼다 
15780, 뉴스하이킥 최지은 윤석열 기본주택 정책 똑같이 베껴가 김재섭 이재명 기본주택 정책 폰지사기 다단계와 유사 lt 최지은 민주당 선대위 대변인 gt 수시 폐지로 입시 문제가 해결되지 않아 lt 김재섭 국민의힘 전 비대위원 gt 정시 비율 높일 필요가 있어 yKYHyWoWs8
15811,김종인 늙은 늑대를 처리해야 압승한다 윤석열 선대위 인선 삐그덕 김종인 김한길 김병준 거부 다음 뉴스 lHl8B8KSZA
15825, 단독 원희룡 종로 출마로 굳혔다 윤석열 선대위 합류 후 보선 출마 E9hfSvVdhD 뉴데일리
15844,윤석열 김종인 김한길 연쇄회동 선거대책위원회 국민통합위원회 양날개 로 꾸려질 전망 국민의힘 대선 후보의 진용 선거대책위원회 국민통합위원회 양날개 로 선대위 국민통합위 인선 신경전도 김병준과 내주 중반 1차 선대위 인선 발표 nFOZpfnx8j
15857,받은 게 있는데 내칠 순 없겠지 뜨거운 감자 들고 열심히 하셔 결국 손만 데이고 헛짓 한 거니까 국민을 개돼지 취급한 댓가는 나중에 따로 치루고 윤석열 김종인 회동했지만 핵심 관계자 선대위 인선 이견 커 ZeYLhjW7At
15879, 만났다 는 윤석열 아니라 는 김종인 선대위 인선 삐걱 국힘당은 이제부터 시작이야 갈데없는 애들 연대라서 할배가 당깨기 해줄껴 굿이나 보고 팝콘이나 우걱우걱 CshN2MBICG
15884,국민의힘 선대위에 김병준 합류 윤석열 김한길 비공개 회동 반노반문짓 하는 새끼들은 싹다 국힘당으로 간다니까 그게 미래야 왜냐면 갈데가 없으니까 기본통진당은 안받아줄거야 Pay6o6x0Wa
15898,민주당과 선대위는 진작 처음부터 대장동으로 파고들어야 했었다 그렇게 안해 국짐당에 오히려 역공 필 빌미 제공 그 결과 대다수 국민들에게 이재명후보 대장동 수사검찰이 봐준다는 의혹 오해 사 최근 이재명 답보 지지율과 윤석열 반사이익 지지율로 반영되게 만들었다 
15906, 아이고 총괄이니 상임이니 전권이니 의미도 없는 자리다툼에 연연하는 국힘이 과연 잘 할수 있을까 윤석열 김종인 김한길 영입 놓고 갈등 선대위 발표 내주 연기 출처 동아일보 네이버 뉴스 q2OsYNJRE8
15921,윤석열 선대위 인선 삐그덕 김종인 김한길 김병준 거부 정치 네이트 뉴스 2d3q0pMrmb
15927,RT ohmynews_korea 윤석열 이준석 회동 불발 윤 김종인과 직거래 윤석열 이준석 김종인 국민의힘 선대위 곽우신 기자 D2rwjLd8v4
15928,RT ohmynews_korea 윤석열 이준석 회동 불발 윤 김종인과 직거래 윤석열 이준석 김종인 국민의힘 선대위 곽우신 기자 s0uFvykRUe
15938, 이재명 선대위 쇄신론 분출 윤석열 반문 통합 선대위 진통 0XoJZDbdh0
15942, nocutnews 김종인과 홍준표와 이준석과 김무성과 유승민이 모두 2021년 11월 1일부터 2022년3월 9일까지 쭈욱 윤석열의 선대위로 전혀 활동하지 못하게 해주세요
15949,윤석열이 나경원에게 공동선대위원장을 제안했대요 이 두 사람의 지난 발언들만 보면 우리나라 대선인지 일본 대선인지 모르겠어요 COqAKpVRqS
15950,김한길 영입도 급물살 국민의힘 대선 선대위 최종 인선 9회말 담판 윤석열이 어느새 퇴물 구태 적폐 감별사가 되었네요 분리수거는 잘 합니다 Ug1sAskhK1
15955,아이들은 가라 RT ohmynews_korea 윤석열 이준석 회동 불발 윤 김종인과 직거래 윤석열 이준석 김종인 국민의힘 선대위 곽우신 기자 az8vxjk29w
15960,11 17일 이재명 후보는 선대위가 본격적으로 움직이고 개인이 언론이 되자고 한 후 부터 점차 안정세를 찾아 긍정어 개수와 전체 언급량에서 윤석열보다 약간 우세한 상황이다 그렇지만 박빙인 상황인 건 분명하다 이제부터가 진짜다 우리가 긍정어를 계속만들고 언론이 되어야 이긴다 pTFEiro3FZ
15965,윤석열 후보 김종인 김한길 연쇄회동 선대위 국민통합위 인선 신경전 M22mwKvuFo
15978,김종인은 윤석열 당선에 큰 관심이 없다 김종인은 그냥 최고 권력 대열에 편승하고 싶을 뿐이다 그리고 김종인이 무슨 선거 도사라도 되냐 작년 총선때 김종인이 설쳤지만 최악의 참패를 당한거 잊었냐 사공만 바글대는 선대위는 패배의 지름길이다 윤석열 거품이 꺼져간다 jpSEdFPiTH
15994, 김종인 내용이 없다 안본 걸로 하겠다 윤석열 선대위 인선안 엎었다 VwA0D5ZSqv
