,tweet
20112,윤석열 국민의힘 대선후보는 외부일정 없이 여의도 당사로 출근해 선대위 인선안 마련에 집중했습니다 0udkli1042
20126,돌아온 나경원 윤석열 공동선대위원장 맡는다 다음 뉴스 1wN9XOPgEY 대장동에 땅을 잔뜩 사놓은 나경원씨 퇴직금은 땅으로 받은건가 곽상도는 50억이던데
20173,이재명 지지율 정체때문에 선대위가 돋보이지 않는다고 카톨릭대 장성철이 윤석열 뛰우기 이재명 까는것도 아주교활해
20245,윤석열 원팀 선대위 속도 내나 초재선의원과 오찬 opSiGtj3lJ
20246, TheMinjoo_Kr 수사는 수사고 민주당선대위가 존재합니까 뮛들하는데 지지율이 그모양되도록 낮잠잡니까 당대표 원대표등 지도부도 없는것같고 선대위엔 숫자만 많으면 제절로 선거운동되는겁니까 윤석열피의자가 댓통되도록 방관하는겁니까 못봐주겠네요
20249,돌아온 나경원 윤석열 공동선대위원장 맡는다 다음 뉴스 tI13yDjreg 나베가 돌아왔다 민주당 호재다 
20252,고무된 윤석열 공격적 인선 출처 서울신문 원희룡 나경원까지 모으면 선대위 구성은 성공적이라는 느낌 gdbuQCm0Yq
20253, Cold_Archer 나경원 환영한다 선대위원장 하면서 윤석열 지지율 많이 깎아줄 것으로 기대한다 
20259,윤석열은 차곡차곡 선대위 구성해 가는데 이재명은 끊임없는 구설수에 휘말리고 있네 뭐가 문제인지 민주당은 근본적으로 재고를 해야 한다 
20266,윤석열 나경원에 공동선대위원장 제안 羅 직책 상관없이 역할 다음뉴스 XzfgNXDEgi
20290, 단독 윤석열 김영희 전 MBC 부사장 선대위 영입 추진 이 자도 윤석열에게 줄 서서 향후 의원 한자리 하고 싶은 모양이지 UZg1wcnB0J
20358,선대위 출발은 서두르는 이준석과 느긋한 윤석열 윤석열 선대위 국민의힘 이준석 김종인 yKf9l1JaB7 곽우신 기자
20411,버러지 같은 놈 시민 세금으로 호의호식하면서 편리 봐 줬으니 도움을 달라 힘 합칠 때 윤석열 나경원에 공동선대위원장 제안 다음 뉴스 co3DXbhfwB
20428, 단독 윤석열 나경원에 공동선대위원장 제안 다음뉴스 qewFQO3AIP
20441,윤석열이 눈 감아주고 김재호가 무죄 때려주고 나경원이 선대위원장해주고 이런 가족같은 사람들을 봤나 KIfrBgiwPf
20452,나경원 윤석열 선대위원장 한일전 완성 9Q53GeCRwq
20461, 단독 윤석열 나경원에 공동선대위원장 제안 ThWaLM0lf5 윤짜장과 나씨도 공동운명체일껄 아마 서로간 최대의 위기에 봉착하니 합세하는거 같네
20501,전략도 소통도 사람도 없다 갈길 먼 이재명 3無 선대위 尹과 지지율 격차 갈수록 커져 이재명 위기 터져나온 與 더 벌어진 지지율 李측 당혹감 속 정책토론 승부 윤석열 52 7 vs 이재명 34 8 양자대결 격차 17 9 p
20509,전북일보 정윤성의 기린대로418 이용호 찬밥 취급에 복당 철회 국힘으로 입당 존재감 높이기 무소속 이용호 의원 남원임실순창 민주당 복당 철회 원점 재검토 찬밥 취급에 국민의힘 입당 향후 행보 모든 가능성 이재명 연락 윤석열 조찬 선대위 합류제안 v6WnbFDPcm
20541, 제발 좀 수락해라 단독 윤석열 나경원에 공동선대위원장 제안 다음 뉴스 MARKDefZ1d
20581,윤석열 선대위 얘기 다 거짓말 권성동 확정이면 발표했을 것 다음뉴스 8OeDTzvO6p
20594,윤석열 나경원에 공동선대위원장 제안 출처 경향신문 네이버 뉴스 ygdF2ONS5y
20600, 송국건의 혼술 김종인 총괄선대위원장 원점으로 당 장악 직접 나선 윤석열 QAZTXHLcxY 출처 YouTube
20639, 윤석열 김종인 선대위 윤석열 공개 러브콜에 김종인 아직 아무것도 몰라 MNrjMyYI03
20644,윤석열씨 김정인 선대위원장 권한주었을때 앞으로발생할사태들 장점 단점 그분태생적 성품 지나온 경력등 심시숙고 깊이성찰판단 결정해야 머리물든놈 치고 언제나 틈을주면 미음대로할라지 그는이나라근세정치판 권모술수가 자칭 정치용병가 언제나 깊이통찰 능수능난 변화자신있어야 진주월아산
20649,나경원에게 선대위원장직을 제의 윤석열은 진정한 돌대가리인가 가뜩이나 너도 비호감인데 거기에 나경원까지 이재명과 함께 비호감 경연대회 하냐 
20659,윤석열 나경원에 공동선대위원장 제안 189조원의 혈세를 탕진착복한 이명박 선거당시 많은 투자자들에게 피눈물을 흘리게 만든 BBK 소유주 이명박의 옵셔널벤처스 주가 조작 사건에 주어는 없다는 망언을 하고 황교안과 함께 문재인 정부를 줄곧 방해한 나경원의 기용은 비판받아 마땅하다 
20673,윤퇘지가 나베년 자식들 특권에 무죄를 준것은 윤퇘지 나베년의 비리커넥션이 있기 때문이다 윤석열 나경원에 공동선대위원장 제안 羅 직책 상관없이 역할 다음뉴스 Az4dMNduAV
20680, 단독 윤석열 나경원에 공동선대위원장 제안 다음 뉴스 fn0UJS1Fjn 국민 밉상을 위원장으로 주대하면 윤석열 표에 많은 도움 주겠지 
20693,윤석열 나경원에 공동선대위원장 제안 羅 직책 상관없이 역할 Zv19uAbzVd 국짐당 나베 페스트트랙 깡패질 재판은 하고 있는거야 뭐야 남편 찬스 중이야 
20702,윤석열 나경원에 공동선대위원장 제안 羅 직책 상관없이 역할 gt 1 1 1
20704,윤석열 나경원에 공동선대위원장 제안 羅 역할 할 것 나경원남편 김재호판사가 윤석열 절친 윤석열 검찰은 나경원을 통으로 불기소했고 김재호는 장모 재판을 연기해 줬다 법조계가 카르텔로 엮여 있다는 건 이제 초등학생들도 다 아는 사실 특권 계층의 권력 남용의 끝 판왕들 
20707,윤석열 나경원에 공동선대위원장 제안 羅 직책 상관없이 역할 다음뉴스 N4c0uMX2bB 국썅년 등판이라 볼만하겠네 국썅년 NO 2는 홍준표 밀다가 나가 떨어졌는데 관전의 재미는 있겠네 두둥 도둑의힘당 화이링 
20708,2022 대선은 한일전 윤석열 나경원에 공동선대위원장 제안 羅 직책 상관없이 역할 다음뉴스 H7oDIOGnVr
20718,윤석열 나경원에 공동선대위원장 제안 정치 네이트 뉴스 EUDFur4ouO
20736,kbs에서 힘들게 개그프로하나 런칭했는데 이렇게 개그맨들 앞길을 막아서야 단독 윤석열 나경원에 공동선대위원장 제안 다음 뉴스 VGNFLM19MV
20745,윤석열 원희룡 나경원 잇따라 만나 나경원에 공동선대위원장 제안 i4oVpnhk1S
20759,국민의힘 윤석열 대선후보에게 물었습니다 선대위 구성 원칙과 철학이 무엇인가요 돌아온 대답은 윤석열 국민의힘_선대위 선대위_구성 선대위구성_철학 QBi0oymofF
20769,윤석열 나경원에 공동선대위원장 제안 니들 비리공동체 불기소해주고 무죄때려주고 놀구있다
20783,윤석열 대선 후보가 나경원 전 의원에게 공동선대위원장직을 제안한 것으로 확인 나경원 전 의원은 윤 후보와 회동한 뒤 기자들에게 대한민국의 미래를 생각하는 국민의힘 당원이라면 누구나 힘을 합칠 때 라고 나경원 드디어 등장 
20784, lt 대변인들 gt 대선필승 최강대변인들이 뜬다 도이치모터스 주가조작 후보자부인 사진 블랙언론 상위 2 종부세를 깎자고 윤석열선대위와 이준석 바로 오늘 11 16화요일 저녁8시 lt 시사타파TV gt 김현정 남영희 이경 정은혜대변인들 꼭 함께 해주세요 
20792,윤석열 선대위 얘기 다 거짓말 권성동 확정이면 발표했을 것 YD5MwlBAFT 검찰당끼리 잘하고 있네 꼬꾸라 질거야 
20797, 단독 윤석열 나경원에 공동선대위원장 제안 다음 뉴스 LTLboJRZim 나베 출동 자위대 만세 
20811, 파안대소 박장대소 유유상종 단독 윤석열 나경원에 공동선대위원장 제안 다음 뉴스 JgWlLROGqN
20821, 단독 윤석열 나경원에 공동선대위원장 제안 다음 뉴스 LKh4uCT3Dn 풉 
20827,내 그럴줄 알았다 윤석열 나경원 나경원남편 김재호판사가 윤석열 장모 정대택 사건판사 지들끼리 짬짜미로 다해처먹죠 윤석열 나경원에 공동선대위원장 제안 羅 역할 할 것 yaowFmzZhs
20834,이재명 예결소위 의원들과 오찬 윤석열 선대위 구상 다음 뉴스 8Ev8RfFFwY
20838, 단독 윤석열 나경원에 공동선대위원장 제안 다음 뉴스 2xHIzuYISS 확실한 친일당 되는군 나베 빠루들고 설치는거 생각나네
20840,이재명 혼자 뛰었고 모든 언론은 이재명을 공격했지만 여론조사는 늘 이재명이 압도적이었음 그대로 결과로 이어졌고 언론도 그때와는 다른 게 그냥 이재명 공격만했지 윤석열처럼 지나치게 남경필을 빨아주지 않았음 지금이라도 선대위 규성 다시 해야하고 당과 이재명한테 요구해야함
20862, 연합단독 윤석열 나경원에 공동선대위원장 제안 다함께 차차차 선대위로 가즈아 irHXLrobZX
20890,개 새 끼 그래서 권씨와 나씨 기소를 면죄해 주었나 단독 윤석열 나경원에 공동선대위원장 제안 다음 뉴스 ZNbz0Q9w7s
20898,지기네 단독 윤석열 나경원에 공동선대위원장 제안 다음 뉴스 HHbZi6ZHa7
20902,윤석열 나경원에 공동선대위원장 제안 0P0QVpnc5D 무능에 무지한 저열하고 추악한 자가 이런 용도로 써먹기 위해 개법부 사찰 그 자료를 이용 친일유전자를 가진 범죄 사실들 덮어주고 면죄부 주었구나 인간의 저열한 이중성을 가진 친일무리들 모조리 이번 기회에 처참하게 살처분해야
20903,여당의 프리미엄을 1도 이용하지 못하고 식물이 된 민주당 선대위의 무능한 닭짓은 무늬만 원팀인 수박들 때문인것 같다 선거무패 이해찬에게 수석 선대위장 맡겨야 김종인이 등판하는 국민의적 윤석열 때려 잡는다 
20919,선대위 물밑 조율 이어간 윤석열 원희룡 나경원 이어 초재선과 연쇄 회동 newsvop ja33xu2LnI
20929,난 윤석열 선대위에 관심이 없는 게 국힘 캐릭터를 잘 모르기도 하고 무조건 이겨 닥치고 이겨 밖에 요구하는 게 없어서 
20942,윤석열 나경원에 공동선대위원장 제안 B80afYIOfQ 점점 친일을 굳히는군
20954,윤석열 나경원에 공동선대위원장 제안 LPb7gtRK7X 
20957,국민의힘 윤석열 대선 후보가 나경원 전 의원에게 공동선대위원장직을 제안했다는 보도가 16일 나왔다 이날 연합뉴스TV는 윤 후보가 서울 여의도 당사에서 나경원 전 의원과 만나 이같이 제안한 것으로 확인됐다고 보도했다 내년대선은 한일전이군 헌데 우리쪽후보가 믿음직하지를못해 
20961,구속될까봐 방어막 치는군료 단독 윤석열 나경원에 공동선대위원장 제안 다음 뉴스 DeZM9pEpEb
20968,윤석열 나경원에 공동선대위원장 제안 47vQfFictK 국민의힘 윤석열 대선 후보는 16일 4선을 지낸 나경원 전 의원에게 선대위 공동선대위원장을 맡아달라고 제안했습니다 
20969,윤석열 선대위 구성 앞두고 당 소속 의원들과 오찬 a7snVotZT8 이런 모습이 있는 사람이 지도자가 되어야한다는거 트럼프가 다 좋은데 음주 안하는거 너무 독한거 아닌가 자기를 버릴줄도 알아야지 아무리 건강이좋다지만 주변사람과 어울릴수있는 사람이 지도자가 되어야 함 
20974,물이 새다보면 둑이 터지겠지 윤석열 선대위 얘기 다 거짓말 권성동 확정이면 발표했을 것 0tWHnEIn3u
20987, 단독 윤석열 나경원에 공동선대위원장 제안 다음뉴스 6yFXZ8iHee 국민 썅년 돌아오는구만
20989,종인 앙숙 윤의 깐부 김병준도 선대위 합류 역시 윤석열답다 5xtsqo2JK0
20993,전형적 간보다 걸렸을 때 태도 윤석열 나경원 무죄만들어줄께 선대위줄게 국민의힘 천황께말잘해주세요 윤석열 선대위 얘기 다 거짓말 권성동 확정이면 발표했을 것 다음 뉴스 HCdJffV2Lo
20998,윤석열 원희룡 나경원 잇따라 만나 내일 선대위 발표는 아냐 종합 dexEOxrXFc 윤석열 만난 나경원 더 좋은 대한민국 위해 어떤 역할이든 쭌스톤 신변확보 시급 전자벌찌 채워 보호필요 한강 100 m 이내 접근금지 시켜야 
21012, QuoVadisKorea 단독 윤석열 나경원에 공동선대위원장 제안 vX2c3LrGhc 신의한수 나경원이 선대위원장하면 이재명 문재인때려잡기 적임자
21014, 단독 윤석열 나경원에 공동선대위원장 제안 한마디로 토왜 드림팀 전두환 정치 드림팀 hiYgZbxnf0
21020,밥먹은 전두환이 이명박근혜가 되어 싸놓은 윤석열이라는 똥에 끓는 똥파리떼 사드는 누구꺼 국민의힘 윤석열 선대위 얘기 다 거짓말 권성동 확정이면 발표했을 것 다음뉴스 0NTlphQnEB
21040,두둥 개봉박두 국쌍 나베와 항문침 윤두환 개가 똥을 끊어 단독 윤석열 나경원에 공동선대위원장 제안 다음뉴스 fKU8kfD524
21047, 단독 윤석열 나경원에 공동선대위원장 제안 다음뉴스 t3ogJ4N9Eo 이번 대선을 확실한 한일전으로 만들겠다는 구상이구나 그렇게 해주마 100년전에는 막지 못했지만 내년은 꼭 막아낸다
21055,근데 저 오른손 형체를 어디선가 본 것 같아서 뭐지 했는데 기억났다 삶은 돼지족발 윤석열 선대위 얘기 다 거짓말 권성동 확정이면 발표했을 것 다음뉴스 OajdqYFzcu
21066,윤석열 선대위 얘기 다 거짓말 권성동 확정이면 발표했을 것 NOnNloR3RP
21090,선대위 있는 당의 지지율은 어떻한 가요 급할 것 없고요 비토 세력들이 지지 않 하여도 윤석열님 지지율이 계속 40 대 일 것입니다 KM3W8dcSFE
21113,친일인사들의 귀환인가 단독 윤석열 나경원에 공동선대위원장 제안 yfSYDln0tL
21118,김종인 컴백 초읽기 기본소득 인적쇄신 등 비단주머니 주목 emByqXYKPf 김종인 전 국민의힘 비상대책위원장이 윤석열 대선 후보 선대위의 총괄선대위원장을 맡는 것이 유력시되면서 김 전 위원장 원톱 체제 가동이 초읽기에 들어갔다 김종인
21124,지지율 경고등에 전략 부재 선대위 쇄신론까지 위기의 이재명 5kN9txxdYC 이재명 더불어민주당 대선 후보와 윤석열 국민의힘 대선 후보의 지지율 격차가 벌어지면서 민주당 내 위기감이 고조되고 있다 이재명
21135, 단독 윤석열 나경원에 공동선대위원장 제안 mgEAnXxcv6
21147,윤석열캠프 이름을 쓰레기 매립장 이라고 지어라 단독 윤석열 나경원에 공동선대위원장 제안 다음 뉴스 8ZlSCn3Cdy
21150,야 사진만 봐도 방역수칙위반이네 기자까지 치면 한방에 몇이여 뉴시스Pic 윤석열 선대위 구성 앞두고 당 소속 의원들과 오찬 다음뉴스 Bc0j62oVqg
21189,나경원이 윤석렬이 총장 일때 혜택 많이 봤으니 보답해야지 단독 윤석열 나경원에 공동선대위원장 제안 다음 뉴스 h1YPTEu4p5
21195,나이스 좋네 단독 윤석열 나경원에 공동선대위원장 제안 출처 연합뉴스TV 네이버 뉴스 VN7OSArMYN
21199, 단독 윤석열 나경원에 공동선대위원장 제안 wr4Pqj42SW
21200,윤석열 나경원에 공동선대위원장 제안 ipIKf25cLW
21201,이런 상황에서 과거 안철수 대표를 향해 정치적 비판이 아니라 정신이 이상한 사람 이란 식으로 인격 모독성 발언을 서슴지 않고 가했던 그것도 지속적으로 밝혔던 김종인 이사장이 윤석열 후보의 총괄선대위원장 이 된다면 소위 야권 단일화 는 난망이라고 할 수 있다 
21202, 단독 윤석열 나경원에 공동선대위원장 제안 9Y3K2K0nEm 이미 커뮤들 반응이 뜨거움 대강 아 빠루 다시 돌아온다 정도
21205,김종인이 윤석열의 선대위원장이 된다면 야권단일화도 어렵게 될 수밖에 없다 비록 한 자릿수 지지율을 기록하는 안철수지만 그와의 단일화 없이는 정권 교체 를 낙관하기 어렵다 정확하게 얘기하면 안 대표와 단일화를 이루지 못한다면 대선 승리 는 사실상 물 건너 가게 되는 꼴과 같다 
21208,비호감 출두요 단독 윤석열 나경원에 공동선대위원장 제안 출처 연합뉴스TV 네이버 뉴스 P1NfAutgx5
21215,윤석열이 김종인을 선대위원장으로 영입하는 것은 본선 경쟁 구도에서 불리한 지형을 스스로 만드는 것과같다 윤석열은 경선 과정에서 홍준표에게 민심 에서는 뒤졌다 윤후보가 홍 의원을 소위 원팀 으로 끌어안지 않으면 그가 희망하는 대선 승리 정권 교체 에는 빨간 불 이 켜질 수밖에 없다
21220,윤석열씨 나경원을 선대위원장으로 그런데 나경원 자녀 대입 부정입학 문제 부터 일가족 학교재단 탈세 문제 남편 수사 개입 문제 비리 범죄 혐의가 많은 사람아닌가요 거기에 윤석열이 검총장 중앙지검장 시절 수사 대상이었던 사람인데 이거 참 
21224, 지금 이럴 때가 아니잖나 지금 윤석열 뿐만 아니라 치열하게 붙고 있는 쟁점에 대해 붙어줘야 하는데 제가 보기엔 아무도 안하고 있고 이재명 후보 혼자 하고 있다 며 경선 초기에도 그렇고 선대위 꾸려지고 나서도 계속되고 있다 고 질타했다 7WnKYwbsVA
21230,또한 김종인 이사장의 과거를 돌이켜 볼 때 그는 윤석열 후보가 자신의 의견을 수용하지 않을 경우 선대위원장직 사임 을 외치면서 칩거 할 가능성이 크다 한창 본선 경쟁이 가열되는 상황에서 김종인 사임 은 악재일 수밖에 없다 
21250,만일 김종인이 윤석열측의 선대위원장으로 활동하게 된다면 향후 이재명을 향해 집중적으로 추궁해야할 대장동의혹을 공격할 명분이 약화될 수도 있다 그런 상황에서 윤석열 후보가 뇌물전과자를 영입해 상왕노릇을 하게 만든다면 이는 이재명의 반격을 자초하는 악수 가 될 수밖에 없다
21265, 유투버는 다 찌라시들 윤석열 선대위 얘기 다 거짓말 권성동 확정이면 발표했을 것 출처 뉴시스 네이버 뉴스 nGBobRhYkj
21275,현재 공정 정의 를 부르짖고 문재인 정권의 위선 을 비판하는 윤석열 후보가 이런 전력을 가진 이에게 전권 을 행사하는 총괄선대위원장 사실상의 상왕직 을 맡긴다는 것은 그 스스로 자신의 존재 이유 출마 명분 대선 도전의 정당성을 훼손하는 자해 라고 할 수 있다 
21351,윤석열 원희룡 나경원 잇따라 만나 내일 선대위 발표는 아냐 종합 출처 뉴시스 네이버 뉴스 yFyOpFdlJd
21385,국민의힘 사무총장 인선 등 선대위 구성 윤석열 뜻대로 nLgNh2AfU9
21413,윤석열 선대위 구성 고심 원희룡 나경원 잇따라 만나 5CboctW3SY
21419,윤석열이 직접 밝힌 인터뷰 17일 1차 인선발표 늦지는 않겠지만 내일 발표는 아니다 선대위 인선은 원만하게 진행중이고 추가로 들어야 할 의견도 있으니 차분히 순서대로 하겠다 선대위는 많은분들이 함께 할것이다 cfKTCKJwzQ
21447,김종인 악연 이준석 패싱 홍준표 원팀 윤석열 선대위 3대 난제 다음뉴스 K4NxD12deI 이해가 안가네 김종인을 왜 자꾸끌어들여 현재상태로 유지만 제대로 해도 선거 이긴다 김종인 옆에 서있는 금태섭 와 정말 어처구니가 없는 일이네 저새끼들이 뭘 할수있다고
21523,빠르면 내일 발표되는 국힘 선대위 이게 핵심임다 종인은 예우 병준은 종인독주 예방과 상당 권한 부여 왜냐구요 윤석열이 김병준을 더 신뢰하니까요 윤도 사람보는눈 우리랑 별반 다르지 않슴다 wrXFBdLgWi
21592,이건 좀 답답하군 김종인만 아니면 안이나 홍과의 관계도 캠프 중진들과의 불협화음도 걱정할 필요가 없는데 지지율 50 짜리 대세후보가 왜 분란거리를 끌어 들이려 하는지 득보다 실이 클텐데 김종인 악연 이준석 패싱 홍준표 원팀 윤석열 선대위 3대 난제 7wQqAvXzE2
21662, lbr72332966 만약 윤석열이 뇌물종인을 선대위원장 상왕으로 모시면 안철수는 윤석열은 무시하고 뇌물종인과 맞다이까면 됨 구도는 과학기술강국 G5 설계자와 구태정치 왕똥파리 뇌물전과자와의 1 1 대결구도 
21664,윤석열 이준석과 갈등 없다 김종인 원톱 선대위 내일 출범할듯 출처 문화일보 네이버 뉴스 68tbU0mp2q
21707,이재명 예결소위 의원들과 오찬 윤석열 선대위 구상 30uRoB1WxB 충분히_준비된_이재명 지금_공부하는_윤석열 국가운영_누가_든든하고_누가_불안한가 새로운_대한민국 이재명은_합니다 가자_선플_달러 지지자는_합니다
21756,이재명 청년 표심 잡기 주력 윤석열 선대위 김병준 적합하다 인선 두고 진통 BzOcswbtdj
21762,이재명 청년 기후활동가 만나 2030 겨냥 지지율 답보 선대위 쇄신 필요 질타도 받아 윤석열 친일파들 만나는 나경원 권성동과 회동 의원들과 오찬 총괄선대위원장 김종인 유력 공식 제안은 아직 9uvwoHJCTD
21782,이재명 청년 기후활동가 만나 2030 겨냥 지지율 답보 선대위 쇄신 필요 질타도 받아 윤석열 나경원 권성동과 회동 의원들과 오찬 총괄선대위원장 김종인 유력 공식 제안은 아직 iQ9D9ZEQPy
21796, muncan76 원희룡은 이때 등장합니다 1 윤석열이 선대위 직책 임명시 2 종로 보궐선거 후보 당내 경선시
21905,이재명 청년 표심 잡기 주력 윤석열 선대위 인선 두고 진통 MZYbs5DLNy
21952,윤석열 의도대로 당과 선대위 재편 명실상부한 윤석열의 당 윤석열을 위한 선대위 체제 IUl3E2eldt
21972, 윤석열 캠프 실세는 장제원 실무 조율한다 fjNurzhzI6 이데일리 권혜미 기자 윤석열 국민의힘 대선후보의 선대위 구성을 앞두고 잡음이 발생하고 있는 가운데 장성철 정치평론가가 윤석열 후보 캠프의 실세는 장제원 의원 이라고 주장했다 
21999,아무리 열린공감TV가 특종을 통해 윤석열 후보의 각종 의혹을 진실을 토대로 보도해도 민주당도 언론도 침묵합니다 민주당 선대위의 신속하고 기민한 행동이 필요합니다 
22018,윤석열은 저 둘을 쳐내는게 유리할지 불리할지만 판단해도 될 듯 이준석 김종인 선대위 가장 높은 곳 모실 것 권위 상당하신 분 출처 머니투데이 네이버 뉴스 C18z3SzMxi
22043,김종인 원톱 의지 이준석 자기 목소리 재보선 지선 공천과 연관 윤 후보 측 강경책이냐 타협책이냐 고심 윤석열 대선후보 국민의힘 김종인 이준석 권성동 선대위 BlC8YU00ap
22162,국민의힘 새 사무총장에 권성동 내정 선대위 갈등 봉합되나 출처 TV조선 네이버 새누리당 보수와 박근혜정권을 말아먹은 새끼들이 뭉쳤군 국민의힘의 진짜보수는 누구냐 A753km41aP
22241, nocutnews 이준석과 홍준표와 김종인과 김무성이 2021년 11월 1일부터 2022년 3월9일까지 쭈욱 윤석열 국민의 힘 선대위활동을 전혀 하지 못하게 해주세요
22367,윤석열 김종인 이준석 만남에도 선대위 구성 막판 진통 p2hfq3oLzY
22391,윤석열 후보 선대위 총괄선대위원장이 유력한 김종인 전 위원장과 윤 캠프 외교 책사인 김성한 전 외교차관이 외교정책 토론회에 나란히 참석해 미중갈등에 대처하는 한국 외교전략을 얘기했습니다 0RYIKPHELL
22433,이재명 2030 중도층 공략 속도전 amp 윤석열 선대위 권한 분산으로 윤곽 우상호 김어준의 뉴스공장 4us4mGvVhu YouTube
22462,김종인 전 위원장 출판기념회에 참석한 이준석 대표는 윤 후보와 한 마디도 하지 않았고 윤 후보 쪽으로는 시선조차 두지 않았다 윤석열 이준석 김종인 선대위 2022대선 아이엠피터뉴스 jVmL4kvziU
22466,표면적으로는 갈등이 봉합된 모양새인데 이 대표는 주변에서 엉뚱한 방향으로 몰고 가지 않았으면 한다 며 윤 후보 측 인사들에 대한 불만을 숨기지 않았습니다 윤석열 이준석 선대위 HgP6n7WMOc
22538, 뇌물의힘 아빠의힘 부적의힘 연합이냐 野 선대위 구성 막판 진통 빅딜 하는 윤석열 이준석 김종인 출처 뉴스1 네이버 뉴스 Ht42ZTZQ8H
22604, JTBC_news 윤석열 선대위와 대선캠프가 2021년 11월 1일부터 2022년 3월 9일까지 쭈욱 전혀 활동하지 못하게 해주시고 전격해체되게 해주세요
22606, JTBC_news 김종인과 홍준표와 이준석과 김무성이 모두 2021년 11월1일부터 2022년 3월9일까지 쭈욱 윤석열 국민의 힘 선대위 활동을 전혀 하지 못하게 해주세요
22610, nocutnews 윤석열의 대선캠프와 선대위가 2021년 11월부터 2022년 3월9일까지 쭈욱 전혀 활동하지 못하게 해주세요
